video_id,title,publishedAt,channelId,channelTitle,categoryId,trending_date,tags,view_count,likes,dislikes,comment_count,thumbnail_link,comments_disabled,ratings_disabled,description,duration
"rS7eIthfn2Q","SONO ANDATA DALL' ESTETISTA DI CHIARA FERRAGNI A FARE LE UNGHIE...HO SPESO €70,00 E...","2020-09-17T12:00:31Z","UCC_K-QAGsezuQahPFUMaEvA","Chiara Facchetti","22","20.18.09","sono andata nel centro estetico|chiara facchetti|meno votato|cinese|chiara ferragni|peggiore|only 1 star|costoso|costosissimo|unghie|decorazione|tendenza|fedez|2020|recensione on the road|newchic|shein|newchic amazon|newchic woman|newchic opinioni|newchic donna|tally w|tally weijl|aliexpress|aliex ru|lightinthebox|alìexpress|alibaba|alí baba|alli ekspres|aliexpresscom|aliex|newchic reggiseno|newchic brands|newchic uomo|new chic borse|newchic official","87731","6307","259","419","https://i.ytimg.com/vi/rS7eIthfn2Q/default.jpg","False","False","Video precedente - HO ASSUNTO UNA CONSULENTE D'IMMAGINE PER FARE IL TEST DELL' ARMOCROMIA 🌈 CHE STAGIONE SONO ??https://youtu.be/KRcj7Ma7lWIBusiness Inquiries: ciafac@yahoo.itLa mia pagina facebook mettete mi piace vi aspetto:http://www.facebook.com/kiascricciolaLink per seguirmi su INSTAGRAM:http://instagram.com/kiascricc/Seguimi anche su TWITTER:https://twitter.com/KiaScricc","PT14M31S"
"z61LnFvljY4","CUCINA ESTREMA - 2KG DI SALMONE IN MEZZO AD UNA FORESTA IN SVEZIA","2020-09-15T11:30:10Z","UC8iDKxXT8Ep1owsiYSucgWA","Giovanni Fois","24","20.18.09","cuciniamo 2kg salmone in mezzo alla foresta|2kg salmone|cuciniamo|cuciniamo salmone|cucina|giovanni fois|fois|giovanni|fois cucina|fois tour|tour europa|milano capo nord|fois capo nord|fois food|Lorenzo lari|notte in tenda|cucina estrema|cucina estrema foresta|tenda|campeggio|tesla|tesla model s|esperienza|esperienza unica|viaggio|svezia|Svezia food|cucina in svezia","314098","41405","299","674","https://i.ytimg.com/vi/z61LnFvljY4/default.jpg","False","False","SCONTI bulk powders  :  http://tidd.ly/68a25c0dProdotti preferiti:  NUOVI gusti BARRETTE PROTEICHE  : https://tidd.ly/32Qccdfburro di pistacchi : https://tidd.ly/32MirQKbiscotto proteico :  http://tidd.ly/8de99a63brownie proteico: https://tidd.ly/2ZNjK03Lorenzo lari : https://www.youtube.com/channel/UCq1dmdCir1EWdSiHFWaYddgInstagram : https://www.instagram.com/giovanni_fois/?hl=itTIKTOK : http://vm.tiktok.com/auvMr4/Sony Alpha 7 iii : https://amzn.to/2PfdiIBObiettivi che uso :Sony 20mm f1.8 : https://amzn.to/34nmDHAtamron 28.75 f2.8 : https://amzn.to/33LUiXqTamron 17-28 f2.8 : https://amzn.to/2rft7ahSony Rx100 M5 : https://amzn.to/2SIjpGvMicrofono rode : https://amzn.to/2Zstbywmicrofono sony gun shot:  https://amzn.to/34UlXXI√vOggi io e Lorenzo lari abbiamo raggiunto la Svezia per dormire in tenda vicino alla nostra tesla model s, durante l'Europa tour da milano a capo nord, abbiamo cucinato del salmone in mezzo alla foresta, esperienza unica.  cuciniamo 2 kg di salmone (wow)","PT15M3S"
"aUcvtQQA90c","Il PSG vince a tempo scaduto, la decide Draxler: PSG-Metz 1-0 | Ligue 1 | DAZN Highlights","2020-09-16T21:51:26Z","UC7N8IuYFhU8Hs1ruCTsXTbg","DAZN Italia","17","20.18.09","Sport|DAZN Italy YouTube|Italian|draxler|psg|metz|ligue1|ligue 1|highlights ligue 1|highlights psg|icardi|mbappe|gol psg|psg metz|psg 1-0 metz|ligue 1 psg|neymar|paris saint germain|Psg highlights|julian draxler|Keylor navas|Paris|Metz|Metz HL","107668","4973","63","174","https://i.ytimg.com/vi/aUcvtQQA90c/default.jpg","False","False","Un gol di Draxler decide la sfida tra PSG e Metz. I parigini riescono ad avere la meglio in inferiorità numerica grazie a un gol del tedesco in pieno recupero.Segui la Ligue1 Uber Eats su DAZN: http://bit.ly/DAZN_Ligue1","PT4M52S"
"8WBfyjt7rP8","Highlights: Liverpool 4-3 Leeds Utd | Salah hits a hat-trick on the opening day","2020-09-12T21:00:00Z","UC9LQwHZoucFT94I2h6JOcjw","Liverpool FC","17","20.18.09","Liverpool FC|LFC|Liverpool|Anfield|Melwood|Liverpool Football Club|premier league","3192332","50060","2598","3689","https://i.ytimg.com/vi/8WBfyjt7rP8/default.jpg","False","False","Watch key highlights from Liverpool's opening day victory over Leeds United, as a Virgil van Dijk header, and three goals from Mo Salah gave Jürgen Klopp's side all three points as they kicked off the defence of their Premier League crown.Enjoy more content and get exclusive perks in our Liverpool FC Members Area, click here to find out more: https://www.youtube.com/LiverpoolFC/joinSubscribe now to Liverpool FC on YouTube now and get notified when new videos land: https://www.youtube.com/subscription_center?add_user=LiverpoolFC","PT1M31S"
"2pK702LRkjo","La MALEDIZIONE della maglia NUMERO 9 del MILAN","2020-09-11T11:45:00Z","UCpFkvd8zEgyCOoeHev18Djw","Gianluca Fraula","17","20.18.09","milan|ac milan|numero 9 milan|maledizione numero 9 milan|inzaghi milan|inzaghi|inzaghi maledizione 9|ibrahimovic|ibra numero|calcio|serie a tim|seriea|calciatori|higuain|numeri 9 milan|van basten|maledizione casacca numero 9|maledizione maglia numero 9|maledizione 9 milan|la maledizione della 9 del milan|la maledizione di inzaghi|maledizioni nel calcio|incantesimo calcio|milanisti|rossoneri|ultimo gol inzaghi|numeri maledetti calcio|maglie maledette calcio","206936","16462","118","893","https://i.ytimg.com/vi/2pK702LRkjo/default.jpg","False","False","⚫ Iscriviti per partecipare alla discussione⚫ http://www.youtube.com/channel/UCpFkvd8zEgyCOoeHev18Djw?sub_confirmation=1🔴 Instagram 🔴https://www.instagram.com/gianluca.fraula/🎤 PODCAST SPOTIFY : https://open.spotify.com/show/23kGqlSgzjmKdyVnDzNPeVITUNES : https://podcasts.apple.com/us/podcast/il-calcio-che-conta/id1497895407?ign-mpt=uo%3D4GOOGLE PODCAST: https://podcasts.google.com/?feed=aHR0cHM6Ly9hbmNob3IuZm0vcy8xMzc0ODQxYy9wb2RjYXN0L3Jzcw%3D%3DCon l' aiuto di Giovanni Guido https://it.linkedin.com/in/giovanni-guido-165581b1#milan #numero9 #inzaghi #ibrahimovic #rossoneri #seriea #calcio #acmilan🔴 LA MALEDIZIONE DEL NUMERO 9 🔴“Mettere la maglia numero 9 del Milan è dura per tutti, ma la maledizione non esiste. Se la mettesse Ibrahimovic finirebbe immediatamente” (Filippo Inzaghi)31 agosto 2020. Nel giorno in cui, solitamente, si suona il gong alle trattative di mercato, questa strana stagione calcistica ci ha regalato invece uno dei suoi primi veri “colpi”. Zlatan Ibrahimovic, 38 anni con il fisico e la voglia di un ragazzino, ha rinnovato il suo contratto con il Milan. Guadagnerà 7 milioni netti per il prossimo anno. Su di lui, soprattutto su di lui, contano i tifosi rossoneri per ricominciare a vincere dopo quasi un decennio pieno di delusioni e avaro di successi. E mentre Stefano Pioli si frega le mani per il rinnovo del suo leader e per l’acquisto in dirittura d’arrivo del giovane Tonali dal Brescia, Zlatan rilascia poche ma precise parole alla stampa. “Al Milan mi sento come a casa, ecco perchè ho voluto restare”. La curiosità di molti, però, cade sulla scelta del numero di maglia. Nei mesi precedenti, per mancanza di alternative, gli era toccata la numero 21. Ma per la prossima annata si torna alle origini. “Il mio numero è l’11, non ho avuto dubbi sulla scelta”. Ma come? Anche uno come Zlatan, sicuro di sè al limite dell’arroganza, cosi’ deciso e spavaldo, si rifiuta di spezzare la mitica maledizione della numero 9 rossonera? Ebbene si’, anche se, e’ bene dirlo, lo svedese nei suoi anni a Milanello non l’aveva mai indossata. L’annata ’20/’21 poteva rappresentare la fine di una storia che mescola realta’ e leggenda metropolitana. E invece, a meno di ripensate dell’ultim’ora, bisognera’ aspettare altri dodici mesi per capire quando scrivere le ultime righe di questo strano racconto.","PT15M23S"
"jCOr6K88Rkc","TE AL LICEO VS TE DA BAMBINO || Diversi tipi di Persone e Situazioni in cui puoi immedesimarti!","2020-09-08T11:09:02Z","UC4C3XBEVcbyDOziQh7MHcKg","123 GO LIKE! Italian","24","20.18.09","fai da te|idee creative|idea creativa|scherzo|scherzi|divertimento|divertente|123GO!|123 go|123go|amici|amichevole|tutorial|123 GO! Like|123 GO! Like Italian|situazione|situazione divertente|situazione imbarazzante|ragazze vs ragazzi|io contro gli altri|io contro altre persone|ragazze in pubblico|in pubblico vs da solo|tu al liceo vs da bambino|scuola","1537687","21707","3293","1342","https://i.ytimg.com/vi/jCOr6K88Rkc/default.jpg","False","False","Ognuno di noi ha dei bei ricordi della propria gioventù, quando eravamo piccoli fino al liceo! Non importa se frequenti il liceo o se ancora usi i giocattoli, perché potrai sempre immedesimarti nei nostri sketch!Te al liceo vs te da bambino, ragazzi vs ragazze, te vs tua madre…oggi ti faremo vedere delle situazioni particolari che capitano a tutti!Iscriviti al 123 GO Like! ⭐ Italian ... e non dimenticare di fare clic sul campanello 🔔 per non perdere i nostri nuovi video!A presto!#123GoLike #videodivertente #123GOSegnalibri:00:00 Momenti divertenti di te al liceo vs te bambino 01:02 Situazioni imbarazzanti al liceo 02:08 Ragazze vs ragazzi le difficoltà05:49 Momenti che capitano tra la mamma e figli06:00 Io vs gli altri07:55 Ragazze in pubblico vs quando sono sole10:03 Papere divertenti Questo video è realizzato a scopo di intrattenimento; Non ne garantiamo la completezza e l'affidabilità. Qualsiasi azione venga intrapresa è a proprio rischio e pericolo e non saremo responsabili per danni o perdite. É responsabilità dello spettatore usare giudizio, cura e precauzioni se intende replicare.Il seguente video mostra l'attività di attori professionisti in un ambiente controllato- usate precauzioni e giudizio se intendete replicare.ISCRIVITI: http://bit.do/123-GO-Like-Italian--------------------------------------------------------Musica di Epidemic Sound: https://www.epidemicsound.com/Materiale di scorta: https://www.depositphotos.com https://www.shutterstock.com","PT10M53S"
"MVVmvHHlOZk","تفاصيل تقديم المشتبه به في قتل الطفل عدنان أمام محكمة الاستئناف بطنجة","2020-09-14T21:36:34Z","UClozwh5URilIQpDFeXch8qw","2MTV","24","20.18.09","samhini 1212|مسلسل سامحيني|2m|2mtv|tv2m|soread|soread maroc|maroc|morocco|2m replay|2m tv maroc live en direct|قناة دوزيم","572519","5466","529","0","https://i.ytimg.com/vi/MVVmvHHlOZk/default.jpg","False","False","http://www.2m.maSubscribe: http://goo.gl/JkTkvZLike on Facebook : http://goo.gl/q3aNs7Follow on Twitter : http://goo.gl/2a8ZnZFollow on Instagram : http://goo.gl/6j2mVv","PT2M29S"
"GLxd0kTXuZo","ECCO I NUOVI IPAD & APPLE WATCH - TUTTE LE NOVITÀ","2020-09-16T16:46:47Z","UCXDorkXBjDsh0wNethPe-zQ","Andrea Bentivegna - BlackGeek","28","20.18.09","Apple|iPad|iPad Air|Apple Watch|Series 6|Apple Keynote|iPhone 12|iPhone 12 Pro","109679","10302","122","637","https://i.ytimg.com/vi/GLxd0kTXuZo/default.jpg","False","False","Ecco i nuovi iPad Air, iPad 8th Gen, Apple Watch Series 6, Apple Watch SE & Apple Fitness+ presentati il 15 settembre da @Apple ISCRIVITI ➜ http://rdrct.cc/go/subscribeCosa uso per fare video ➜ http://rdrct.cc/go/amzn-attrezzaturaIL MIO LINK AMAZON (Acquistando da questo link, mi regalerete il 5% della spesa) ➜ http://rdrct.cc/go/amzn==================== SOCIALS ====================Telegram ➜ https://telegram.me/blackgeektutorialInstagram ➜ @blackgeektutoFacebook ➜ BlackGeekTutorialTwitter ➜ @blackgeektuto1Periscope ➜ @blackgeektuto","PT15M23S"
"n3A6Yjt81t4","Highlights | Liverpool 4-3 Leeds United | 2020/21 Premier League","2020-09-13T06:40:47Z","UCyQcJHDN4uYfPa1DHzKVSnw","Leeds United Official","17","20.18.09","Leeds United|LUFC|LUTV|marcelo bielsa|highlights|Liverpool|Premier League","576652","7579","231","991","https://i.ytimg.com/vi/n3A6Yjt81t4/default.jpg","False","False","Highlights of our 4-3 defeat to Liverpool in the 2020/21 Premier League. #LeedsUnited #LUFC #PremierLeagueGet exclusive Leeds United video content first - download the Official App: http://bit.ly/LUTVappIf you thought this video was 🔥 don't forget to subscribe and hit the like 👍 button! Also if you want to get a notification every time we post hit the bell 🛎 button in the top right corner. MOT. ALAW. ⚽️If you want to keep up with everything Leeds, go check out our other pages https://www.facebook.com/LeedsUnited/https://twitter.com/LUFChttps://www.instagram.com/leedsunited/?hl=enhttps://www.leedsunited.com","PT2M1S"
"dtVNBv9Tj0s","İyi Günde Kötü Günde 2. Bölüm 2. Fragman","2020-09-16T09:34:11Z","UCcxHJLb7yDoLTjSt0rktmbw","İyi Günde Kötü Günde","1","20.18.09","İyi Günde Kötü Günde|İyi Günde Kötü Günde Dizisi|Star TV|İyi Günde Kötü Günde 1. Bölüm|Elçin Sangu|Ozan Dolunay|Yasemin Allen|Yasemin Kay Allen|iyi gunde kotu gunde|في اليوم الجيد واليوم السييء|مسلسل في اليوم الجيد واليوم السييء|في السراء و الضراء‎|في السراء و الضراء|И в печали и в радости|Fe El Saraa We El Daraa|Sarp Leyla|Sarp Melisa|SarMel|SarLey|LeySar|MelSar|iyi günde kotü günde fragman|En las buenas y en las malas","872085","14709","330","696","https://i.ytimg.com/vi/dtVNBv9Tj0s/default.jpg","False","False","İyi Günde Kötü Günde bütün bölümleri startv.com.tr'de → https://www.startv.com.tr/dizi/iyi-gunde-kotu-gundeİyi Günde Kötü Günde'ye Abone Olmak İçin → https://bit.ly/igkg-dd-subBir yanda nikah masasında terk edildiği adamın düğününü organize etmek zorunda kalan Leyla, diğer yanda gitmesinin nedenini herkesten saklayan Sarp ve ikilinin ortasında her şeyden habersiz evlilik hayalleri kuran  Melisa… Kaderin cilvesi birbirlerine düğümlenen bu üç kişinin hayatı öylesine karışır ki çözebilene aşk olsun.Yapım: O3 MedyaYapımcı: Saner AyarSenaryo: Pelin Karamehmetoğlu, Aksel BonfilYönetmen: Metin BalekoğluOyuncu Listesi:Leyla: Elçin SanguSarp: Ozan DolunayMelisa: Yasemin AllenAslıhan: Şenay GürlerMeral: Derya AlaboraPerihan: Nergis KumbasarHalil: Hakan SalınmışArda: Ali YağcıBülent: Sinan AlbayrakYasemin: Hande YılmazSeda: Deniz IşınCan: Tugay Erdoğan#İyiGündeKötüGünde","PT1M4S"
"F3N1ZBBNpGQ","【脱口秀大会S3 ROCK&ROAST】完整版第9期：庞博哽咽发言，李诞落泪","2020-09-17T12:00:06Z","UCQatgKoA7lylp_UzvsLCgcw","腾讯视频","24","20.18.09","腾讯视频|tencent video|wetv|騰訊視頻|we tv|tencent|腾讯|腾讯视頻|李云迪|腾讯综艺|杨天真|sisters who make waves|rock&roast|tencentvideo|脱口秀大会|脱口秀大会ep01|乘风破浪的姐姐|罗永浩|脱口秀大会第一集|脱口秀大会s3|lidan|脱口秀大会 eng sub|脱口秀大会第三季|李诞|黄圣依|脫口秀大會","233124","1348","115","1928","https://i.ytimg.com/vi/F3N1ZBBNpGQ/default.jpg","False","False","《脱口秀大会》第三季定位为一档原创棚内喜剧脱口秀节目。脱口秀演员根据每期节目话题，以不同的视角切入，用专业的喜剧创作能力进行高质量的内容输出，满足观众的信息需求，同台较量，争夺年度“脱口秀大王”桂冠。▶7月23日首播，每周四晚8点更新一期▶主要嘉宾：郑爽、罗永浩、大张伟、李诞、杨天真☞立即观看全集☞https://bit.ly/32HApE9☞更多精彩片段☞https://bit.ly/3jT0Fl4🚀更多火爆综艺🚀♥《心动的信号S3》：https://bit.ly/3hcfHzG♥《德云斗笑社》：https://bit.ly/2EE1WMP♥《潮玩人类在哪里》：https://bit.ly/2XMrM7T♥《忘不了餐厅S2》：https://bit.ly/2Ob87cD♥《脱口秀大会S3》https://bit.ly/32HApE9♥《超新星运动会S3》：https://bit.ly/32kFMsC♥《Super R1SE·周年季》https://bit.ly/3jbfwaj♥《明日之子SUPERBAND》：https://bit.ly/2W2d6R8♥《认真的嘎嘎们》：https://bit.ly/2VJFmIg⚡️观看精彩剧集⚡️：♥《我，喜欢你》：https://bit.ly/33rJEXG♥《仲夏满天心》：https://bit.ly/2WLsz8L♥《少女大人》：https://bit.ly/3b1zala♥《女世子》：https://bit.ly/3kMeYIG♥《且听凤鸣》：https://bit.ly/3inDv4H♥《不说谎恋人》：https://bit.ly/2BpZ70l♥《时间倒数遇见你》：https://bit.ly/3db8H4d♥《凤归四时歌》：https://bit.ly/3hzOFUx♥《你是我的命中注定》：https://bit.ly/3cC6HSi♥《传闻中的陈芊芊》：https://bit.ly/36dqmWY♥《三生三世枕上书》：http://bit.ly/3amlwZb♥《陈情令》：http://bit.ly/2xr53kg♥《致我们暖暖的小时光》：http://bit.ly/tcshoulder♥《恶魔少爷别吻我S1》：http://bit.ly/tcdemon1♥《龙日一，你死定了S1》：http://bit.ly/tcdragon♥《狐狸的夏天S1》：http://bit.ly/tcfox1🔒马上订阅更多官方频道🔒☞ 腾讯视频: http://bit.ly/wetvnew☞ 腾讯视频热播综艺: https://bit.ly/wetvshow☞ 腾讯视频华语经典剧场: https://bit.ly/wetvdrama☞ 创造营 CHUANG2020: http://bit.ly/chuang2020☞ WeTV 台灣: http://bit.ly/wetvtw☞ WeTV Thailand: http://bit.ly/wetvthaisub☞ WeTV Indonesia: http://bit.ly/wetvinsub☞ WeTV Vietnam: http://bit.ly/wetvvisub☞ WeTV English: http://bit.ly/wetveng☞ WeTV Arabic: http://bit.ly/wetvarab☞ WeTV Spanish: http://bit.ly/wetvesp☞ WeTV Korea: http://bit.ly/wetvkr☞ WeTV Turkish: https://bit.ly/wetvtur☞ WeTV Russian: https://bit.ly/wetvrus#脱口秀大会第三季","PT3H12M11S"
"1spBDh-Fl1o","10 EURO CHALLENGE: MANGIARE IN DUE a PALERMO con 10 EURO!","2020-09-14T11:00:01Z","UCj_AV4r1UzhB4nDikOsbwYg","Junkfully","24","20.18.09","10 euro challenge|10 euro Junkfully|10 euro challenge Junkfully|mangiare a Palermo|Palermo|cibo Palermo|Palermo cibo|street food Palermo|Palermo street food|cosa mangiare a Palermo|pani ca meusa|pane ca meusa|panino con la milza|pane panelle|arancina|arancina Palermo|Palermo arancina|colazione Palermo|pranzo Palermo|iris fritta|dove mangiare a Palermo|mangiare economico Palermo|mangiare Palermo|Junkfully|Okiro|Doppiaddi","73645","6068","51","498","https://i.ytimg.com/vi/1spBDh-Fl1o/default.jpg","False","False","Torniamo con la 10 EURO CHALLENGE: quanto riusciamo a mangiare in due nelle città d'Italia? In questa ottava puntata: PALERMO!➡️ ABBONATI AL CANALE: https://www.youtube.com/channel/UCj_AV4r1UzhB4nDikOsbwYg/join👕 MERCH: https://teespring.com/stores/junkfully📷 INSTAGRAM: http://instagram.com/junkfully 🧢 OKIRO: http://instagram.com/okiro 🕶 DOPPIADDI: http://instagram.com/doppiaddi","PT15M46S"
"NZyQT9N_WOM","🍎 MUFFIN SOFFICI YOGURT E MELE 🍎 Ricetta Facile - Fatto in Casa da Benedetta","2020-09-16T11:16:32Z","UCIIe8pQHrmWSzs1i5o3r10w","Fatto in Casa da Benedetta","26","20.18.09","fatto in casa da benedetta|ricetta facile|benedetta|benedetta fatto in casa|fatto in casa per voi|benedetta rossi|ricetta muffin|muffin alle mele|muffin soffici|muffin di benedetta|muffin soffici yogurt e mele|muffin allo yogurt e mele|muffin|muffin fatto in casa da benedetta|ricetta muffin di benedetta|torta mele e yogurt|muffin allo yogurt|muffin sofficissimi allo yogurt|muffin sofficissimi senza burro|muffin senza burro|muffin alle mele e yogurt|muffins","205819","11969","108","433","https://i.ytimg.com/vi/NZyQT9N_WOM/default.jpg","False","False","Video in collaborazione con PANEANGELI ▶︎ https://www.paneangeli.it Shop on-line PANEANGELI ▶︎ https://shop.dolcidee.it■ 𝗩𝗮𝗶 𝗮𝗹 𝗕𝗹𝗼𝗴 ► https://www.fattoincasadabenedetta.it ■ 𝗡𝘂𝗼𝘃𝗼 𝗟𝗶𝗯𝗿𝗼 ▶︎ https://amzn.to/31zGYUN■ 𝗜𝘀𝗰𝗿𝗶𝘃𝗶𝘁𝗶 ► http://goo.gl/DMQc1Z ■ 𝗦𝗵𝗼𝗽 ▶︎ https://www.amazon.it/shop/fattoincasadabenedetta★ 𝗧𝘂𝘁𝘁𝗲 𝗹𝗲 𝗥𝗶𝗰𝗲𝘁𝘁𝗲 ► https://www.fattoincasadabenedetta.it/ricetteMUFFIN SOFFICI YOGURT E MELE  Oggi vi propongo i Muffin allo Yogurt e Mele, una ricetta facile da realizzare e che non richiede troppo tempo, quindi perfetta per quando siamo a casa e ci prende quella improvvisa voglia di dolce! Possiamo prepararli come dolcetto per il dopocena, ma sono perfetti anche a colazione o a merenda: intinti nel caffellatte o nel tè sono squisiti! Questi muffin sono davvero morbidi e profumatissimi grazie al Lievito PANE DEGLI ANGELI e alla presenza nell’impasto dello yogurt e dei pezzetti di mela, che li rendono anche umidi al punto giusto. La mia ricetta prevede la fialetta Aroma Vaniglia PANEANGELI nell’impasto, ma possiamo utilizzare anche la bacca di vaniglia oppure un cucchiaino di cannella, che possiamo anche mescolare allo Zucchero al Velo PANEANGELI per spolverare i nostri muffin una volta sfornati. Inoltre, per arricchire i nostri Muffin Yogurt e Mele, si può aggiungere all’impasto dell’uvetta (circa 30 gr) e renderli ancora più morbidi e gustosi!Preferite una Torta di Mele ? Vi basta raddoppiare le dosi di questa ricetta e usare uno stampo a cerniera da 24 cm di diametro, oppure uno stampo 30 x 10 per realizzare un fantastico plumcake …in questo caso i tempi di cottura saranno di 45 minuti circa!INGREDIENTI2 uova120 gr di zucchero40 gr di olio di semi di girasole50 gr di latte125 gr di Yogurt bianco1 Fialetta di Aroma Vaniglia PANEANGELI270 gr di farinamezza bustina di lievito PANEANGELI2 meleZucchero al velo PANEANGELIRICETTA STAMPABILE ► https://www.fattoincasadabenedetta.it___________________________𝗙𝗢𝗟𝗟𝗢𝗪 𝗠𝗘■ 𝗜𝗻𝘀𝘁𝗮𝗴𝗿𝗮𝗺 ► https://www.instagram.com/fattoincasadabenedetta■ 𝗙𝗮𝗰𝗲𝗯𝗼𝗼𝗸 ▶︎ https://www.facebook.com/fattoincasadabenedetta ■ 𝗣𝗶𝗻𝘁𝗲𝗿𝗲𝘀𝘁 ▶︎ https://www.pinterest.it/homemadebybenny  ■ 𝗬𝗼𝘂𝗧𝘂𝗯𝗲 ▶︎ https://www.youtube.com/user/benedetta1972     ■ 𝗧𝘄𝗶𝘁𝘁𝗲𝗿 ▶︎ https://twitter.com/homemadebybenny■ 𝗧𝗲𝗹𝗲𝗴𝗿𝗮𝗺 ▶︎ https://t.me/fattoincasadabenedetta■ 𝗦𝗶𝘁𝗼 𝗪𝗲𝗯 ▶︎ https://www.fattoincasadabenedetta.it■ 𝗡𝗲𝘄𝘀𝗹𝗲𝘁𝘁𝗲𝗿 ▶︎https://www.fattoincasadabenedetta.it/login___________________________𝗜 𝗠𝗜𝗘𝗜 𝗟𝗜𝗕𝗥𝗜✪ 𝗜𝗻 𝗖𝘂𝗰𝗶𝗻𝗮 𝗰𝗼𝗻 𝗩𝗼𝗶 ▶︎ https://amzn.to/31zGYUN✪ 𝗟𝗮 𝗖𝘂𝗰𝗶𝗻𝗮 𝗱𝗶 𝗖𝗮𝘀𝗮 𝗠𝗶𝗮 ► https://amzn.to/2yDuWNJ✪ 𝗙𝗮𝘁𝘁𝗼 𝗶𝗻 𝗖𝗮𝘀𝗮 𝗱𝗮 𝗕𝗲𝗻𝗲𝗱𝗲𝘁𝘁𝗮 𝟮 ▶︎ http://amzn.to/2lZ9tc5✪ 𝗙𝗮𝘁𝘁𝗼 𝗶𝗻 𝗖𝗮𝘀𝗮 𝗱𝗮 𝗕𝗲𝗻𝗲𝗱𝗲𝘁𝘁𝗮 𝟭 ► http://amzn.to/2m1J9hh✪ 𝗔𝗺𝗮𝘇𝗼𝗻 𝗦𝗵𝗼𝗽 ▶︎ https://www.amazon.it/shop/fattoincasadabenedetta___________________________■ 𝗧𝘂𝘁𝘁𝗶 𝗶 𝗩𝗶𝗱𝗲𝗼 ▶︎ https://www.youtube.com/user/benedetta1972/videos ■ 𝗧𝘂𝘁𝘁𝗲 𝗹𝗲 𝗣𝗹𝗮𝘆𝗹𝗶𝘀𝘁 ▶︎ https://www.youtube.com/user/benedetta1972/playlists■ 𝗜𝘀𝗰𝗿𝗶𝘃𝗶𝘁𝗶 𝗮𝗹 𝗖𝗮𝗻𝗮𝗹𝗲 ► http://goo.gl/DMQc1Z  ___________________________■ 𝗖𝗼𝗻𝘁𝗮𝘁𝘁𝗶✉️ Mail Benedetta: benedetta@fattoincasadabenedetta.it ✉️ Mail Marco: marco@fattoincasadabenedetta.it✉️ Mail Collaborazioni: business@fattoincasadabenedetta.it 👩🏽‍💻 lavora con noi ▶︎ https://www.fattoincasadabenedetta.it/job___________________________© MAUI MEDIA SRL https://www.fattoincasadabenedetta.it#muffin #yogurt #mele #ricetta #ricette #recipe #recipes #cooking #cucina #fattoincasadabenedetta","PT5M22S"
"Mm0NvlXdz4A","Apple Watch Series 6: Everything New! (Product RED)","2020-09-17T13:00:48Z","UCBJycsmduvYEL83R_U4JriQ","Marques Brownlee","28","20.18.09","Apple Watch|series 6|Apple Watch SE|Apple Watch series 6|Apple Watch 6|red Apple Watch|apple watch colors|product red|MKBHD|Apple Watch unboxing","2023976","99007","1805","6750","https://i.ytimg.com/vi/Mm0NvlXdz4A/default.jpg","False","False","A first look at Apple Watch Series 6 and Apple Watch SEMKBHD Merch: http://shop.MKBHD.comTech I'm using right now: https://www.amazon.com/shop/MKBHDIntro Track: http://youtube.com/20sylPlaylist of MKBHD Intro music: https://goo.gl/B3AWV5Watches provided by Apple for review.~http://twitter.com/MKBHDhttp://instagram.com/MKBHDhttp://facebook.com/MKBHD","PT8M9S"
"9h7Uy5glnBk","SALIAMO IN CIMA ALL' ETNA MA FINIAMO A DORMIRE PER STRADA! PECHINO EXTRASH #6","2020-09-15T09:00:03Z","UCHZl_sLl4kGZSkrPBrWb_aQ","Anima","24","20.18.09","anima|mates|anima mates|pechino extrash|ep 6|martex|stretto di messina|traghetto|messina|catania|etna|vulcano|scalare un vulcano|in cima al vulcano|sicilia|arancini di riso|vlog|viaggio|tour italia|25 euro budget|traghetto messina|mathame|etna techno|yakinop|scroccare|dormire in macchina|cena di pesce|da milano a palermo|tour italia scroccando|sascha burci|thatsanima|lookatsascha|non smettere mai di vivere|anima yt|non sono anima|sicilia estate","321430","32717","210","1004","https://i.ytimg.com/vi/9h7Uy5glnBk/default.jpg","False","False","Anima dei Mates e Yakinop sbarcano in Sicilia, salgono sull' Etna ma i soldi non bastano per dormire comodi! Per fortuna ci prestano una macchina!Canale Yakinop: https://bit.ly/3bGY2PCLa mia playlist SPOTIFY: https://spoti.fi/3foSTxbSHOP UFFICIALE MATES: https://www.matescollection.com/Supportami su FORTNITE con il codice: anima-ytLe Musiche che utilizzo: http://bit.ly/1OYt5laRegistro con Elgato HD 60: http://e.lga.to/animaCANALI PERSONALI:Yang Sascha: https://bit.ly/2yQTiaHYin Sascha: https://bit.ly/3eZb1gJSOCIAL:Instagram: lookatsaschaTik Tok: ThatsAnimaTwitter: Anima_YTFacebook: Sascha BurciSE VUOI SPEDIRMI QUALCOSA:Via privata Giovacchino Belli 14Webstarschannel - Mates MagazzinoMilano 20127 Italiasul pacco scrivere: Anima/Mates","PT16M45S"
