video_id,title,publishedAt,channelId,channelTitle,categoryId,trending_date,tags,view_count,likes,dislikes,comment_count,thumbnail_link,comments_disabled,ratings_disabled,description,duration
"uq0A0LBS5w8","STUDENTI RICCHI VS STUDENTI NORMALI || Rientro A Scuola Ricchi vs Poveri by 123 GO! SCHOOL","2020-09-17T07:00:07Z","UCKtMLmINLbhzSB3HJI8M_jg","123 GO! SCHOOL Italian","24","20.18.09","go|123go|123go! scuola|123goschool|scuola|fai da te|scherzo|trucchi|trucchetti|ambiguo|imbarazzante|trucchi utili|scherzi|divertente|tiktok|tik tok|sketch","297993","6074","805","272","https://i.ytimg.com/vi/uq0A0LBS5w8/default.jpg","False","False","Lo voglio e l’avrò! L’eterna lotta fra i ragazzi ricchi e quelli poveri. Oggi vi mostreremo altre differenze tra i ragazzi ricchi e quelli poveri! Vi siete trovati in una situazione di ricchi contro poveri come questa? Fatecelo sapere nei commenti!Non dimenticate di condividere questo video con i vostri amici e iscrivetevi alla pagina YouTube di 123 GO! SCHOOL, per altri fantastici video come questo!#123GO #divertente #scuola #ricco #povero #studentiIscriviti: https://bit.ly/33IG4rOMusica daEpidemic Sound: https://www.epidemicsound.com/Materiali usato:https://www.depositphotos.comhttps://www.shutterstock.comhttps://elements.envato.comQuesto video è realizzato a scopo di intrattenimento; Non ne garantiamo la completezza e l'affidabilità. Qualsiasi azione venga intrapresa è a proprio rischio e pericolo e non saremo responsabili per danni o perdite. É responsabilità dello spettatore usare giudizio, cura e precauzioni se intende replicare.Il seguente video mostra l'attività di attori professionisti in un ambiente controllato- usate precauzioni e giudizio se intendete replicare.","PT10M3S"
"yMgbBvU3fV8","Lei con Quale Celebrità Tradirebbe il Suo Ragazzo? - [La Lavagnetta Distruggi-Coppie] - theShow","2020-09-16T12:00:17Z","UCYZ3uwiIy1LrwrAywLeQSlQ","theShow","24","20.18.09","the show|theshow|the show is you|theshowisyou|esperimenti sociali|the show scherzi|esperimento sociale|scherzi iene|prank ita|scherzi gente milano|''scherzi''|''scherzo''|scherzi a parte|candid camera|la lavagnetta distruggi coppie|fidanzati|intervista|gelosia|sogno|erotico|fantasia|cristano ronaldo|bagnino|interviste coppie","560853","42801","642","1915","https://i.ytimg.com/vi/yMgbBvU3fV8/default.jpg","False","False","Qui trovi tutto quello che abbiamo in casa e molto altro: https://www.amazon.it/shop/theshowQuanto mancava la Lavagnetta Distruggi-Coppie! Anche in un'epoca di distanziamento sociale siamo riusciti a far avvicinare molte coppie di innamorati.Con cosa registriamo di nascosto?🎥CAMEREPer girare candid a camera nascosta:- Panasonic HC-VX980: https://amzn.to/39sKncM- GoPro HERO 8: https://amzn.to/2VFn8IC- Supporto da petto per GoPro HERO 8: https://amzn.to/2Tf5dqpPer le intro:- Panasonic Lumix Gh5: https://amzn.to/2IfYnus- Lente 18 -35 Sigma: https://amzn.to/3cnVGox🎤MICROFONI E REGISTRATORIMicrofoni nascosti:- Tascam DR-10L: https://amzn.to/32PDekA- Set Microfono Sennheiser: https://amzn.to/32Kjm2kPer registrare i voice over- Microfono a condensatore: https://amzn.to/38bwP41- Pannello fonoassorbente: https://amzn.to/2TyFCHVRegistratori portatili:- Olympus: https://amzn.to/32PDpMM- Zoom h6: https://amzn.to/2Ie8Iak💡LUCIFaretto leggero Yongnuo: https://amzn.to/39hsDRQQui trovi il nostro libro Fallo: Teorie inutili ed esercizi pratici per vincere le PARANOIE ed essere VERGOGNOSAMENTE felici📕https://amzn.to/3bnuapW¶ La programmazione 2019/2020 di theShow:   - LUNEDÌ: Candid Girl Power con le Aktriz   - MERCOLEDÌ: Candid Camera Original theShow, con Alessio e Alessandro   - VENERDÌ: Video dei nuovi player (a rotazione tra LALE, Gatto e Jaser)   - DOMENICA: EPPOI? QUIZ SHOW (A Domeniche Alterne)¶ Partecipa al quiz EPPOI? scrivendo a eppoitheshow@gmail.com (verranno prese in considerazione solo le candidature di maggiorenni, con video di presentazione e/o contatti social)¶ Per lettere/pacchi, ricorda di scrivere ALL'ATTENZIONE DEI THESHOW prima dell'indirizzo: Show Reel Media Group - Via Stresa 6, 20125 Milano ¶ SEGUITECI SU:    - Youtube: http://www.youtube.com/theshowisyou    - Facebook: http://www.facebook.com/theshowisyou   - Twitter: http://www.twitter.com/theshowisyou   - Instagram: http://www.instagram.com/theshowisyou","PT13M8S"
"G0EoegoakxM","La demenza senile di SILENTE","2020-09-17T11:30:00Z","UChn336v-fUYkJH09vA4ZuCA","CARTONI MORTI","1","20.18.09","harry potter|silente|silente harry potter|harry potter parodia|harry potter cartone|harry potter cartone animato italiano|cartone animato|parodia|italiano|cartoni morti|harry potter theory|cartone italiano|potter parodia|silente parodia|gandalf e silente|merluzzo|cartone silente","265080","39766","406","1011","https://i.ytimg.com/vi/G0EoegoakxM/default.jpg","False","False","Silente ha una certa età ma Harry Potter pensa che sia solo saggio.INSTAGRAM► https://instagram.com/cartoniMortiSHOP► https://www.moteefe.com/store/cartonimortiFACEBOOK► https://facebook.com/cartoniMortiTWITTER► https://twitter.com/cartonimortiE-MAIL COMMERCIALE► cartonimorti@socialflowagency.itCOSA USO:Microfono ► https://amzn.to/36pvB4pCuffie ► https://amzn.to/36q16ewScheda audio (questa è nuova) ► https://amzn.to/38COqCJCasse ► https://amzn.to/2RLwQ8DTavoletta grafica ► https://amzn.to/2RO1yhsMa vorrei prendere questa ► https://amzn.to/2TZWbhMComputer ► https://amzn.to/2TRoWgMLucina ► https://amzn.to/30R7OJwOcchiali anti raggi blu ► https://amzn.to/3aGMqeA","PT2M1S"
"B1tl1rLEmQo","LE RAGAZZE E LO SHOPPING","2020-09-17T10:00:05Z","UCb4ktqSHE8yU0EqRBx2_BwA","Quello che le donne non dicono","24","20.18.09","[none]","207330","10729","139","158","https://i.ytimg.com/vi/B1tl1rLEmQo/default.jpg","False","False","Ogni mattina una ragazza si sveglia e sa che dovrà correre più veloce di ogni altra donna per accaparrarsi quel vestito che sta proprio un amore ed è al 50% di sconto!. Pronte, partenza ... SHOPPING 🛍","PT4M27S"
"xlGCDKEgqok","PARODIA FALÒ SOFIA E AMEDEO!","2020-09-17T12:48:36Z","UC8yqtQKi-7uM5bGjJqqvkuw","Vincenzo Tedesco","24","20.18.09","[none]","133071","17991","110","938","https://i.ytimg.com/vi/xlGCDKEgqok/default.jpg","False","False","Seguitemi su Instagram = @vincenzotedesco97 che disagio ogni giorno nelle storie 😂 Iscrivetevi al canale 🤪🌈💘🦄","PT10M14S"
"x1aXvxVT21o","The Jackal - L’ultimo giorno PRIMA dell’ESAME (feat. Emma Marrone)","2020-09-16T11:00:10Z","UCpB9uxBH-Hjoj_Jd9cnRC_w","The Jackal","23","20.18.09","video divertenti|parodie divertenti|corti divertenti|web series ita|parodia|the jackal|emma marrone|x factor|sky|mika|maracas|gruppo studio|studiare|mario|real brown","492912","37107","476","638","https://i.ytimg.com/vi/x1aXvxVT21o/default.jpg","False","False","Lo sapevi? Studi scientifici dimostrerebbero che la musica aiuta a concentrarsi, e che se continuerai a dare zero esami all'anno non ti laureerai mai.➜ ISCRIVITI AL CANALE: https://bit.ly/2WjyIdd➜ INSTAGRAM: https://www.instagram.com/_the_jackal/➜ FACEBOOK: https://www.facebook.com/thejackalweb/➜ TWITCH https://www.twitch.tv/thejackal_official➜ TWITTER: https://twitter.com/_the_jackalIn collaborazione con Sky ItaliaX Factor 2020 dal 17 Settembre tutti i Giovedì alle 21:15 su Sky Italia e in streaming su NOWTV---- Cast & Troupe ----Ciro PrielloGianluca FruAurora LeoneClaudia Napolitanocon la partecipazione di: Emma Marronee con:Renato De SimoneGiuseppe AquilaPietro ValenteMichele Angelo GrimaldiRegia: Valerio VestosoDirettore della fotografia: Roberto OstuniDirettore della fotografia unità Roma: Giuseppe de MuroProduttore esecutivo: Simone RussoOrganizzatore generale: Maria Chiara De GregorioCoordinatrice di Produzione: Annachiara de FilippisAssistente di produzione: Giuseppe AquilaAssistente di produzione: Pietro ValenteMontaggio: Nicola VerreColor Correction: Alfredo FelcoMusiche e Mix Audio: Liz MartinAiuto Regia: Ylenia AzzurrettiSegretaria di Edizione: Laura CampanileCostumista: Teresa PapaTrucco: Antonietta BorrelliParrucco: Antonello AstaritaAttrezzista: Miriana PalombaAiuto Attrezzista: Daniele RussoFonico: Giorgio DurantinoOperatore: Giuseppe De MuroVideoassist: Deborah VenezianoCapo Elettricista: Francesco SaccoMacchinista: Vitalii MaliuskyiElettricista Roma: Nicola De BlasioAmministrazione: Arianna Avolio, Antonella Tommasini, Rosita Venuti, Raffaele SodanoSottotitoli: Marica EspositoSoggetto e Produzione The JackalHead of Branded Content: Vincenzo PiscopoAccount Manager: Anna ManzoDirezione artistica: Alessandro GrespanScritto da: Alessandro Grespan, Ciro Priello, Gianluca Fru, Fabio Balsamo, Aurora Leone e Claudia Napolitano","PT5M41S"
"UkLTyPFFstw","ANIMARE con UN SOLO FOGLIO! Illusione ottica 🐸 Fraffrog","2020-09-17T12:00:42Z","UCuL6cg-3m-ile8KOd5Q_Rtw","Fraffrog","26","20.18.09","fraffrog|fraffrog animazione|fraffrog illusione ottica|creare illusione ottica|animazione con un solo foglio|animazione disegno|disegno tradizionale|optical illusion|animazione 5 fotogrammi|come animare un disegno|fraffrog disegno carta|fraffrog disegno ipad","139184","16077","102","415","https://i.ytimg.com/vi/UkLTyPFFstw/default.jpg","False","False","Sapete che per creare un'animazione sono necessari più o meno fotogrammi, oggi vi dimostrerò che è possibile farlo anche con un solo disegno!Disegni utilizzati nel video: https://drive.google.com/file/d/1HWenFHYkChfR-Buk1Fzi9F_OQ2UqUiXC/view?usp=sharing⬇️⬇️ INFO ⬇️⬇️🎬 Attrezzatura Video ► https://amzn.to/2QpsZP5📝 Attrezzatura Disegno ► https://amzn.to/2rV29oG📘 I miei fumetti ► https://amzn.to/39F9Znj📸 INSTAGRAM - http://bit.ly/35tFu0h🎙️ PODCAST - https://spoti.fi/37DhIR7📺 TWITCH - http://bit.ly/2pKaASJ💻 IL MIO PCComputer • http://it.rog.gg/Fraffrog_PBA_GamingRigMonitor • http://it.rog.gg/Fraffrog_ASUS_PA27AC📩 MAIL Lavoro? ► fraffrog(at)gmail.com","PT15M13S"
"ips8p1FB8YA","Ep.28 Libertà con Giuseppe Cruciani - Muschio Selvaggio Podcast","2020-09-14T12:00:17Z","UCg7mcZKjupbLdsuiMBVTuDw","muschio selvaggio","22","20.18.09","muschio selvaggio|fedez|luis|fedez podcast|luis podcast|luis sal e fedez|muschio selvaggio podcast|muschio selvaggio giuseppe cruciani|giuseppe cruciani intervista|giuseppe cruciani","773871","39423","1218","2632","https://i.ytimg.com/vi/ips8p1FB8YA/default.jpg","False","False","Instagram: https://www.instagram.com/muschioselvaggio/?hl=itSpotify: https://open.spotify.com/show/6jBWY6Mup7iEFSYvMiVw7b?si=y2UYfu2uQYKUyrp-sMjBrAApple Podcast: https://podcasts.apple.com/it/podcast/muschio-selvaggio/id1495854773","PT1H4M11S"
"o9owSt9SHak","Tommaso Paradiso - Ricordami","2020-09-16T12:00:11Z","UCe4o1J6j0gV-zkYIORfhTqw","TommasoParadisoVEVO","10","20.18.09","Tommaso|Paradiso|Ricordami|Universal|Music|Italia|srL.|Pop|non avere paura|sulle nuvole tour|tommy paradiso|thegiornalisti|non avere paura testo|baby netflix|colonna sonora baby|netflix|i nostri anni|ma lo vuoi capire|oh ma lo vuoi capire|sotto il sole di riccione|sulle nuvole|ricordami|abbracciami|baciamoci|estate|andrea delogu|cocktail|anni 80|francesco montanari","173550","5651","305","408","https://i.ytimg.com/vi/o9owSt9SHak/default.jpg","False","False","Ascolta “Ricordami” http://island.lnk.to/ricordami ► Segui Tommaso Paradiso:Facebook: https://www.facebook.com/tommasoparadiso83/Instagram: http://www.instagram.com/tommasoparadisoSpotify: https://spoti.fi/2lnraWo ► Credits Con Francesco Montanari e Andrea Delogu  Una produzione Maestro Production  Regia : Younuts! (Antonio Usbergo & Niccoló Celaia) Produttore Esecutivo : Antonio GiampaoloD.O.P : Davide Manca Montaggio: Francesco GalliColorist : Alessandro RocchiMotion Graphic : Valerio MasottiOrganizzatore Generale : Michela TerzaghiAiuto Regia : Simone MastronardiDirettore di produzione : Livia GabriottiIspettore di Produzione : Giammario D’Eramo Costumi : Marta FantozziFocus Puller : Lorenzo De MarcoAiuto Operatore : Matteo AloisiVideo Assist : Giuseppe GentiliCapo Elettricista : Daniele ZonettiElettricista : Massimo MontinaroCapo Macchinista : Massimo DiamantiMacchinista : Giovanni Peyrone Stagisti Fotografia : Giulio Paolo Davoli, Ignazio Caccamo, Andrea Lo Vetro, Alessandro SaulliFonico : Andrea GuzzoScenografia : Massimo SergianniAss. Scenografia : Anna Di Franco, Giorgio Rodinò, Angeliki SyrmaAss. Costumi : Luigi D’EliaMake up : Adriana ApruzzoAss. Make up : Giulia Neri  Hair Style Tommaso : Francesco DominiciHair Cast : Italo De AngelisAss. Hair Cast : Simone AlimontiAssistente di produzione : Camilla Zanini Autisti : Petrucci Gabriele, Massucci Dino, Spitoni Stefano Un ringraziamento particolare per i costumi a: WoodenD’Inzillo, La Bottega di Alice, AnnamodeMadmoiselle Vintage Giorgia Bianchini Thanks to:Carlo CartocciMake Green / CateringGuido PlanetaSound System Gel Allestimenti per lo spettacoloBakeka Casting e Gianluca Mitrione F.ll Cartocci Srl Il video è stato realizzato rispettando tutte le misure di sicurezza a tutela del contenimento del virus COVID-19.  ► Ricordami (Testo)Noi che crediamo solo ai sogni e bastaNoi che fumiamo mentre va la pastaNoi che sbagliamo a mandare i messaggiNessuno che capisce i nostri sbagli A noi che non ci piace fare fintaA noi che a volte non abbiamo grintaAmore, Sally, toccami la manoScopiamo pure su questo divano E se finisse pure il mondo adessoLa nostra vita resterà lo stesso Abbracciami, baciamoci, ricordamiTanto comunque andrà sarà un successoAbbracciami, baciamoci, ricordamiTanto comunque andrà sarà un successo Tu che mi dici asciugati i capelliTu che ti svegli sempre dopo di meIo che non so neanche che giorno èMa son contento ce ne andremo in vacanza E se finisse pure il mondo adessoLa nostra vita resterà lo stesso Abbracciami, baciamoci, ricordamiTanto comunque andrà sarà un successoAbbracciami, baciamoci, ricordamiTanto comunque andrà sarà un successo Abbracciami, baciamoci, ricordamiTanto comunque andrà sarà un successoSarà un successoSarà un successoMusic video by Tommaso Paradiso performing Ricordami. An Island Records release; © 2020 The Sold Out Music Srl, under exclusive licence to Universal Music Italia srlhttp://vevo.ly/MNx7Ua","PT4M36S"
"HDT-1EbZC4w","Achille Lauro - Maleducata (Baby 3 Official Soundtrack)","2020-09-16T22:00:02Z","UCBn0LqkY6sTa1iw-NQOGEbA","Achille Lauro","10","20.18.09","maleducata|achille lauro|1969 achille lauro rebirth|achille idol|1969|c'est la vie|maledetto lunedì|album 1969 achille idol rebirth|rolls royce|cadillac|zucchero|sexy ugly|bam bam twist|me ne frego|16 marzo|roma|je t'aime|delinquente|scusa|c'est la vie feat. fiorella mannoia|fiorella mannoia","140840","6866","150","485","https://i.ytimg.com/vi/HDT-1EbZC4w/default.jpg","False","False","Achille Lauro - MaleducataProd. Gow Tribe, Frenetik&Orang3, Gregorio CalculliGraphic & Video Design: Vivjan Prendihttps://www.instagram.com/vivjanprendiAscolta qui: https://bit.ly/3iJzokcLyrics:Sì voglio una stupida sigarettaSì sono una stupida conigliettaHo lasciato il cervello nella mia cameretta Sì sono cresciuto sì dentro una gabbietta  Quand’esco metto sempre una passata di smalto Oh mio Dio ‘sto cesso è pieno di Borotalco E tu ti stai truccando come una ballerina Stai bevendo un tè speciale con la tua amica Oh sì  Sì ti voglio sempre cosìSì ti voglio sempre cosìSì ti voglio sempre cosìSì ti voglio sempre così Sì ti voglio sempre cosìDavvero fammi maleOra che sto qui con teSì l’amore uccideSei il mio sicarioVai ti voglio sempre cosìMaleducataTi voglio sempre cosìOh no noTi voglio sempre così  Sì sono una stupida Bambolina Sì ti prego affogami nella tua piscina Le regalo il cuore sì così lo cucina Strappa la mia pelle sìMettila in vetrina Scattami una foto sìSono una modellaSfila sul mio corpo Sì come in passerellaDi notte vanitosa Di mattina aggressiva Di giorno una monella E una bambina cattivaSì cose da femmina Ti voglio sempre cosìCose da femmina Oh mio DioCose da femmina Ti voglio sempre cosiCose da femmina  Sì ti voglio sempre cosìDavvero fammi maleOra che sto qui con teSì l’amore uccideSei il mio sicarioVai ti voglio sempre cosìMaleducataSì ti voglio sempre cosìMaleducataFammi male ora che sto quiMaleducataSì l’amore uccideSei il mio sicarioVai ti voglio sempre cosìScoiattolinaSexy      Oh yeeeToglimi gli indumenti OleeeNo non vado bene a scuola No niente patente Mi sto spogliando in bagno sìRipetente Oh sì sìTi voglio sempre cosìOh mio DioTi voglio sempre così  Oh yeee yeeeTi voglio sempre cosìTi voglio sempre così#AchilleLauro #1969AchilleIdolRebirth #Maleducata","PT2M53S"
"fn96G9DmFc8","Pagare una Goleador con 50 € (e Lasciare il Resto) - [Sorprese ai Negozianti] - theShow","2020-09-14T12:00:22Z","UCYZ3uwiIy1LrwrAywLeQSlQ","theShow","24","20.18.09","the show|theshow|the show is you|theshowisyou|esperimenti sociali|the show scherzi|esperimento sociale|scherzi iene|prank ita|scherzi gente milano|''scherzi''|''scherzo''|scherzi a parte|candid camera|Pagare una Goleador con una Banconota da 50 euro|sorprese ai commercianti|caffè|panino|buone azioni|aktriz|merenda ai negozi","1089318","88223","1233","2045","https://i.ytimg.com/vi/fn96G9DmFc8/default.jpg","False","False","Qui trovi tutto quello che abbiamo in casa e molto altro: https://www.amazon.it/shop/theshowUna delle cose che ci chiedete più spesso è di pagare una goleador con una banconota da 50 euro. L'abbiamo fatto...ma con una sorpresa!Con cosa registriamo di nascosto?🎥CAMEREPer girare candid a camera nascosta:- Panasonic HC-VX980: https://amzn.to/39sKncM- GoPro HERO 8: https://amzn.to/2VFn8IC- Supporto da petto per GoPro HERO 8: https://amzn.to/2Tf5dqpPer le intro:- Panasonic Lumix Gh5: https://amzn.to/2IfYnus- Lente 18 -35 Sigma: https://amzn.to/3cnVGox🎤MICROFONI E REGISTRATORIMicrofoni nascosti:- Tascam DR-10L: https://amzn.to/32PDekA- Set Microfono Sennheiser: https://amzn.to/32Kjm2kPer registrare i voice over- Microfono a condensatore: https://amzn.to/38bwP41- Pannello fonoassorbente: https://amzn.to/2TyFCHVRegistratori portatili:- Olympus: https://amzn.to/32PDpMM- Zoom h6: https://amzn.to/2Ie8Iak💡LUCIFaretto leggero Yongnuo: https://amzn.to/39hsDRQQui trovi il nostro libro Fallo: Teorie inutili ed esercizi pratici per vincere le PARANOIE ed essere VERGOGNOSAMENTE felici📕https://amzn.to/3bnuapW¶ La programmazione 2019/2020 di theShow:   - LUNEDÌ: Candid Girl Power con le Aktriz   - MERCOLEDÌ: Candid Camera Original theShow, con Alessio e Alessandro   - VENERDÌ: Video dei nuovi player (a rotazione tra LALE, Gatto e Jaser)   - DOMENICA: EPPOI? QUIZ SHOW (A Domeniche Alterne)¶ Partecipa al quiz EPPOI? scrivendo a eppoitheshow@gmail.com (verranno prese in considerazione solo le candidature di maggiorenni, con video di presentazione e/o contatti social)¶ Per lettere/pacchi, ricorda di scrivere ALL'ATTENZIONE DEI THESHOW prima dell'indirizzo: Show Reel Media Group - Via Stresa 6, 20125 Milano ¶ SEGUITECI SU:    - Youtube: http://www.youtube.com/theshowisyou    - Facebook: http://www.facebook.com/theshowisyou   - Twitter: http://www.twitter.com/theshowisyou   - Instagram: http://www.instagram.com/theshowisyou","PT9M20S"
"xW00l1YHhpY","Il Milanese Imbruttito - La svolta GREEN dell'Imbruttito","2020-09-16T13:13:31Z","UCwbdE36Ey2CNeANU7Y23kww","Il Milanese Imbruttito","24","20.18.09","imbruttito|il milanese imbruttito|giargiana|smart working|milano|office|ufficio|lavoro|green|grano|ecosostenibilità|biometano|metano|mobilità|plastica|eco|ecobonus|bonus|ridere|comedy|fun|divertente|gag|fatturare|duomo|navigli|doppia f|germano lanzoni|valerio airò|renato avallone","182988","14508","199","305","https://i.ytimg.com/vi/xW00l1YHhpY/default.jpg","False","False","Uè figa! Iscriviti al canale Imbruttito: http://bit.ly/2fkDpukDopo la doppia F c’è un nuovo mantra aMilano e si basa sulla doppia G: Green e Grano. TaaacSegui Il Milanese Imbruttito su: http://ilmilaneseimbruttito.com/facebook: http://bit.ly/2ix9GiBinstagram: http://bit.ly/2jpXzs3","PT4M40S"
"wZJdGT7a1Z4","Tony Colombo Ft. Tina Colombo - TIAEMMEO (Video Ufficiale 2020)","2020-09-17T09:00:08Z","UCA9UA9ZQIKMkWf5A5C4iYKw","CR STUDIO NAPOLI","10","20.18.09","Tony Colombo|Tina Colombo|Pop|TIAEMMEO|CR Studio Napoli|sonarmusic|musica italiana|musica neomelodica|cantante neomelodico|canzone napoletana|canzone d’autore|VIDEO UFFICIALE|OFFICIAL VIDEO","60962","1767","360","204","https://i.ytimg.com/vi/wZJdGT7a1Z4/default.jpg","False","False","PRODUZIONE/ CR STUDIO NAPOLIArrangiamenti/ Max D’ambraAUTORE: L.Barbato - A.ColomboRegia/ Ferdinando EspositoMake-up/ Agostino DeganParrucchieri/ Lorman Parrucchieri (Napoli)Tina veste/ DiorInfo/ +39 331.4271370www.tonycolombo.itTIAEMMEO #TonyColombo #TinaColombo #TONYeTINA@2020 CR Studio: Tony Colombo Ft.Tina Colombo - TIAEMMEO (Video Ufficiale 2020)AUTORE: L.Barbato - A.ColomboASCOLTA QUI: https://backl.ink/142832054Iscrivetevi al nostro canale: https://goo.gl/Ru7Jyx   YouTube: https://goo.gl/TjHV60Facebook: https://www.facebook.com/therealtonycolombo/Instagram: https://www.instagram.com/tonycolombotv/?hl=it","PT3M34S"
"Z2Y1pHUfamM","NIKO PANDETTA - (REMIX) A UN PASSO DALLA LUNA & DANZA.","2020-09-15T12:08:43Z","UCDuX5tSzDq5MocnAJWQMXtA","Niko Pandetta","10","20.18.09","#nikopandetta #danza #Catania","272335","12163","529","975","https://i.ytimg.com/vi/Z2Y1pHUfamM/default.jpg","False","False","NIKO PANDETTA - (REMIX) AD UN PASSO DALLA LUNA & DANZA.Autori: Vincenzo Pandetta - Giuseppe Giocondo- C. BagliMix e Master: G.SantonocitoIeri sera sono tornato nella mia city, sentendo un po’ i miei amici di vita sono stato invitato in studio, lo studio dove tutto iniziò.Abbiamo acceso il microfono e tra una risata e l’altra ci siamo accorti che Ad un passo dalla luna di Rocco è molto simile a Danza 😂,e vabbè, da qui é nata l'idea.È sempre bello tornare a casa,le energie positive della mia cara Catania mi avvolgono come un caloroso abbraccio dato da una madre!Ci vediamo l’1 ottobre.REVENGE 🍀👑Segui Niko Pandetta:Su Instagram: https://bit.ly/31I2YQNSu Spotify: https://spoti.fi/32Fcrb2Su Facebook: https://bit.ly/3hMC4wT","PT2M52S"
"HIKRDIvkvEc","Rossoneri avanti in Europa: Shamrock Rovers-Milan 0-2 | DAZN Highlights","2020-09-17T21:46:38Z","UC7N8IuYFhU8Hs1ruCTsXTbg","DAZN Italia","17","20.18.09","ac milan|milan|europa|shamrock rovers|dazn|dazn highlights","79296","4548","72","163","https://i.ytimg.com/vi/HIKRDIvkvEc/default.jpg","False","False","I gol di Ibrahimovic e Calhanoglu regalano la vittoria al Milan contro lo Shamrock Rovers. I rossoneri incontreranno al prossimo turno il Bodø/Glimt","PT5M22S"
"75pByg-qdIo","Thauvin decide un Le Classique ad alta tensione: PSG-Marsiglia 0-1 | Ligue 1 | DAZN Highlights","2020-09-14T07:42:28Z","UC7N8IuYFhU8Hs1ruCTsXTbg","DAZN Italia","17","20.18.09","psg|marsiglia|le classique|ligue 1|dazn|dazn italia|neymar|thauvin|benedetto|paredes|icardi|mbappe","357294","10733","277","783","https://i.ytimg.com/vi/75pByg-qdIo/default.jpg","False","False","Un gol di Thauvin decide il derby di Francia. Grande nervosismo nel finale, con ben 5 espulsi, compresi Neymar e Benedetto. Seconda sconfitta consecutiva per il PSG.Segui la Ligue1 Uber Eats su DAZN: http://bit.ly/DAZN_Ligue1","PT5M57S"
"sgYBnLqd2f8","FSK SATELLITE, Greg Willen - 10 X IN CALIFORNIA","2020-09-14T12:00:23Z","UCkZD_dYZyOUgvSs6XX48L1w","FSKSATELLITEVEVO","10","20.18.09","FSK|SATELLITE|Greg|Willen|CALIFORNIA|Universal|Music|Italia|srL.|Hip|Hop|sapobully|taxi b|chiello|greg willen|10 sprite|mitra|trapshit|fsk trapshit|melissa p|la prova del cuoco|no spie|ansia no|thaurus|ollare|crema di buccia|settimana al caldo|padre figlio e spirito|10 x in california|andrea dipre|padre|figlio|spirito","319528","19370","933","1686","https://i.ytimg.com/vi/sgYBnLqd2f8/default.jpg","False","False","“Padre Figlio e Spirito”, il nuovo album è fuori http://thaurus.lnk.to/padrefiglioespirito Segui FSK Satellitehttps://www.instagram.com/taxi_bi/https://www.instagram.com/sapo_bully/https://www.instagram.com/chiello_fsk/ Prod. Greg Willen https://www.instagram.com/gregwillen Directed by FSK, Giorgio CassanoShot and edited by Giorgio CassanoThanks to Andrea Dipré, Kikko SanfiTypo by PysellinoOriginal artworks by Alvin Sonic, Filippofm, Paolo Dopo, Ratematica, SafeSpaceCMX, Taxi BergoeMusic video by FSK SATELLITE, Greg Willen performing 10 X IN CALIFORNIA. © 2020 Thaurushttp://vevo.ly/ko8AdV","PT2M29S"
"1O6Qstncpnc","Hogwarts Legacy - Official Reveal Trailer | PS5","2020-09-16T20:17:47Z","UC-2Y8dQb0S6DtpxNgAKoJKA","PlayStation","20","20.18.09","Hogwarts|Hogwarts legacy|harry potter game|wizarding world|wizards|witches|jk rowling|video games|gaming|gamer|WB Games|Warner Bros games|magic|wands|Hogsmeade|hogsmede|hogwart|rpg|role playing games|avalanche|playstation|ps5|playstation 5|next gen games|fantasy games|fantastic beasts|Announce trailer|trailer|hippogrif|hippogriff|reveal|game announce|game reveal|announce|hedwigs theme|gameplay","4477142","179780","3666","13719","https://i.ytimg.com/vi/1O6Qstncpnc/default.jpg","False","False","Always be the first to get #HogwartsLegacy news at go.wbgames.com/HogwartsLegacyExperience a new story set at #Hogwarts in the 1800s. Your character is a student who holds the key to an ancient secret that threatens to tear the wizarding world apart. Make allies, battle Dark wizards and decide the fate of the wizarding world.Connect with Hogwarts Legacy online: Twitter: https://twitter.com/HogwartsLegacyFacebook: https://facebook.com/HogwartsLegacyInstagram: https://instagram.com/HogwartsLegacyDiscord: Discord.gg/HogwartsLegacy","PT2M41S"
