video_id,title,publishedAt,channelId,channelTitle,categoryId,trending_date,tags,view_count,likes,dislikes,comment_count,thumbnail_link,comments_disabled,ratings_disabled,description,duration
"uGyzYwhleeE","Whenever You Call","2020-09-17T10:15:29Z","UCFK3iAGAFy6q8lS8NspImrQ","ARASHI - Topic","10","20.18.09","ARASHI|Bruno Mars|D'Mile|Whenever You Call","301538","23266","381","1712","https://i.ytimg.com/vi/uGyzYwhleeE/default.jpg","False","False","Provided to YouTube by The Orchard EnterprisesWhenever You Call · ARASHI · Bruno Mars · D'MileWhenever You Call℗ 2020 J Storm Inc.Released on: 2020-09-18Producer: Bruno MarsProducer: D'MileAuto-generated by YouTube.","PT3M14S"
"XatXG64RxUA","【衝撃】海で絡んできたヤンキー達に鉄拳制裁","2020-09-17T10:00:25Z","UCyck8jJ1yQzy82rLJ5nv8Gg","安保瑠輝也 あんぽるきや","24","20.18.09","朝倉未来|喧嘩自慢|ヤンキー|スパーリング|ぼったくりバー","690743","12025","722","3063","https://i.ytimg.com/vi/XatXG64RxUA/default.jpg","False","False","街の喧嘩自慢がプロ格闘家にスパーリングを申し込んだらやるのかやらないのか【前編】https://youtu.be/6R3aMHDQ2xk【神回】K-1世界王者が朝倉未来にMIXルールで挑んでみたhttps://youtu.be/uvsVOs3HmRI朝倉未来1年チャレンジvs安保瑠輝也https://youtu.be/OxhBXy9oNF0・あんぽるきやのSNShttps://twitter.com/anpo_rukiya?s=21https://instagram.com/anporukiya_k1・くりおのSNShttps://twitter.com/kro219?s=21https://instagram.com/kurio219?igshid=1iq7epithlndp・あんぽるきやYouTube公式Twitterhttps://twitter.com/allwin_rukiya?s=21","PT13M40S"
"MH_vjfNPv70","BTS Performs Dynamite on AGT - America's Got Talent 2020","2020-09-17T00:48:16Z","UCT2X19JJaJGUN7mrYuImANQ","America's Got Talent","24","20.18.09","TV Series|Hilarious Music Songs|Highlights|America's Got Talent|AGT|America's Got Talent 2020|AGT 15|America's Got Talent Season 15|New AGT|Funny Videos|Live Shows|Full Performance|AGT Full|AGT Live Shows|Highlights Previews|funny|clips|talent|talent show|방탄소년단|BTS|Dynamite|Dynamite MV|BTS Dynamite AGT|Dynamite AGT|BTS AGT|Kpop|Korean|Korean Pop|Jimin|J-Hope|Namjoon|Jungkook|Jin|Suga|Taehyung|Hoseok|RM|Hobi|Kpop Music Video|Music Video|BTS on AGT","7743272","1234052","12982","74024","https://i.ytimg.com/vi/MH_vjfNPv70/default.jpg","False","False","BTS (방탄소년단) is BACK! BTS returns with an incredible performance of Dynamite on America's Got Talent!» Get The America's Got Talent App: http://bit.ly/AGTAppDownload» Subscribe for More: http://bit.ly/AGTSub» Watch America's Got Talent Tuesdays & Wednesdays 8/7c on NBC!» Stream on Peacock: https://bit.ly/AGTPeacockAMERICA'S GOT TALENT ON SOCIALLike AGT: https://www.facebook.com/agtFollow AGT: https://twitter.com/agtAGT Instagram: http://instagram.com/agtFind America's Got Talent trailers, full episode highlights, previews, promos, clips, and digital exclusives here. #BTS #BTSonAGT #AGTNBC ON SOCIAL:YouTube: http://www.youtube.com/nbcTwitter: http://Twitter.com/NBCFacebook: http://Facebook.com/NBCInstagram: http://instagram.com/nbcABOUT AMERICA'S GOT TALENTAmerica’s Got Talent, NBC’s No. 1 summer show, returns in May with fresh new faces and familiar favorites, along with the excitement, thrills and feel-good performances that viewers have come to love each season. Creator and Executive Producer Simon Cowell is back at the star-studded judges' table with fan-favorite comedian Howie Mandel. Acclaimed actress and international superstar Sofia Vergara joins as a new judge this season alongside returning judge and global fashion icon Heidi Klum.  The dynamic Terry Crews returns as host. With the show open to acts of all ages, America's Got Talent continues to celebrate the variety format like no other show on television. Year after year, America's Got Talent features an impressive array of singers, dancers, comedians, contortionists, impressionists, magicians, ventriloquists and hopeful stars, all vying to win America's hearts and a $1 million prize.America's Got Talent is available now on Peacock, the new streaming service from NBCUniversal. Watch thousands of hours of hit movies and shows, plus daily news, sports, and pop culture updates. Stream now on Peacock.BTS Performs Dynamite on AGT - America's Got Talent 2020https://youtu.be/MH_vjfNPv70America's Got Talenthttp://www.youtube.com/user/americasgottalent#AGT #AmericasGotTalent","PT3M26S"
"cp6stP2xLdk","TVアニメ『SHAMAN KING』ティザーPV","2020-09-17T01:00:05Z","UCR61XV4ROXhkcfLO31hTGuw","「KING AMUSEMENT CREATIVE」公式チャンネル","1","20.18.09","キンクリ|キングレコード|シャーマンキング|SHAMAN KING|武井宏之|日笠陽子|小西克幸|林原めぐみ|高山みなみ","759091","0","0","2380","https://i.ytimg.com/vi/cp6stP2xLdk/default.jpg","False","True","シリーズ累計3,500万部突破の武井宏之先生による大人気コミックス『SHAMAN KING』2021年4月テレビ東京系にてTVアニメ放送決定！アニメ公式Twitter：https://twitter.com/SHAMANKING_PR 【ON AIR】2021年4月テレビ東京系にてTVアニメ放送決定！【Introduction】-notice-『SHAMAN KING』それは、森羅万象を司る星の王。神や霊と交流できる「シャーマン」と呼ばれる者達が、500年に一度「シャーマンファイト」でその座を争う。そんなシャーマンの一人である少年・麻倉 葉の、シャーマンキングを目指す戦いが、2021年4月、完全新作アニメーションとして今、始まる。【STAFF】原作：武井宏之監督：古田丈司シリーズ構成：米村正二キャラクターデザイン：佐野聡彦音楽：林 ゆうき音響監督：三間雅文音楽制作：キングレコードアニメーション制作：ブリッジ【CAST】麻倉 葉：日笠陽子阿弥陀丸：小西克幸恐山アンナ：林原めぐみハオ：高山みなみ【WEB】アニメ公式HP：https://shamanking-project.com/アニメ公式Twitter：https://twitter.com/SHAMANKING_PR ©武井宏之・講談社／SHAMAN KING Project.・テレビ東京","PT36S"
"c_WT67oS_Ss","【ノーカット】岸信夫防衛大臣が着任　出迎え・栄誉礼、着任式","2020-09-17T09:18:06Z","UC1zYGo1jIIjMVDTLL3dydow","SankeiNews","25","20.18.09","産経新聞|sankei|防衛省|岸信夫|防衛大臣|栄誉礼|着任式","296046","6465","163","765","https://i.ytimg.com/vi/c_WT67oS_Ss/default.jpg","False","False","菅義偉内閣は１７日、発足から一夜明けて本格始動した。防衛省では午後、新しく就任した岸信夫防衛大臣の栄誉礼と着任式が行われた。　河野太郎行政改革担当相は後任の岸防衛相と午後に防衛省で引き継ぎを行う予定だったが、直前になって中止に。事務方は「都合により中止」と発表しただけで、詳しい説明はなかった。","PT14M29S"
"j-T0v7t2JvA","河野大臣「やめたらいい」　深夜の会見に苦言(2020年9月17日)","2020-09-16T21:17:51Z","UCGCZAYq5Xxojl_tSXcVJhiQ","ANNnewsCH","25","20.18.09","ニュース|NEWS|ANN|テレビ朝日|テレ朝|tvasahi|TV ASAHI|provided|菅内閣|記者会見|行政改革|河野大臣|会見|在り方|苦言","1123286","19255","516","3025","https://i.ytimg.com/vi/j-T0v7t2JvA/default.jpg","False","False","菅内閣の最初の記者会見で、行政改革を担当する河野大臣が会見の在り方に苦言を呈しました。　河野行政改革担当大臣：「例えば、この記者会見も各省に大臣が散ってやれば、もう今ごろ皆が終わって寝てますよね。それを延々ここでやるっていうのは前例主義、既得権、権威主義の最たるものだと思いますので、こんなものさっさとやめたらいいと思います」　新内閣の発足時は大臣が順番に会見を行うのが慣例で、河野大臣は14番目でした。会見は17日午前1時ごろに始まり、河野大臣は「霞が関のブラックなところを是正しないと人材が集まらない」とも訴えました。　一方、デジタル改革を担当する平井大臣は菅総理が提唱するデジタル庁の創設に向け、取り組みを進める考えを示しました。[テレ朝ｎｅｗｓ] https://news.tv-asahi.co.jp","PT1M1S"
"CUY9beBLIKM","FINAL FANTASY XVI “AWAKENING”","2020-09-16T20:16:04Z","UC6SmH9mR82nj28_NNg_rZvA","スクウェア・エニックス","20","20.18.09","スクウェア･エニックス|スクエニ|SQUARE ENIX|スクエア|FF16|FFXVI|Final Fantasy XVI|Final Fantasy 16|ファイナルファンタジーXVI|ファイナルファンタジー16|PlayStation5|PS5","1069351","0","0","0","https://i.ytimg.com/vi/CUY9beBLIKM/default.jpg","True","True","「これは、クリスタルの加護を断ち切るための物語」Official Twitter：https://twitter.com/FF16_JP#FF16　#PS5","PT4M"
"jytHODUS8bk","本日リリース！iOS 14アップデートの主要新機能をまとめて試す・AirPods Proの空間オーディオが凄い！","2020-09-17T11:27:11Z","UCCD76tKlE45u1YTX0cVh1OQ","Appleが大好きなんだよ","26","20.18.09","Apple|WWDC|iOS14|iPhone|iPhone 12|iPhone 12 Pro|Appleのニュース|Appleが大好きなんだよ|5G|A14|A13|carkey|空間オーディオ|AirPods Pro|ウィジェット|ピクチャ・イン・ピクチャ|Appライブラリ|サイクリング|翻訳|背面タップ","130136","2468","128","40","https://i.ytimg.com/vi/jytHODUS8bk/default.jpg","False","False","本日明け方に正式版がリリースされた「iOS 14」をiPhone 11 Proにインストールして主要機能をチェックしました。強くマークをしてなかったAirPods Proの空間オーディオに度肝を抜かれましたよ！＜iOS 14＞https://www.apple.com/jp/ios/ios-14/全部はお見せできないのでこちらをチェックしてください。＜関連動画＞関連動画＞予約開始！10分でわかるApple Watch Series 6とSEまとめ・SEのGPSモデルはお買い得！https://youtu.be/mdRhd8qb6CM＜速報＞Appleイベントを14分に要約！9/16午前2時開催・Apple Watch Series 6にiPad Air 第4世代などhttps://youtu.be/A4L6xz15bxI今夜発表？フライング入手のiPad Air 4用ケースからわかった事・噂の再まとめと日本の価格の勝手予測もしてみましたhttps://youtu.be/-LUU_-M3L3g頑張って使わない！iPadのユル系用途が好きすぎる・気軽に手軽に使えるからこそ iPadってオススメhttps://youtu.be/PS1_Pq7-SRE撮影機材・Panasonic Lumix GH5s・Panasonic Lumix GH5・Canon Power Shot G7X Mark II ・iPhone 11 Pro（Simフリー）・iPhone 11（Simフリー）・iPhone XS Max（Simフリー）・iPhone X（Simフリー）・iPadPro 11”（Simフリー）・DJI OSMO Pocket・Moment  iPhone 外付けレンズ＆専用ケース動画編集Final Cut Pro XAdobe Illustrator(スライド)Adobe Photoshop(スライド）Adobe Character Animator（アニメーション）※チャンネル全般で使っているものであって動画によって機材アプリは違います。#iPhone#iOS14#iPhone12","PT14M31S"
"MYawpxus2PA","【PS5予約戦争-徹底攻略】予約ページリンク先あり！予約の注意点も！ 本日予約開始！ PS5の予約方法、 みなきゃ損！ PS5","2020-09-17T07:00:35Z","UCBERF7Bp43yKWe-9e3fqoqw","Dゲイル","20","20.18.09","最新情報|ps4|ps5|SONY|割引|速報|まとめ|プレステ5|プレイステーション5|XboxシリーズX|XBOXSX|新作|SIE|Dゲイル|ソニー","290318","4701","289","1443","https://i.ytimg.com/vi/MYawpxus2PA/default.jpg","False","False","#PS5#PS5予約#PS5の予約※概要欄ではなく固定コメントでＰＳ５の予約情報は記載することになりました。■ツイッターではPS5の予約情報をリアルタイムで更新！https://twitter.com/DGalle___?s=09メインチャンネル以外の情報発信","PT16M11S"
"tefhjNW_b9A","私の病気について。今まで隠していた話。","2020-09-17T10:00:30Z","UCySfIDBkBFIICu4Bm0qwtSA","ゆりいちちゃんねる","24","20.18.09","ゆりいちちゃんねる|ゆりな|いちろー|カップル|彼氏|彼女|恋愛|病気|持病|シェーグレン症候群|シェーグレン症候群|症状|リウマチ|関節リウマチ|リウマチ|症状|リウマチ|原因|シェーグレン症候群|原因|全身性エリテマトーデス|全身性エリテマトーデス|症状|全身性エリテマトーデス|原因|難病|指定難病|膠原病|自己免疫疾患|入院|闘病|闘病期|病気について","505829","14487","372","1338","https://i.ytimg.com/vi/tefhjNW_b9A/default.jpg","False","False","たくさんのコメント本当にありがとうございます。ゆりなより。今日も#ゆりいちちゃんねる を見てくださりありがとうございます(*ˊᵕˋ*)❤コメントや、動画のリクエスト待ってます💌チャンネル登録もぜひ！！よろしくお願いします！！💗Yurina💗【Instagram 】@riri_yurina→https://www.instagram.com/riri_yurina【Twitter】@x_x_yurina_x_x→https://twitter.com/x_x_yurina_x_x💙ICHIRO💙【Instagram】@rin_ichiro→http://instagram.com/rin_ichiro【Twitter】@ichitribe129→https://twitter.com/ichitribe129💜YURIICHI💜【Twitter】→ https://mobile.twitter.com/yuriichich...【Ameba】→https://ameblo.jp/riri-yurina❣️ファンレター・プレゼント送り先❣️〒154-0005東京都目黒区大橋2-16-23 セントヒルズ池尻11Fお仕事の依頼はこちらから♪→yuriichi@libertytown.co.jp","PT22M4S"
"T-_wJZE2VjU","負けたら全額返金！芦澤竜誠オーディション②続編 また乱入！？嘘でしょサプライズ展開｜9.22 PPV生中継「芦澤竜誠を殴りたいやつ、大募集」","2020-09-16T09:41:10Z","UClPKS7S62cwYYaq6udr-G-Q","ABEMA 格闘CH【公式】","17","20.18.09","ABEMA|AbemaTV|アベマ|あべま|abema|芦澤竜誠|アンチ|キックボクシング|K-1|DX|格闘技|乱入","496647","3238","497","919","https://i.ytimg.com/vi/T-_wJZE2VjU/default.jpg","False","False","負けたら全額返金！芦澤竜誠オーディション②続編 また乱入！？嘘でしょサプライズ展開｜9.22 PPV生中継「芦澤竜誠を殴りたいやつ、大募集」◆「K-1 DX「芦澤竜誠を殴りたいやつ、大募集」」9/22ごご7時30分～ABEMAで完全生中継！購入はこちら▷https://abe.ma/3c3VQBP ▷▷放送後も全試合Webからノーカットで見られます◁◁（アプリダウンロードなし ＆ 登録なし）◇ABEMA 格闘Ch公式チャンネルを登録して番組の見どころ・最新情報を受け取ろう！チャンネル登録▷ https://www.youtube.com/channel/UClPKS7S62cwYYaq6udr-G-Q ▼番組詳細------------------------------------------------------------長きにわたり姿を消していた芦澤竜誠が復活を遂げる！呼び出されて撮影に臨んだスタッフに告げられたのは「俺のアンチファンは俺に勝てると本気で思ってる」「格闘家×YouTuberコラボは偽物！」と怒りに満ちたふたつの思い。そこで動き出した驚愕の新企画「芦澤竜誠を殴りたいやつ大募集！」しかも参加者は2人組 ３人で芦澤と戦う！芦澤がムカついて仕方がない方・・・本気で芦澤を殴りたい方・・下記募集欄からご応募お待ちしています！https://abe.ma/2EWvRQs特典①9月15日（火）昼12時までにチケットをご購入いただいた方の中から抽選で50名様に、本配信を行う会場で実際に試合を観戦できるチケットをご用意いたします。特典②9日15日（火曜）昼12時までにチケットをご購入いただいた方は、もれなく「リモート観戦」にもご参加いただけます。「リモート観戦」では、会場と視聴者をリモートで繋ぎ、会場の壁面に映し出すことで、視聴者は自宅でライブビューイングをしながら、まるで会場にいるかのような“特等席”で試合を応援することができます。特典③9月15日（水）昼12時までにチケットをご購入いただいた方の中から抽選で10組20名様に、9月22日（火）大阪エディオンアリーナで開催される「K-1 WORLD GP 2020 JAPAN」（詳細：https://www.k-1.co.jp/k-1wgp/schedule/16518/）のチケットをプレゼントいたします。※特典①②③ともに、9月15日（火）昼12時以降順次、ABEMA内「ギフトボックス」にてお知らせいたします。通知は予告なく遅れることがございます。あらかじめご了承ください。※特典①②③ともに、発送先およびご連絡先を記載フォームにてご入力いただきます。※本公演は、ABEMA独占配信となります※こちらの放送は、見逃し視聴、追っかけ再生が利用可能です※放送終了後、2週間は購入/視聴が可能となります※放送終了時間は告知なく前後する可能性がございます #ABEMA#芦澤竜誠#DX------------------------------------------------------------※YouTubeの動画には一部ミュート(消音)となっている部分がございますのでご了承ください※YouTubeの動画には掲載期限があり、予告なく掲載をおろす場合がございますのでご了承ください▼▼▼▼▼▼▼▼▼▼▼▼▼▼▼▼▼▼専門YouTubeチャンネルが続々オープン中！恋愛リアリティーショーCh：https://www.youtube.com/channel/UCfgQFWzaw7HfaKN-uVIf73QバラエティCh：https://www.youtube.com/channel/UC9OvLVXb-okaVtoK9V8Biwg夜あそびCh：https://www.youtube.com/channel/UCCqbFzCTb3HwWHmMJl2DJIgアベプラCh：https://www.youtube.com/channel/UCB1dgsqLiEp57oDAyNV_vwwニュースCh：https://www.youtube.com/channel/UCk5a240pQsTVT9CWPnTyIJw/今日好きCh：https://www.youtube.com/channel/UCzXVsEc1h2Elljge0fnQYRg恋ステCh：https://www.youtube.com/channel/UCe816MskSn1I90H02pVzHTg将棋CH：https://www.youtube.com/channel/UC2Fj0jEiCpmlbofC8Wiexfg※その他COMING SOON！▲▲▲▲▲▲▲▲▲▲▲▲▲▲▲▲▲▲ ▷公式SNSでも見どころ配信中！公式Instagram：https://www.instagram.com/abema_official公式LINE：https://line.me/R/ti/p/%40abema公式Twitter：https://twitter.com/ABEMA公式Facebook：https://www.facebook.com/ABEMAofficial▷ABEMAアプリをダウンロード(登録なし・無料)iOS：https://abe.ma/2NBqzZuAndroid：https://abe.ma/2JL0K7b","PT4M41S"
"02-sfNfECbo","Snow Man「KISSIN’ MY LIPS / Stories」特典映像（ダイジェスト）","2020-09-16T08:00:01Z","UCuFPaemAaMR8R5cHzjy23dQ","Snow Man","10","20.18.09","Snow Man|スノーマン|岩本 照|Hikaru Iwamoto|深澤 辰哉|Tatsuya Fukazawa|ラウール|Raul|渡辺 翔太|Shota Watanabe|向井 康二|Koji Mukai|阿部 亮平|Ryohei Abe|目黒 蓮|Ren Meguro|宮舘 涼太|Ryota Miyadate|佐久間 大介|Daisuke Sakuma|滝沢秀明|タッキー|アクロバット|KISSIN' MY LIPS|Stories|ブラッククローバー|ブラクロ|特典映像","705269","0","0","3151","https://i.ytimg.com/vi/02-sfNfECbo/default.jpg","False","True","2020.10.07 2nd Single Release！ Snow Man「KISSIN’ MY LIPS / Stories」 初回盤BのDVDに収録される「撮り下ろし特典映像 真実を暴け！JOKERゲーム」のダイジェスト映像を公開！果たして、わざと失敗しているJOKERは誰なのか…！本編をお楽しみに！「KISSIN’ MY LIPS」のMusic Videoはコチラhttps://www.youtube.com/watch?v=gsR-bbdGn_I●初回盤A（CD+DVD） 品番：AVCD-94848B 価格：1,600（税抜） ￥1,760（税込） スリーブ仕様 動画A視聴シリアルナンバー封入 【CD収録内容】 01. KISSIN’ MY LIPS 02.Stories 【DVD収録内容】 ・「KISSIN’ MY LIPS」 Music Video ・「Stories」Music Video ・「Stories」Dance Video ・ジャケット/Music Videoメイキング映像 ●初回盤B（CD+DVD） 品番：AVCD-94849B 価格：1,600（税抜） ￥1,760（税込） スリーブ仕様 動画B視聴シリアルナンバー封入 【CD収録内容】 01. KISSIN' MY LIPS 02. Stories 【DVD収録内容】 ・「KISSIN’ MY LIPS」マルチアングル映像・ 撮り下ろし特典映像 真実を暴け！JOKERゲーム ●通常盤（CD） 品番：AVCD-94850X 価格：1,000（税抜） ￥1,100（税込） 初回仕様：スリーブケース、26Pフォトブック 動画C視聴シリアルナンバー封入 【CD収録内容】01. KISSIN’ MY LIPS 02. Stories 03. 君の彼氏になりたい。04. ファンターナモーレ 05.「KISSIN’ MY LIPS」Instrumental 06.「Stories」Instrumental 07.「君の彼氏になりたい。」Instrumental 08.「ファンターナモーレ」Instrumental 09.ボイスドラマ 2ndシングル「KISSIN’ MY LIPS / Stories」のご予約はこちら！ ◆初回盤A https://avex.lnk.to/SnowManAVCD94848 ◆初回盤B https://avex.lnk.to/SnowManAVCD94849 ◆通常盤 https://avex.lnk.to/SnowManAVCD94850#SnowMan #くちびるものがたる #スノStoriesSnow Man オフィシャルサイトhttps://avex.jp/snowman/Snow Man on ジャニーズJr.チャンネル https://goo.gl/UXB2Ms Weibohttps://www.weibo.com/SnowManofficialJohnny's nethttp://www.johnnys-net.jp/ISLAND TVhttps://j-island.net/artist/group/id/4","PT5M2S"
"3zxY3T5nAI4","Nintendo Switch『モンスターハンターライズ』プロモーション映像","2020-09-17T14:25:57Z","UCyuEAZQzRqhcaLZvQd9ZUNA","CapcomChannel","20","20.18.09","CAPCOM|モンスターハンターライズ|モンハン ライズ|monsterhunter rise|スイッチ|Nintendo Switch|ハンティングアクション|RPG|アクション|モンハン|狩り|オトモ|ガルク|携帯モンハン","330701","8183","489","0","https://i.ytimg.com/vi/3zxY3T5nAI4/default.jpg","True","False","公式サイト https://www.capcom.co.jp/monsterhunter/rise/---モンスターハンターライズ対応機種：Nintendo Switch発売日：2021年3月26日（金） 予定ジャンル：ハンティングアクションプレイ人数：1人（オンライン:1～4人）※インターネット通信プレイ、ローカル通信プレイ対応CERO：審査予定※インターネットに接続して遠くのプレイヤーと協力プレイを行う場合は、Nintendo Switch Online（有料）への加入が必要です。","PT2M33S"
"sgcRW7j_SeA","【殴られ屋企画】K-1世界王者、木村フィリップミノルに15秒間殴られ続けた結果...","2020-09-17T09:00:12Z","UCcf_hIfQz1jir7f8NrlJqkQ","福地勇人Yuto Fukuchi空手世界チャンピオン","17","20.18.09","木村フィリップミノル|k-1|福地勇人|空手|RIZIN|朝倉未来|朝倉海|京口紘人|ボクシング|那須川天心|武尊|殴られ屋|パンチ|安保","128081","1476","36","297","https://i.ytimg.com/vi/sgcRW7j_SeA/default.jpg","False","False","k-1スーパーウェルター級王者木村”フィリップ“ミノル選手のチャンネル　　　　　　　↓https://youtu.be/4RLyZQwHAMAありがとうございました！‪【KOアーティスト】木村“フィリップ“ミノルに挑んでみた https://youtu.be/u3Bc0X2gHQY‬木村選手と手押し相撲対決！フルコンタクトチャンネル　　　　　↓https://youtu.be/CVDYm-CSN5s佐々木先生チャンネルhttps://youtu.be/OvCMpKeSFJk空手家仲間の空手家チャンネルhttps://youtu.be/mrQCSJ_qfaQお仕事の依頼はこちらの方までyuto.byakuren890@gmail.com福地勇人　公式Twitterhttps://mobile.twitter.com/byakurenyuto福地勇人　公式Instagramhttps://www.instagram.com/yutoway/白蓮会館福地道場HPhttp://fukuchi-dojo.com/","PT11M20S"
"lFtIwe4lcPw","『バイオハザード　ヴィレッジ』2nd Trailer","2020-09-16T20:48:35Z","UCbReH8gzVeGr6wuQHEOiHFA","biohazard","20","20.18.09","バイオハザード|ヴィレッジ|BIOHAZARD VILLAGE|バイオハザード|ヴィレッジ|BIOHAZARD|VILLAGE|イーサン|クリス|バイオハザード8|バイオ8|カプコン|CAPCOM|PlayStation5|PS5|Xbox Series X|Steam","277390","3653","109","0","https://i.ytimg.com/vi/lFtIwe4lcPw/default.jpg","True","False","公式サイト⇒http://www.capcom.co.jp/biohazard/village/バイオハザード　ヴィレッジ■発売日：2021年発売予定■対応ハード：PlayStation®5、Xbox Series X、PC（Steam）■ジャンル：サバイバルホラー■プレイ人数：1人■CEROレーティング：審査予定ロゴに“VIII”を冠した『バイオハザード ヴィレッジ』が目指すのは誰も見たことがないサバイバルホラー。悪夢のような事件から数年ーイーサン・ウィンターズは家族とのありふれた日常を取り戻していた。その日常を奪ったのはクリス・レッドフィールド、暗い横顔に歴戦の勇士の面影はなかった。","PT2M48S"
