video_id,title,publishedAt,channelId,channelTitle,categoryId,trending_date,tags,view_count,likes,dislikes,comment_count,thumbnail_link,comments_disabled,ratings_disabled,description,duration
"cWmLYM3qk3A","師匠、新しいバイクをちょっと高めのTシャツを買うくらいの感じで買う。【中尾明慶くんとノープランツーリング】","2020-09-13T09:00:15Z","UCU5yxbI6JKh1tAiJEI5f5fQ","ハンバーグ師匠チャンネル〜音楽フェス開催への道〜","24","20.18.09","#スピードワゴン|#ハンバーグ師匠|#井戸田潤|#小沢一敬|#ハンバーグ|#デミグラス|#ハンバーグフェス|#ハーレー|#harley|#カスタム|#バイク|#fxdl|#ローライダー|#都内|#モトブログ|#ツーリング|#中尾明慶|#あのハーレー|#ソープランドピンク|#Kawasaki|#Z750FX|#バイク購入|#ハンターカブ|#バイク買う|納車","765010","9826","245","778","https://i.ytimg.com/vi/cWmLYM3qk3A/default.jpg","False","False","今回は中尾明慶くんとの「ノープランツーリング」後編！話の流れで、なぜか新しいバイクを買う事になったぜ！しかも、中尾明慶くんが選んだバイクを買う事に・・・！果たして、ノリと勢いで購入したバイクとは・・・！？最後まで、見届けてくれよな！★中尾明慶くんとの「ノープランツーリング」前編はコチラ！→https://youtu.be/68OlKR6fCqQ●中尾明慶くんのチャンネルでのコラボ動画はコチラ！→https://youtu.be/Sbbf47CSPTY●中尾明慶くんのチャンネル　「中尾明慶のきつねさーん」はコチラ！→https://www.youtube.com/channel/UCqlS-_VjKVfHmNYzbYVcN7w●今回、お邪魔した「ホンダドリーム新宿」さんのHPはコチラ！　→http://www.sakurai-honda.co.jp/dream_shinjuku/ーーーーーーーーーーーーーーーーーーーーー★師匠のこれまでの「ハーレーツーリング動画」はこちら！　①初ツーリング→https://youtu.be/uP3m_Vt2Hss　②ハーレー故郷に帰る 前編→https://youtu.be/xB6BZU1DaUE　③ハーレー故郷に帰る 後編→https://youtu.be/wvgF4ODmW-E#ハンバーグ師匠#中尾明慶#ハーレー#ハンバーグフェス#バイク#ツーリング#カスタム#harley#バイク買うーーーーーーーーーーーーーーーーーーーーー「ハンバーグ師匠 フェス開催への道」は、週に３回、水曜日、土曜日、日曜日の夜６時にアップするぜ！※他の曜日にアップされる時もありますよかったら、チャンネル登録もお願いするぜ！https://www.youtube.com/channel/UCU5yxbI6JKh1tAiJEI5f5fQ/featured?view_as=subscriberTwitter＆Instagramもフォローしてくれると嬉しいぜ！▶︎Twitterhttps://twitter.com/junjunitojun▶︎Instagramhttps://www.instagram.com/jujuju_101010お仕事のご依頼等はこちら→spwhamburg.1213@gmail.com★小沢君のYouTubeチャンネルはコチラ！　スピードワゴン小沢一敬YouTube channel「スピードワゴン小沢のオザワ倶楽部」　→https://www.youtube.com/channel/UCobq8FTmlbctw88uB2NCJ6wハンバーグ師匠がフェス開催を目指すキッカケになった曲だぜ！▶︎川谷絵音さん作詞・作曲・完全プロデュース　ハンバーグ師匠「TOKYOハンバーグ」MVhttps://www.youtube.com/watch?v=KO9gVzVTRcU","PT15M34S"
"C4eKoIap8DM","カップルYouTuberになるとどうなるのか？【アニメ】【漫画動画】","2020-09-13T09:00:02Z","UCo_nZN5yB0rmfoPBVjYRMmw","全力回避フラグちゃん!","1","20.18.09","全力回避フラグちゃん|フラグちゃん|アニメ|漫画|マンガ|まんが|漫画動画|マンガ動画","424861","5814","419","673","https://i.ytimg.com/vi/C4eKoIap8DM/default.jpg","False","False","チャンネル登録、高評価よろしくお願いします！https://www.youtube.com/channel/UCo_nZN5yB0rmfoPBVjYRMmw?sub_confirm=1フラグちゃんLINEスタンプ発売中です！https://store.line.me/stickershop/product/12763172ツイッターもフォローしてくれると嬉しいです！https://twitter.com/flag__chanファンアートなどは# フラグちゃんでツイートしてくださいね！◆お問い合わせやお仕事の依頼はこちらflagchan@plott.tokyo原作：bikihttps://twitter.com/biki_relic企画・製作：株式会社Plott【使用している音楽素材など】audiostock https://audiostock.jp/http://www.music-note.jp/index.htmlhttps://taira-komori.jpn.org/human01.htmlhttps://soundeffect-lab.info/sound/anime/","PT6M18S"
"1XXJ0MxPP6c","【密着ドキュメント】「緊急手術、その時家族は…前編」美奈子号泣…その訳とは？","2020-09-12T11:00:01Z","UC4y3TWIq94xMa81o7NdF_5g","美奈子ファミリーTV","24","20.18.09","#大家族|＃美奈子ファミリー|＃佐々木家|＃ザ・ノンフィクション|＃新・漂流家族|＃重大発表|＃衝撃の事実|＃密着取材|＃ドキュメンタリー|＃痛快ビッグダディ|美奈子ファミリーTV|ルーティーン|企画|日常|緊急|手術|絆|号泣|感動|密着|ノンフィクション|密着取材","406532","4797","1145","757","https://i.ytimg.com/vi/1XXJ0MxPP6c/default.jpg","False","False","先日、胆石の緊急手術を受けた美奈子さん。その入院当日の様子、そして退院までの軌跡に密着したショートドキュメンタリー。「母が緊急手術、その時家族は…」前編をお届けします。手術への不安、子供たちと離れる事への不安…大家族の母親としての葛藤…そして涙の入院…そこには母の帰りを心待ちにして助け合う父と子の姿がありました。「家族の絆」を問うドキュメンタリーです。是非ご覧ください！#美奈子ファミリーTV #ドキュメンタリー #新漂流家族サブチャンネル【美奈子ファミリーのひみつきち。】https://www.youtube.com/channel/UCL0cf2bxr6iaxLpYXYv7YfQ使用音源「DOVA-SYNDROME」https://dova-s.jp「OtoLogic」https://otologic.jp/「Nota no Mori」http://notanomori.net/使用画像「イラストAC」https://www.ac-illust.com/「フォトAC」www.photo-ac.com家族イラスト「猫田まんじまる」　https://twitter.com/shizuharamaika「美奈子ファミリーTV」https://youtu.be/YcGcosKb_6Mお仕事のご依頼はminako.info@gmail.com美奈子ファミリー　公式アメーバブログhttps://ameblo.jp/minako-officialblog/.美奈子　公式LINEブログhttps://linebrog.me/minako/.美奈子　公式インスタグラムhttps://www.instagram.com美奈子　公式ツイッターhttps://twitter.com/minako7love0223美奈子ファミリーTV公式TikTokhttps://vt.tiktok.com/N32ttx/美奈子ファミリー公式Facebookhttps://www.facebook.com/profile.php?id=100046328482303上記SNSで美奈子ファミリーの最新情報をお知らせします！チャンネル登録＆フォローお願いいたします！","PT33M43S"
"eyBDkwt4cwE","夜に駆ける/YOASOBI 【あやなんcover】【本気レコーディングver】","2020-09-13T12:39:46Z","UCAne8GG-iUcTzUkpQG4N7jw","しばなんといっしょ!","24","20.18.09","家族|ポンス|しばなん|カップル|Youtuber|しばゆー|あやなん|東海オンエア|キッズチャンネル|子どもが喜ぶ|子ども|赤ちゃん|しばなんチャンネル","461198","16339","770","1104","https://i.ytimg.com/vi/eyBDkwt4cwE/default.jpg","False","False","※ピアノは、弾いてるように見えて   全く弾いておりませんご了承ください。しばなんのサブチャンネルです⭐ゆったりまったり楽しんでね〜見てくれてありがとう！あやなんのTwitterhttps://twitter.com/ayachan0619しばゆーのTwitterhttps://twitter.com/TOKAI_ONAIRチャンネル登録よろしくお願いします！！「しばなんちゃんねる」はこちら→https://www.youtube.com/channel/UColoXxvhfz54o0icqQRPzYw","PT4M20S"
"glMinpCOQSw","【謝罪】退去宣告を受けました。家が無くなります。","2020-09-12T11:30:44Z","UC2iHI3kGrPcXeluLZ8H1CEA","渥美拓馬/Takuma Atsumi","24","20.18.09","料理|釣り|魚|魚釣り|バーベキュー|BBQ|海|川|水路|池|cook|cooking|怪魚|巨大魚|ブラックバス|包丁|アマゾン|カエル|ザリガニ|車|アウトドア|outdoor|バス釣り|タエニア|ハネモノ","516077","7829","858","802","https://i.ytimg.com/vi/glMinpCOQSw/default.jpg","False","False","楽しみにしてくれていた方、本当に申し訳ありません。きまぐれクック：https://www.youtube.com/user/toruteliにしやん会長：https://www.youtube.com/channel/UCwJ0csCsSiievLHk3K0_IVw☐セカンドチャンネル：https://www.youtube.com/channel/UCBqyhgvzbzyqzvty4w-0Ihg☐『Abyss』HP：https://abyssshop.official.ec/☐twitter：https://twitter.com/TakumaAtsumi☐facebook：https://www.facebook.com/takuma.atsumi.1☐instagram：https://www.instagram.com/atsumi.takuma/■プレゼント、お手紙などの宛先はこちら（※生物、冷蔵便は受け取りができません）〒150-0031東京都渋谷区桜丘町20-1渋谷インフォスタワー17階「株式会社Kiii 渥美拓馬」宛☆お仕事の依頼等→https://kiii.co.jp/contact/■使用音源http://dova-s.jp/https://audiostock.jp/","PT19M20S"
"-c-5yluoVaM","【2年ぶり】お悩み相談コーナー！浮気された時の話ｗｗｗ【ぽんりさQ&A】","2020-09-12T10:02:51Z","UCgpq8b6bCzkSLquNQeSE6QQ","Kawanishi Mikiかわにしみき","22","20.18.09","河西美希|美希ぽん|みきぽん|mikipon|Kawanishi Miki|かわにしみき|みきかわにし|ぽんりさ|質問コーナー|お悩み|相談|雑談","449926","9271","287","686","https://i.ytimg.com/vi/-c-5yluoVaM/default.jpg","False","False","◥◤りささんのチャンネルはこちら！https://www.youtube.com/channel/UC__AsSnEuyVgO9TWvZE_ziA前回のぽんりさ動画はこちらhttps://youtu.be/i9wX75UAXXcいつも動画を見てくれてありがとうございます！▼Twitterhttps://twitter.com/mikipon11▼インスタグラムhttp://instagram.com/mikipon1111▼コラボコスメ販売中！✨https://bit.ly/2BjTVdZ▼初のスタイルブック📖https://amzn.to/2Q6REqn▼ラインはじめました！返事めっちゃ早いよhttps://lin.ee/eELj07z▼LINEスタンプhttps://store.line.me/stickershop/product/9177377▼適当すぎhttps://www.youtube.com/channel/UCpvjh6V8l1oCztJZoZNHzSg▼グッズ（いつ作ったか覚えてない）https://uuum.skiyaki.net/mikipon▼コスメレビューLIPShttps://lipscosme.com/users/164440※月に１枚届くか届かないかのファンレター宛先〒107-0052東京都港区赤坂9丁目7番1号 ミッドタウン・タワー 28階 UUUM株式会社 かわにしみき 宛日頃の報告とか雑談お手紙でお待ちしてます♡あ、プリクラとか写真を付けて頂けると嬉しいです😚▼お仕事のご連絡kawanishimiki.info@gmail.com","PT23M54S"
"46xJGI2LHgs","【第二話】清原と語る、打撃理論と鉄拳制裁","2020-09-13T10:00:01Z","UCKa1VlSq1WwdSQWv4JFdgxg","デーブ大久保チャンネル","17","20.18.09","プロ野球|野球選手|野球|広島|阪神|横浜DeNA|読売ジャイアンツ|中日|巨人|ソフトバンク|西武|楽天|清原|デーブ大久保|ピッチャー","451103","5515","288","399","https://i.ytimg.com/vi/46xJGI2LHgs/default.jpg","False","False","■デーブ大久保 プロフィール2020年6月〜YouTubeを始めることにしました。プロ野球界の現在や過去のエピソードを幅広く配信していきたいと思います。2008年西武ライオンズ日本一一軍打撃コーチ、元東北楽天ゴールデンイーグルス一軍監督【Twitter】デーブ大久保(＠DAVEOHKUBO）➡︎https://twitter.com/DAVEOHKUBO■デーブ・ベースボールアカデミーHPはこちらhttp://www.dba-school.jp■撮影場所　新橋の居酒屋　肉蔵でーぶ　https://tabelog.com/tokyo/A1301/A130103/13193033/#プロ野球　#野球　#清原和博","PT16M45S"
"Of1ohQ7qDHY","【記念すべき初コラボ！】オリエンタルラジオ藤森さんとドライブトーク【後編】","2020-09-12T09:00:05Z","UCKfIRa0Zhs6HQ33a_L6Tc5Q","生駒里奈 'IKOMACHANNEL'","24","20.18.09","生駒里奈|生駒ちゃん|モデル|女優|乃木坂|アイドル|AKB48|卒業|メイク|いこまちゃん|乃木坂46|乃木|のぎ|ドライブ|藤森慎吾","253711","7126","194","552","https://i.ytimg.com/vi/Of1ohQ7qDHY/default.jpg","False","False","＜前編はこちらから＞https://youtu.be/LlQ2xm4Y8eIオリエンタルラジオ藤森さんのチャンネルはこちら！https://www.youtube.com/channel/UC25Ah0_XF2lOUwWV9VSfl2g/生駒里奈です！「IKOMACHANNEL」初のコラボ動画！初コラボのお相手は、公私ともにたっくさんお世話になっているオリエンタルラジオの藤森慎吾さん！初めてのコラボは藤森さんがいい！とずっと思っていたので今回実現できて嬉しいです！藤森さんとだからこそお話しできるようなこともたくさん出てくるので、みなさんぜひ見てください！藤森さん、コラボしていただいてありがとうございましたっ！■オフィシャルウェブサイトhttps://ikomarina.com/■オフィシャルファンクラブ「モノクローズ」https://ikomarina.com/feature/entry■オフィシャルSNSTwitter：https://twitter.com/ikomarina_staff Instagram：https://www.instagram.com/ikomarina_1... Facebook：https://www.facebook.com/IKOMARINAOFF... 【YouTubeに関するお問い合わせ】株式会社A.M.Entertainmenthttp://ament.co.jp/#生駒里奈 #藤森慎吾 さん#ドライブ","PT13M5S"
"71r8TtDchWQ","かまちょな彼女を無視し続けたら反応が可愛すぎました…【モニタリング】【ゆたせな】","2020-09-12T10:00:01Z","UCeYxosL6fjp_DTEQBmH8GSA","ゆたせな Yuta and Seina","24","20.18.09","カップル|ゆたせな|モニタリング|ドッキリ|検証|無視|彼女|可愛い|甘えん坊","157038","7711","358","563","https://i.ytimg.com/vi/71r8TtDchWQ/default.jpg","False","False","ゆたせな初のオンラインイベントが決定しました🍒🌈2対1で1分間お話することができるイベントです！オリジナルのステッカーも販売してます🌼💖特典付き購入サイト⬇️⬇️https://groveshop.net/items/5f507d933475ed1075679dfb特典なし購入サイト⬇️⬇️https://groveshop.net/items/5f51d1772742d762d480667eチャンネル登録 はこちらから↓↓https://www.youtube.com/channel/UCeYxosL6fjp_DTEQBmH8GSAサブチャンネル「ゆたせなランド」はこちら↓↓https://www.youtube.com/channel/UC0-S20lE_ua0iD7Tz1fTk7Aゆたせなのゆる〜い日常やトーク、VLOGを配信🌈TikTokはこちら↓https://vt.tiktok.com/MCnoYD/Instagramはこちら↓ユウタhttps://www.instagram.com/yaginoyutaセイナhttps://www.instagram.com/sei__panクレココ🐶https://www.instagram.com/c_cworldTwitterはこちら↓↓ユウタ＠yaginoyuta2セイナ@sei__pan2ファンレターやプレゼントはこちらにお願い致します。〒106-6131東京都港区六本木6-10-1六本木ヒルズ森タワー31FGROVE株式会社ゆたせな宛お仕事の依頼はこちらからお願い致します。grove-obata@anymindgroup.comコメントもたくさんお待ちしてます🍒🌈そして動画が少しでもいいなと思ったら高評価お願いします！！そしてSNSで拡散してくださると嬉しいです🥺🥺ご視聴ありがとうございました🙇‍♂️🙇‍♀️___________________________________BGM by Epidemic Soundhttps://www.epidemicsound.com___________________________________#モニタリング　#無視　#彼女","PT9M44S"
"faSMGtaaaTQ","【100万人記念LIVE】 全身がみるみるほぐれるヨガ！ 初心者にもオススメ☆ #390","2020-09-13T01:56:39Z","UCd0pUnH7i5CM-Y8xRe7cZVg","B-life","26","20.18.09","[none]","119347","5617","57","146","https://i.ytimg.com/vi/faSMGtaaaTQ/default.jpg","False","False","9月は久しぶりにワークショップを開催します。詳細は下記をご覧ください！https://www.blifetokyo.com/workshop-2020-9B-life書籍最新刊『魔法のピラティス』がいよいよ6月1日に発売決定！購入はこちら↓https://amzn.to/3avHlEtB-lifeオンラインサロン7日間無料！全部で100時間以上のLIVEレッスンが受けられます♪詳細はこちら↓https://lounge.dmm.com/detail/1005/------------------------------------------------------------------------------【B-lifeについて】動画の補足情報をブログで紹介していますhttps://www.blifetokyo.com/新しいカレンダープログラムやワークショップ等の情報をFacebookで配信していますhttps://www.facebook.com/blifetokyo/主に撮影裏側の写真や動画を載せていますhttps://www.instagram.com/blifetokyo/------------------------------------------------------------------------------【配信機材】Atem Minihttps://www.blackmagicdesign.com/jp/products/atemmini------------------------------------------------------------------------------【使用ウェア】　スタイリッシュでおしゃれな「KIT」のウェアを使用していますhttp://bit.ly/2Cpj8C4Marikoが動画内で着ているウェアhttp://bit.ly/2BlGQ0i","PT1H20M7S"
"gfC2hMxwNKs","石になるスプレーで石化してみた【恐怖のドッキリ】","2020-09-11T11:00:11Z","UCljYHFazflmGaDr5Lo90KmA","SUSHI RAMEN【Riku】","24","20.18.09","すしらーめん|りく|学生|おもしろ|動画|バカ|面白|実験|youtuber","1806837","56311","820","3846","https://i.ytimg.com/vi/gfC2hMxwNKs/default.jpg","False","False","※スプレーを直接肌に塗らないようにしましょう！（拙者は全身タイツの下にも一応防護服を着ております）--------------------------------------------------------この投稿頻度最弱チャンネルは、チャンネルメンバーシップ(村長、長老)様のご支援を受けて制作をしています。心の底からありがとうございます。より面白い動画を作れるように、恩返しできるように頑張ります！https://www.youtube.com/channel/UCljYHFazflmGaDr5Lo90KmA/join--------------------------------------------------------その辺にいる大学生です！「またあいつアホな事やってるな〜」っと気軽に友達感覚で見てもらえたら嬉しいです！Twitterなどで気軽にリクエスト飛ばしてね！◆グッズページ[🌱ZERO GRAVITY🌱]→ https://zerogravity.base.shop ◆◆Twitter→ https://twitter.com/sushi_riku?lang=ja ◆◆Instagram→ https://www.instagram.com/sushi_riku/?hl=ja ◆◆すしらーめん2nd!!→ https://goo.gl/XIAoCO ◆◆ブログ→ https://ameblo.jp/sushi-ramen/ ◆・企業様のお問い合わせは、直接Gmailの方に宜しくお願い致します。・翻訳をお手伝いしてくださる方がいらっしゃいましたらご連絡をお待ちしています！Business Mail→sushiramen.business@gmail.com","PT6M5S"
"-6TO899eBVI","【年俸など契約内容も予想!!】今年のFA選手の動向について大胆予想しました！","2020-09-12T10:15:00Z","UCFCtAX45lgHcf4s0vAgAxww","Satozaki Channel","17","20.18.09","プロ野球|野球選手|野球|広島|阪神|横浜DeNA|読売ジャイアンツ|中日|巨人|ソフトバンク|西武|楽天|清原|里崎智也|ピッチャー","370038","4047","307","2936","https://i.ytimg.com/vi/-6TO899eBVI/default.jpg","False","False","■里崎智也 プロフィールプロ野球生活1999〜2014年16年間ありがとうございました。引退を機に2019年3月〜YouTubeを始めることにしました。 今後の活動を始め幅広く配信していきたいと思います。 2006WBC優勝！ベストナイン！ 2005.2010ロッテ日本一！ベストナイン・ゴールデングラブ・最優秀バッテリー賞共に2度受賞！北京五輪出場■袴田彩会 プロフィール元東北放送アナウンサー楽天イーグルス初のリーグ優勝・日本一の際にビールかけリポートを経験。その後、ベンチリポーターやヒーローインタビューを担当。ヒーローインタビュー担当日は全試合楽天が勝利したため「勝利の女神」と呼ばれていた。現在は東京を拠点に活動している。【里崎智也のセカンドチャンネル】https://www.youtube.com/channel/UCu14_kv1oKLIQMbpYqFJsew?view_as=subscriber【高木豊さんのチャンネル】https://www.youtube.com/channel/UCgr5CkgytiVfdnk4C0M42nQ【片岡篤史さんのチャンネル】→https://www.youtube.com/channel/UCSFE1o0ihc5mfODf2FybeuA【岩本勉さんのチャンネル】→https://www.youtube.com/channel/UC7CeOxGzcmmxbf_Oacxf7sg/【森藤恵美さんのチャンネル】→https://www.youtube.com/channel/UC1Db9qogCZ3wMSPDbxgacag/【Twitter】里崎智也(@satozakitomoya)➡︎http://ur0.work/pwQk袴田彩会(@AyaeH1210)➡︎http://ur0.work/gYv1【TikTok】https://vt.tiktok.com/FRdomx/仕事の依頼はこちらへお願いします。→info@playfulinc.co.jp","PT16M8S"
"5D0ueTx2tvU","【CH.1 生配信】大会3日目『第53回 日本女子プロゴルフ選手権大会 コニカミノルタ杯』","2020-09-12T08:10:24Z","UCY2xPVc56SLntMOcoF-cnFA","JLPGA TV","17","20.18.09","JLPGA|LPGA|ゴルフ|女子ゴルフ|女子プロゴルフ|コニカミノルタ杯|日本女子プロゴルフ選手権大会|JFE瀬戸内海ゴルフ倶楽部|予選ラウンド|決勝ラウンド|鈴木愛|笹生|笹生優花|渡邉彩香|ライブ配信|生配信","558660","665","97","6","https://i.ytimg.com/vi/5D0ueTx2tvU/default.jpg","False","False","▼配信内容【CH1】トーナメント全体中継（実況・解説付き）第１組スタートから全組ホールアウトまで完全ライブ中継。テレビ放送クオリティと臨場感のある音で全ホールカバーします。弾道表示システムも導入。▼その他のチャンネル【CH2】練習場・１６番・選手インタビュー（実況・解説付き）こちらから→https://www.youtube.com/watch?v=MulP_Nl4GLI&list=PLqzJAT5Rl1sjTG0sbipqRRwR4dlAxBHeF&index=5スタート前の練習風景をじっくり観戦。さらに難易度の高い１６番ショートホールの映像、スタート前の注目選手や好成績を残した選手のホールアウトインタビューをお届けします。。■『第53回 日本女子プロゴルフ選手権大会 コニカミノルタ杯』の公式サイトhttps://champ.lpga.or.jp/2020/■開催日9月10日(木)予選ラウンド9月11日(金)予選ラウンド9月12日(土)決勝ラウンド9月13日(日)決勝ラウンド9月14日(月)予備日■開催コースJFE瀬戸内海ゴルフ倶楽部■主催一般社団法人日本女子プロゴルフ協会(JLPGA)・公式サイト　https://www.lpga.or.jp/・公式Twitter　https://twitter.com/JLPGA_official■後援スポーツ庁、岡山県、笠岡市、福山市、朝日放送テレビ株式会社■特別協賛コニカミノルタ株式会社■賞杯･賞状日本女子プロゴルフ選手権大会杯コニカミノルタ杯文部科学大臣杯文部科学大臣賞状■賞金2億円（優勝賞金3,600万円）■優勝副賞コニカミノルタA3カラー複合機「bizhub C250i」　提供：コニカミノルタ株式会社メルセデス・ベンツ　C Class C180　提供：メルセデス・ベンツ日本株式会社","PT8H27M57S"
"GDHNCuxWtPE","#26【中辛】本当にあった！？座ると呪われる椅子に座った結果・・・！","2020-09-12T10:00:04Z","UCqNEOVhcKpfdzcp9VgNcm0A","オウマガトキFILM","24","20.18.09","[none]","168155","4489","190","832","https://i.ytimg.com/vi/GDHNCuxWtPE/default.jpg","False","False","座ったら最後、呪われてしまう椅子ーバズビーズチェアー　は存在した！？知る人ぞ知る廃墟に存在する【呪われた椅子】を実際に座って検証！！一体どうなってしまったのか・・・！この動画の恐怖度は・・・甘口、中辛、辛口、激辛、超激辛の５段回のうち、【中辛】です。【企画・編集　ヒロ】恐怖度の目安・・・甘口、中辛、辛口、激辛、超激辛の５段回のうち、『犬鳴トンネル内部でテント張って一泊してみた』https://youtu.be/xgtkXCPY34E   が【激辛】です。【オウマガトキFILM】とは、心霊スポットや曰くのある場所に潜入、検証をするホラーエンターテイメント番組です。【オウマガトキFILM】では、あなたからの恐怖スポットの情報を随時お待ちしております！是非お問い合わせください！では、【オウマガトキ】始めます。ホラーエンタテインメント番組【オウマガトキFILM】メインパーソナリティ・ヒロ、トモカメラ・T【オウマガトキFILM】は、探索や肝試しを推奨している番組ではありません。これらの行為は自己責任であり、トラブル等の一切の責任は負いかねます。最新情報や、現場のオフショットを載せています。是非フォローお願いします！Twitter      → https://mobile.twitter.com/tomo_hiro_TInstagram→  https://www.instagram.com/o_magatoki/TikTok      →  https://vt.tiktok.com/6VyVxg/#心霊映像#心霊スポット#心霊#心霊番組 #心霊動画#心霊映像#怖い動画","PT20M41S"
