video_id,title,publishedAt,channelId,channelTitle,categoryId,trending_date,tags,view_count,likes,dislikes,comment_count,thumbnail_link,comments_disabled,ratings_disabled,description,duration
"VAZxSoKb65o","Taaron Ke Shehar Song: Neha Kakkar, Sunny Kaushal | Jubin Nautiyal,Jaani | Bhushan Kumar | Arvindr K","2020-09-20T10:18:21Z","UCq-Fj5jknLsUf-MWSy4_brA","T-Series","10","20.21.09","taaron ke shehar song|taron ke shehar|neha kakkar new song|neha kakkar new song 2020|jubin nautiyal new song|jubin nautiyal|neha kakkar|new hindi song 2020|2020 hindi songs|new hindi songs|2020 new songs|tseries|tseries songs|hit songs 2020|2020 film songs|bollywood songs|2020 songs|hindi 2020 songs|film songs|hindi movie songs|jaani songs|arvindr khaira songs|all new songs 2020|hindi romantic songs|romantic video status|sunny kaushal song","8219510","360640","14337","25792","https://i.ytimg.com/vi/VAZxSoKb65o/default.jpg","False","False","Gulshan Kumar and T-Series presents Bhushan Kumar's Taaron Ke Shehar sung by Neha Kakkar and Jubin Nautiyal. The song depicts a tale of an intense love story followed by pain and separation featuring Neha Kakkar & Sunny Kaushal. The song is composed and penned by Jaani.♪Stream full song here♪ JioSaavn: http://bit.ly/TaaronkeShehar--JioSaavnSpotify: http://bit.ly/TaaronkeShehar-SpotifyHungama: http://bit.ly/TaaronkeShehar-HungamaGaana: http://bit.ly/TaaronkeShehar-GaanaApple Music: http://bit.ly/TaaronkeShehar-AppleMusic iTunes: http://bit.ly/TaaronkeShehar-iTunesResso: http://bit.ly/TaaronkeShehar-RessoWynk: http://bit.ly/TaaronkeShehar-WynkGoogle Play: http://bit.ly/TaaronkeShehar-GooglePlay-------------------------------------------------------------------------------------Song: Taaron Ke SheharFeaturing:- Neha Kakkar & Sunny KaushalSingers:-Neha Kakkar & Jubin NautiyalLyrics, Composer and Music:- Jaani  Music Programming:- Gaurav Dev and Kartik Dev Mix & Mastered By:- Gurjinder Guri and akashNeha Kakkar's vocals recorded at AMV by Rahul M Sharma Assist By Samir DharapGuitar:- Shomu SealGuitars recorded at T series studioRecorded by Surajit Ghosh MazumdarVideo Director :- Arvindr KhairaCreative director/ Steadicam Operator:- Amaninder singhDop :- Anurag solankiAD’s :- Satnam Singh , Sukhman Sukhu , Jais SiviaAssistant AD’s :- Gurdeep singh , karanEditing :- ZipsiGrading :- Adolf D’SouzaStyling of Sunny Kaushal :- Jyoti Aneja and Lavika SinghStyling of Neha Kakkar :- Ritz , Lavika Singh , Jyoti AnejaVfx :- Inside Motion Pictures , LuvLine producer- Aadesh gola and vikrant kaushik (kreative productions)Teaser/Promo - Himanshu MishraProduction team- Usama chauhan, prashant, rahul dhir, lobe k lavania and sanchit aroraProduction designer- Diksha sharmaArt team- ashish modgil, rahul, parvinder and tanisha___________________________________Enjoy & stay connected with us!👉 Subscribe to T-Series: http://bit.ly/TSeriesYouTube👉  Like us on Facebook: https://www.facebook.com/tseriesmusic👉Follow us on Twitter: https://twitter.com/tseries👉 Follow us on Instagram: http://bit.ly/InstagramTseries","PT4M44S"
"oji2B6y2Lnc","5 Million Special QNA - Desi Gamers","2020-09-20T06:42:21Z","UCuApqv2tNQ73S7gcfrfCSDw","Desi Gamers","24","20.21.09","desi gamers qna|amitbhai qna|desi gamers 5 million qna|Qna Desi Gamers Free Fire|5 Million Special QNA|sawal jawab desi gamers|my income in qna|desi gamers amitbhai|qna 2020 desi gamers","2281567","429653","8639","35450","https://i.ytimg.com/vi/oji2B6y2Lnc/default.jpg","False","False","Instagram ► https://www.instagram.com/desigamers1/Discord ► https://discord.gg/desigamersFacebook ► https://www.facebook.com/DesiGamers2/TWITTER ► https://twitter.com/desigamers01This is My 5 Million Special Qna Video For My Subscriber Family.Desi Gamers QNA 2020","PT8M58S"
"2Vq2Pklcc4Q","कादर खान असरानी ने बिना पैसे दिए खाया खाना - Kader Khan Asrani Comedy","2020-09-19T09:57:31Z","UCnofQ65yrqUslv1am59PWsw","Haste Raho","23","20.21.09","kader khan comedy|kader khan asrani comedy scenes|asrani comedy|kader khan|asrani|कादर खान की कॉमेडी|कादर खान कॉमेडी|कादर खान|asrani comedy scenes|असरानी|hindi comedy scenes|bollywood comedy movies|bollywood|haste raho|haste raho comedy|hindi|funny|dinesh hingoo comedy scene|dinesh hingoo|kader khan comedy scenes|kader khan comedy movies|bollywood comedy scenes","5216111","65127","6901","7875","https://i.ytimg.com/vi/2Vq2Pklcc4Q/default.jpg","False","False","कादर खान असरानी ने बिना पैसे दिए खाया खाना - Kader Khan Asrani ComedyFilm: Badi Bahen #kaderkhan #asrani #hasteraho","PT7M16S"
"OJ2TVNS-0d0","ASK THEM : Gippy Grewal Ft. Karan Aujla (Full Video) Latest Punjabi Songs | Geet MP3","2020-09-20T12:03:00Z","UClZF7OsrECe3t_ADrjZEh_Q","Geet MP3","10","20.21.09","geet mp3|gk digital|latest punjabi songs|latest punjabi song 2020|new punjabi song|new punjabi song 2020|new punjabi songs 2020|trending songs|punjabi song 2020|karan randhawa new song|latest punjabi songs 2020|new video song 2020|latest punjabi song|Gippy Grewal|new punjabi songs|the main man album|the main man gippy grewal|ask them karan aujla|karan aujla ask them|ask them song|ask them gippy grewal|karan aujla song|ask em karan aujla","3128851","298969","11505","761843","https://i.ytimg.com/vi/OJ2TVNS-0d0/default.jpg","False","False","Geet MP3 & GK Digital Presenting Official Song Of Ask Them From Album The Main ManFull Album Releasing On 22 Sept 6PMMake Sure You Will Like It And Spread it As Much As You Can. Subscribe To Our Channel For New Songs  : http://bit.ly/SubscribeGEETMP3Song : Ask ThemSinger : Gippy Grewal Feat. Karan AujlaLyrics : Karan Aujla Music : ProofMix & Master : DenseVideo Director : Robby Singh, Sukh SangheraEditor & Dop : Robby Singh Female Lead : Ishita RajArt Director : Ritesh Kumar (Pinky) Publicity Stills Making : Daas Films Visual Promotion : Clap Studioz Publicity Design : Impressive Design Studio, Town Media Production : Team AG Chreographer : Sahil Masih Costume : Rakesh Kumar (Rocky)Special Thanks : Bhana LA Producer : KV DhillonPromotions : GK DigitalLabel : Geet MP3Music Consultant & Digital Partner : GK DIGITALInstagram : https://www.instagram.com/GK.DIGITALSubscribe Other Our Other Channels : Geet MP3 Haryanvi : https://bit.ly/SubscribeGeetMP3HaryanviEnjoy & Stay Connected With us 📲Website : http://GeetMP3.comYouTube : http://bit.ly/SubscribeGEETMP3 Facebook : https://www.facebook.com/iGeetMP3Instagram : https://www.instagram.com/GEETMP3Twitter : https://twitter.com/GEETMP3SnapChat : https://www.snapchat.com/add/GEETMP3","PT3M48S"
"OZhlpWmrQFY","Shaadi Phir Barbaadi | the mridul | pragati | Nitin","2020-09-18T12:30:04Z","UC0zXnLIFedO97pFsyMxZcFg","The MriDul","23","20.21.09","the mridul|the mridul new video|pragati|pragati comedy video|pragati new video|nitin|nitin mridul video|mridul nitin comedy|school life|shaadi phir barbaadi|shaadi comedy|comedy videos|desi comedy|new comedy video|best comedy videos|mridul comedy|funny video","6120845","180634","11571","10959","https://i.ytimg.com/vi/OZhlpWmrQFY/default.jpg","False","False","Hello Doston 👋🏻😊🌸🌺                                      FOLLOW US ON INSTAGRAM  👇🏻👇🏻Follow MriDul on instagram ~ https://www.instagram.com/themridul_/follow Nitin on instagram ~ https://www.instagram.com/i.am.nitin_/Shaadi Phir Barbaadi | the mridul | pragati | NitinPLEASE SUBSCRIBE 🥰Cast ~ MriDul, Nitin, Pragati, Aarav, kshama, ujjwal, kavya, Delisa, Dipesh camera,Editing ~ Maan gujjar Script ~ The MriDulThumbnail ~ vishal rana  (pheonix)Special thanx ~ Rajeev (Nandu bhaiya) the mridul new videothe mridulpragatischool videoPragati new videoThnkew for watching 🙏🏻😊😍🌺🌸","PT14M58S"
"lXgljvadBUE","EMIWAY - AS-SALAAM WALEKUM (PROD.FLAMBOY) (OFFICIAL MUSIC VIDEO)","2020-09-20T05:59:46Z","UCHmk8iNJHvf5mGN6_pkPc7g","Emiway Bantai","10","20.21.09","emiway|asalamwalekum|emiway bantai|emiway new song|rap|hip hop|music|independent|organic|underground","1921641","342030","21479","40115","https://i.ytimg.com/vi/lXgljvadBUE/default.jpg","False","False","Available on all platforms soon....Artist & Lyrics - Emiway Bantai Music - Flamboyhttps://www.youtube.com/channel/UCMGx...Mix/Master - EmiwayDirected by - Rayhaan PatniVisuals by - HappyEdited by -  Happy and EmiwayProduction - Bantai studio Production managed - Sankalp VaidEmiway Management MAIL ID imailemiway@gmail.comSocial connectInstagram - Emiway_BantaiFacebook - Emiway37Twitter - emiwaytweets#emiway #assalamwalekum #bantai","PT4M13S"
"UWYqf8RZUio","Real Star Srihari and Raasi BlockBuster Superhit Action Movie Part -2 || Vendithera","2020-09-20T05:30:01Z","UCGzTKkn_jPIZsH1stXWV2MQ","Vendithera","24","20.21.09","Coolie Songs|Coolie Full Songs|Coolie Full Songs Jukebox|Coolie Hit Songs|Sri Hari Songs|Sri Hari Full Songs|Sri Hari Hit Songs|Sri Hari Full Songs With Lyrics|Raasi Songs|Vandemataram Srinivas Hit Songs|Telugu Songs|Telugu Full Songs|Telugu Hit Songs|raasi hot movies|raasi telugu movies|raasi hot in saree|coolie telugu movie|coolie telugu movie parts|sri hari telugu movies|srihari comedy scenes|vendithera|vendithera movies|sher khan","1046740","7833","975","0","https://i.ytimg.com/vi/UWYqf8RZUio/default.jpg","True","False","Watch Real Star Srihari and Raasi BlockBuster Superhit Action Movie Part -2 || Vendithera#trendingmovies","PT15M3S"
"e5vv4IUw0pU","Juventus 3-0 Sampdoria | Kulusevski Scores on Debut as Juve Open with a Win | Serie A TIM","2020-09-20T21:45:00Z","UCBJeMCIeLQos7wacox4hmLQ","Serie A","17","20.21.09","Ronaldo|Serie A|Higuain|Dybala|highlights|Juventus|AC Milan|Inter Milan|Napoli|Roma|CR7|Cristiano Ronaldo|goals|full highlights|watch|stream|partita|migliori gol|migliori in campo|migliori al mondo|gol del mese|federcalcio|calcio|Italia|lukaku|de ligt|Lazio|Sampdoria|juventus sampdoria|juve sampdoria|juventus samdoria highlights|juventus highlights|juventus sampdoria 3 0|kulusevski|kulusevski juventus|bonucci|weston mckennie","1225909","40160","622","1684","https://i.ytimg.com/vi/e5vv4IUw0pU/default.jpg","False","False","Dejan Kulusevski scored on his Juventus debut as his side cruised to a 3-0 win with goals from Leonardo Bonucci and Cristiano Ronaldo | Serie A TIMThis is the official channel for the Serie A, providing all the latest highlights, interviews, news and features to keep you up to date with all things Italian football.Subscribe to the channel here! https://bit.ly/2OM2Eax Find out more about the Serie A at: http://www.legaseriea.it/en/ Questo è il canale ufficiale della Serie A, dove potrai avere accesso ai momenti salienti, alle interviste, alle notizie e alle funzionalità del momento per rimanere aggiornato sulle ultime novità del campionato.Iscriviti qui al canale! https://bit.ly/2OM2EaxPer maggiori informazioni sulla Serie A: http://www.legaseriea.it/it","PT4M13S"
"0wDwm6j-sFk","IPL 2020 Match 2 | Delhi Capitals vs Kings Xi Punjab Both Team Playing 11 | KXIP vs DC Playing 11","2020-09-20T02:15:30Z","UC_oeFt5g6Iso1EifUdmIW7w","Sports Canvas","17","20.21.09","IPL 2020 Kings xi Punjab vs Delhi capitals playing 11|IPL 2020|Delhi capitals vs kings xi Punjab|KXIP vs DC playing 11|Delhi capitals playing 11|Kings xi Punjab playing 11|IPL 2020 2nd Match|Sports canvas","579381","8109","3032","1318","https://i.ytimg.com/vi/0wDwm6j-sFk/default.jpg","False","False","IPL 2020 2nd Match | Delhi Capitals vs Kings Xi Punjab Both Team Playing 11 | KXIP vs DC Playing 11KXIP Playing 111. KL Rahul 2. Chris Gayle 3. Mayank Agarwal 4. Glenn Maxwell 5. Mandeep Singh6. Jimmy Neesham7. Krishnappa Gowtham8. Mohammad Shami 9. Ravi Bhisnoi10. Chris Jordan 11. Ishan PorelDC Playing 111. Ajinkya Rahane 2. Shikhar Dhawan 3. Shreyas iyar 4. Rishabh Pant 5. shimon Hetmyer6. Marcus Stoinis7. Ravichandran Ashwin 8. Sandeep Lamichahne 9. Amit Mishra 10. Kagiso Rabada 11. Ishant Sharma #KXIPvsDC #2ndMatch #IPL2020 #Playing11Thank you so much","PT2M23S"
"_O0sqoTbkfg","Life & Beauty Hacks - Desi vs Modern","2020-09-18T12:00:28Z","UCuN4A3GCUq5-0wJDSiJoxRQ","Anaysa","26","20.21.09","WOW|WOW Skin Science India|Anti Acne Face Serum|Face Serum|Best Face Serum|Wow Face Serum|blemish care|Skincare|Cruelty free|parabenfree|face wash|face serum|uv water|anaysa series|desi mom|mom hacks|beauty hacks|skincare hacks|life hacks|anaysa|skin|skincare|skin care routine|shruti arjun anand|shruti anand|blogger|acne|for beginners|skincare routine|desi mom & beauty|face spray|face toner|shiny skin hacks|dandruff|remove dandruff","2809470","129151","13945","7053","https://i.ytimg.com/vi/_O0sqoTbkfg/default.jpg","False","False","Link to install WOW Mobile App: http://onelink.to/dups86Use our promo code ANAYSA15 to get extra discount on your purchase.WOW Skin Science UV Water Transparent Sunscreen Spray SPF 30Buy wow- https://bit.ly/3iKoqv8Amazon - https://amzn.to/38wyT8uFlipkart - https://bit.ly/3iwIxg6Nykaa - https://bit.ly/2C9TjIqWOW Skin Science Anti Acne Face Wash - Oil Free - No Parabens, Sulphate, Silicones & Color (200mL)https://www.amazon.in/dp/B08CTC6YVF/ref=cm_sw_r_wa_apa_i_zEHtFb6T4PFC1WOW Lavender & Rose No Parabens & Sulphate Skin Mist Toner , 200mL https://www.amazon.in/dp/B071DZ1Y6C/ref=cm_sw_r_wa_apa_i_nFgoEb7WWBPGZWOW Skin Science Blemish Care Serum - Oil Free - Anti Acne, Spot Reducing - No Parabens, Silicones, Synthetic Fragrance & Color, 50 mlAmazon - https://amzn.to/2DLLqKz Buy wow -  https://bit.ly/3hh2ghO WOW Skin Science Anti Acne Face Serum - Natural Neem Leaf Oil, Tea Tree Oil, Caviar Lime Fruit Extract - Spot Therapy - No Parabens, Silicones & Fragrance - 30mlhttps://www.amazon.in/dp/B08B62K6X3/ref=cm_sw_r_wa_api_i_QOiwFbRT334NJIf you enjoyed the video Don’t forget to LIKE & SHARE.This time TARGET is 2,00,000 LIKES, or most important COMMENT karna mat bhulna ku ki ham karenge apke comments ka reply.Aap logo ki demand Episode 3 ke liye thi or ham video na late toh aisa nahi hota..So we are back with another episode of Desi vs Modern Mom Hacks with lots of comedy, fun and amazing sequences.Toh chalo chalte hai video enjoy karne or video ko LIKE jarur kr dena. CREDITS:Produced By : SpiceUp MediaCreative Head : Shruti AnandDirected By : Vikram ChoudharyScripted By : Bharti Singh, Vikram ChoudharyDOP : Dinesh KumarAssistant DOP : DeepakShoot Coordinator : Sonu GuptaEdited By : Shubham Raj VermaSupport Staff : Rita, SagarPresented By : Bharti Singh, Babli, Jeetusri, Danish Khan, Sonu, Ujagar, Anjali AdhikariSocial Media : Komal Sharma, Danish Khan~ XoXo~ AnaysaNEW UPLOADS every Friday 5:30 pm!AUDIO DISCLAIMER/CREDITS –Music from Epidemic Sound (http://www.epidemicsound.com)DISCLAIMER: The information provided on this channel and its videos is for general purposes only and should NOT be considered as professional advice.#DesiMom #DesiHacks #Hacks #DesiMomHacks #BeautyBlogger #Anaysa #Beauty #Skin #NaturalSkinCare #SkinCareRoutine #HealthySkin #SkinCare #SkinTips #WOW #WOWSkinScienceIndia #WOWSkinScience #WOWWorthy #CrueltyFree #Clean #WOWCare #Revitalize #Rejuvenate #Parabenfree #WOWSome #NatureInspiredBeauty #FaceSerum #AntiAcne #AcneFaceSerum #FaceSerum #BlemishSerum","PT9M56S"
"C8NlJDzpgMw","Attha kodalu part-4 // ultimate comedy video // 5star junnu // 5star laxmi","2020-09-20T03:42:59Z","UC0u7Y9hLEW2kwO6lrWRIqPQ","5 Star Junnu","2","20.21.09","5star channel|5star junnu|5star venky|5star Laxmi|5star srikanth|5star md|5star pasi|5star frooty|My village show|Creative thinks|Dhoom dham channel|Shanmk shannu videos|Software developer|Gangavva videos|Big boss|IPL videos|Telugu prank videos|Jabardasth videos|Dhethadi|Patas videos|Ipl 2020|Telugu folk songs|Sytv","400939","5835","863","761","https://i.ytimg.com/vi/C8NlJDzpgMw/default.jpg","False","False","Hii Frnds My New Shortfilm // Attha Kodallu  Part- 4  // plz watch like share and Subscribe for more updates.....8790348117Email: Venkythanugula581@gmail.com special thanks: T.Shivamani,T.VenkateshWritten: Venky Goud Camera & Editing : Srikanth Durgam, Mahammad MDDirection : Venky Goud,5 Star LaxmiProduction : 5 Star TeamOur Village LocatioVillage : Kondapur And AmbaripetMandal : VelgatoorDistrict : JagityalState : Telangana","PT13M45S"
"aHdngErWmmI","Jatta Takda Hoja : Jass Bajwa | G Skillz | Pavitar Bal | Latest Punjabi Songs 2020 | Being Digital","2020-09-20T05:30:10Z","UCc90_GyUIt1O0fHYbuNG1tQ","Jass Bajwa","10","20.21.09","[none]","579848","96162","811","10482","https://i.ytimg.com/vi/aHdngErWmmI/default.jpg","False","False","Jatta Takda Hoja : Jass Bajwa | G Skillz | Pavitar Bal | Latest Punjabi Songs 2020Singer Lyrics Composer : Jass BajwaMusic : G SkillzProject By : Pavitar BalOnline Promotion : Being DigitalSocial Media Promotion : Gold MediaMusic Consultant & Digital Partner : Being Digitalhttps://instagram.com/being.digitall","PT4M55S"
"xE82SFjezAc","BiggBossTelugu4 eliminated contestant karate kalyani interview tomorrow @ 10AM & 6PM on StarMaaMusic","2020-09-20T16:27:33Z","UC3pFVvw_HwykroUwLRdfRkg","Star Maa Music","10","20.21.09","Bigg Boss Telugu|Bigg Boss Telugu 4|karate kalyani|BiggBossTelugu4 eliminated contestant|karate kalyani interview|star Maa Music|eliminated contestant karate kalyani interview|Bigg Boss Telugu Buzzz|Bigg Boss|Bigg Boss Interview","488838","10880","452","553","https://i.ytimg.com/vi/xE82SFjezAc/default.jpg","False","False","#KarateKalyani #BiggBossTelugu4Buzzz #BiggBossElimination #BiggBossTelugu4 #StarMaaMusicBigg Boss Telugu 4 second Elimination interview exclusively on Star Maa Music. Tomorrow at 10 am & 6PM only on Star Maa Music","PT1M10S"
"1I6t00Vycko","Amma’s Special Dish | Ishaani Krishna","2020-09-19T11:41:24Z","UCDIuIf4lKDneweAYP1ZhDiQ","Ishaani Krishna","22","20.21.09","[none]","458630","24510","2082","2183","https://i.ytimg.com/vi/1I6t00Vycko/default.jpg","False","False","#MyLatestYoutubeVlog#YummyFood#Amma’sRecipe#IshaaniKrishna","PT15M11S"
"D3Loo1cp7RI","The Software DevLOVEper || EP - 6 || Shanmukh Jaswanth Ft. Vaishnavi Chaitanya || Infinitum Media","2020-09-18T12:28:48Z","UCjbBFvK04b-O3foSNabdrOA","Shanmukh Jaswanth","24","20.21.09","shanmukh jaswanth|shanmukh videos|shanmukh short films|shanmukh jaswanth videos|shannu|shannu funny video|vaishnavi chaitanya|pruthvi mukka|infinituim media|software devloveper|vaishnavi chaitanya shortfilm|The Software DevLOVEper || EP - 2|shannu software developer|shannu software meeting|shannu new video|software shanmukh|software developer web series|The Software DevLOVEper || EP - 4|The Software DevLOVEper || EP - 5|The Software DevLOVEper || EP - 6","1860252","124311","2100","17575","https://i.ytimg.com/vi/D3Loo1cp7RI/default.jpg","False","False","Create an #FBSaccount by the link https://bit.ly/32tupyo get 100% bonus for your first deposit.Start earning from home with the most reliable campaign !! The Software DevLOVEper  is a Telugu Comedy WebSeries Featuring  Shanmukh Jaswanth &  @   as leads.Cast:- Shanmukh Jaswanth,  @Vaishnavi Chaitanya   ,Sri Vidya Palaparthi  @Pruthvi Mukka   ,   @Jhakaas    Pruthvi, Sri Priya Iduri & Chandu JC .Written & Directed by - Subbu .KEditor:-  Krishna Karthik VunnavaCinematography & DI - Vamshi Srinivas Sound engineer - Vamshi NalliTitle and poster designer - HarinathExecutive producer - Sathwik G.RoyPowered by #Infinitum Network Solutions.#ShanmukhJaswanth Famously known as  Shannu is a Telugu comedy & Entertainment Youtube Content Creator. we upload the latest Telugu comedy videos.This is produced by Infinitum media.#VaishnaviChaitanya","PT31M27S"
"2SDGpZxOMtQ","Cute Jeha (Full Song) Barbie Maan Ft Dilpreet Dhillon | Sharry Nexus | Kirat Gill | New Punjabi Song","2020-09-18T04:30:24Z","UCcvNYxWXR_5TjVK7cSCdW-g","T-Series Apna Punjab","10","20.21.09","new song|latest song|songs 2020|new songs|latest songs|punjabi songs|punjabi songs new|punjabi songs latest|punjabi song status|punjabi song dj|punjabi|latest punjabi songs 2020|latest punjabi songs|new punjabi songs|latest song 2020|latest punjabi song|dilpreet dhillon|barbie mann|cute jeha|dilpreet dhillon new song|dilpreet dhillon cute jeha|cute jeha barbie mann|barbie mann new song|barbie mann dilpreet dhillon|dilpreet dhillon new punjabi song","6979152","194910","7162","54954","https://i.ytimg.com/vi/2SDGpZxOMtQ/default.jpg","False","False","#DilpreetDhillon #CuteJeha #BarbieMaanPresenting latest punjabi song Cute Jeha sung by Barbie Mann Ft Dilpreet Dhillon. The music of new punjabi song is given by Sharry Nexus while lyrics are penned by Kirat GIll. Enjoy and stay connected with us !!Song - Cute JehaSinger - Barbie Maan Feat. Dilpreet Dhillon Lyrics - Kirat Gill Music - Sharry nexus Director - Savio Sandhu Video Team - Savio & Yug Dop - Shinda Singh Edit grade - Zipsi Studio Assistant - Rajveer Maan & Jazz Maan Production - Manish khariPromotion - Gold MediaSpecial Thanks - Guru Randhawa & Dilpreet DhillonMusic Label: T-Series---------------------------------------------------------------Connect with T-SERIES APNAPUNJAB----------------------------------------------------------------For Latest Punjabi video's and songs stay connected with us!! SUBSCRIBE - http://www.youtube.com/tseriesapnapunjabFollow Us on TikTok - http://bit.ly/TseriesApnaPunjabTikTokLIKE US - http://www.facebook.com/tseriesapnapunjabInstagram - https://www.instagram.com/tseriesapnapunjabofficial","PT3M25S"
"7-ORLGKcnLQ","Tumhein Dekhen Meri Aankhen | Divya Bharti | Ayesha Jhulka | Kumar S | Alka Y | Rang | 90s Sad Song","2020-09-18T15:00:49Z","UCJrDMFOdv1I2k8n9oK_V21w","Tips Official","10","20.21.09","Tumhein Dekhen Meri Aankhen|divya bharti|ayesha jhulka|alka yagnik|kumar sanu|rang|90's sad song|kamal sadanah|tumhe dekhe meri aankhe isme kya meri khata hai|rang movie song|rang movie songs hd 1080p|rang movie video song|divya bharti video song|ayesha jhulka video song|tips official|kumar sanu alka yagnik sad song|90s hits hindi songs|90s sad songs hindi|90s sad video songs|old bollywood sad songs|purane gane|hindi song|heartbreak songs|breakupsong","3113222","31839","3040","2463","https://i.ytimg.com/vi/7-ORLGKcnLQ/default.jpg","False","False","90's Sad Song #TumheinDekhenMeriAankhen sung by #KumarSanu #AlkaYagnik from #Rang movie that stars #DivyaBharti #AyeshaJhulka #KamalSadanah is ready to get you all nostalgic once again.Stay updated with latest videos from Tips Music, Subscribe on below link.http://bit.ly/TipsOfficialSet 'Tumhein Dekhen Meri Aankhen' song as your Mobile Callertune (India Only)Vodafone & Idea Users Dial 5372516171Available On:Resso https://m.resso.app/ZS5GMKxP/JioSaavn https://www.jiosaavn.com/album/rang/1...https://www.jiosaavn.com/album/rang/1jMxGMXjuRY_Amazon https://music.amazon.in/albums/B0745D41ZF/B0745CM52R?refMarker=dm_wcp_af_r&ref=dm_wcp_albm_link_search_c&tab=CATALOG&Song Credits:Singers: Alka Yagnik, Kumar Sanu, P. SunandaMusic: Nadeem-ShravanLyrics: Surender SaathiMovie Credits:Producer: Mansoor Ahmed SiddiquiDirector: Talat JaniStarCast: Jitendra, Amrita Singh, Kamal Sadanah, Divya Bharti, Ayesha Jhulka, Kader KhanSong Lyrics:Tumhe dekhe meri aankheIsame kya meri khata haiTumhe dekhe meri aankheIsame kya meri khata haiHaal kya hai mere dil kaYe to bas mujhako pata haiTumhe dekhe meri aankheIsame kya meri khata haiHaal kya hai mere dil kaYe to bas mujhako pata haiDil mera sanbhal jaaye duwa karanaDil mera sanbhal jaaye duwa karanaPaagal na machal jaaye duwa karanaYe puchhata hai tujhaseDil deewaana bekaraarYe puchhata hai tujhaseDil deewaana bekaraarWo kaun si ada hai jiseTu karega pyaarWo kaun si ada hai jiseTu karega pyaarKisi se dil na lagaauYahi dhadakan ki sada haiHaal kya hai mere dil kaYe to bas mujhako pata haiTumhe dekhe meri aankheIsame kya meri khata haiMain tere sapano ko saja dungiMain tere sapano ko saja dungiDil tere kadamo mein bichha dungiMain kya bataau tujhakoKaise hai mere haalaatMain kya bataau tujhakoKaise hai mere haalaatMajaburiyon ke haathBik gaye mere jasbaatMajaburiyon ke haathBik gaye mere jasbaatJis pe main lut gayi dilbarYahi wo teri ada haiHaal kya hai mere dil kaYe to bas mujhako pata haiTumhe dekhe meri aankheIsame kya meri khata haiHaal kya hai mere dil kaYe to bas mujhako pata haiTumhe dekhe meri aankheIsame kya meri khata haiHaal kya hai mere dil kaYe to bas mujhako pata hai#Rang #AlkaYagnik #KumarSanu #AyeshaJhulka #DivyaBharti #Jitendra #AmritaSingh #KamalSadanahJoin Us Onhttp://youtube.com/tipsofficialhttps://youtube.com/tipsfilmshttp://youtube.com/dilapnapunjabihttp://youtube.com/jhankargaanehttp://youtube.com/volumehttp://youtube.com/tipsmarathihttp://bit.ly/TipsGujaratihttp://bit.ly/TipsBhojpuriChannelhttps://bit.ly/TipsHaryanvihttp://youtube.com/bhaktipremhttps://www.facebook.com/TipsMusichttps://www.instagram.com/tipshttps://twitter.com/tipsofficial","PT6M34S"
"DeZdt04TbXg","Mudiyan shivaniyayum  Shivani mudiyanayumayi one day full | SWAPING LIFE STYLE FOR ONE DAY","2020-09-19T12:00:11Z","UCWB9EGOW6HfcnXTmZr6D1Sw","Rishi K","24","20.21.09","Rishi K|uppum mulakum mudiyan|uppum mulakum|uppum mulakum shivani|shivani menon","512777","29260","856","2025","https://i.ytimg.com/vi/DeZdt04TbXg/default.jpg","False","False","DIGITAL PARTNER : Magazine Media Entertainment FOLLOW ME ON INSTAGRAMhttps://www.instagram.com/rishi_skumarFOLLOW ME ON FACEBOOKhttps://www.facebook.com/Actorrishisk...CONCEPT               : RishiStaring                    : Rishi & Shivani Camera & Editing : Sreeraj|| ANTI-PIRACY WARNING ||This content is Copyrighted to Rishi K . Any unauthorized reproduction, redistribution or re-upload is strictly prohibited. Legal action will be taken against those who violate the copyright of the same","PT24M37S"
