video_id,title,publishedAt,channelId,channelTitle,categoryId,trending_date,tags,view_count,likes,dislikes,comment_count,thumbnail_link,comments_disabled,ratings_disabled,description,duration
"iSXwitDGM14","Ishq Mein Marjawan S2 | इश्क़ में मरजावाँ | Ep. 59 | Riddhima Pregnant With Vansh'S Child?","2020-09-20T03:35:38Z","UC55IWqFLDH1Xp7iu1_xknRA","Colors TV","24","20.21.09","colors tv serials all|colors tv promo|colors tv new serial|colors tv naagin|colors tv khatron ke khiladi|bigg boss|hindi shows|कलर्स टीवी|comedy show|horror show|crime show|reality show|ishq mein marjawan season 2|ishq mein marjawan colors tv|इश्क़ में मरजावाँ|romantic thriller|colors tv thriller show|helly shah|riddhima|murder|mystery|suspect|arjun bijlani|ishq mein marjawan theme song|sonyliv|star plus|romantic hindi show|episode highlights","618128","7805","226","211","https://i.ytimg.com/vi/iSXwitDGM14/default.jpg","False","False","Vansh plans a surprise for Riddhima and gives her a gift to make an apology for not believing in her. On the other hand, the family finds a positive pregnancy report and decides to talk to Riddhima, assuming it's her report. Will their assumption turn out to be true?#ColorsTV #IshqMeinMarjawanTo subscribe this channel go to: http://www.youtube.com/subscription_center?add_user=colorstvTo download the Voot app please click on the link :IOS: https://apps.apple.com/in/app/voot/id1011777157Android: https://play.google.com/store/apps/details?id=com.tv.v18.violaFire TV: https://www.amazon.in/Viacom18-Media-Pvt-Ltd-Originals/dp/B01N2PCGG3/ref=sr_1_1?dchild=1&keywords=voot+tv&qid=1595417708&s=mobile-apps&sr=1-1To go to the playlist please click: https://www.youtube.com/playlist?list=PLcC6hSpO26Kue6oLBI-QzuPsQt8LQKGuXFollow us on: Facebook: https://www.facebook.com/ColorsTVInstagram: https://www.instagram.com/colorstv/She had the perfect life, the perfect man but little did she know that she was walking into the perfect trap. What happens when the man you love turns out to be a genius manipulator? Watch now.The accuracy, completeness, currency and/or suitability of the above video description is not endorsed by its licensor or broadcaster or the Channel. They shall not be liable for loss and/or damage arising from the video description.","PT3M11S"
"PuhJ7oiqjAA","Hair Fall || Mahathalli || Tamada Media","2020-09-16T14:48:46Z","UCFnLGH9BGpJLJMMlRMr-f5Q","Mahathalli","24","20.21.09","telugu comedy videos|telugu funny videos|telugu comedy webseries|comedy videos telugu|telugu comedy shortfilms|comedy shortfilms|telugu comedy 2019|mahathalli|mahathalli amma|Mahathalli Latest Videos|Mahatalli|Mahathalli|Comedy|Videos|hair fall|tamada media|wirally","881809","29766","1268","3359","https://i.ytimg.com/vi/PuhJ7oiqjAA/default.jpg","False","False","Order Tru Hair here :https://bit.ly/2ZACnDOCast : Jahnavi Dasetty, Sushant, Shravya, Siddu & P.V.SaiDOP : SidduEditing : Srinivas ChegondaVoices : Ramya Yadavalli & Vamsi Krishna LingalaConcept : Jahnavi DasettyPublicity Designer : Durga SaiWritten & Executed by P.V.Sai Somayajulu#Mahathalli #Wirally #TamadaMediaPowered By Tamada MediaFollow me onFacebook : https://www.facebook.com/Mahathalli/Twitter : https://twitter.com/mahathalliInstagram : https://www.instagram.com/mahathalli/Telegram : https://t.me/mahathalli_officialTamada Media : https://www.instagram.com/tamadamedia/","PT12M53S"
"iXPO7aN5hts","Guddan Tumse Na Ho Payega Monday to Friday Zee TV Americas","2020-09-18T19:00:07Z","UCqSlPR1Da1S8_hhMcQnRSuw","ZEE TV USA","24","20.21.09","ZEE|TV","395059","3106","284","0","https://i.ytimg.com/vi/iXPO7aN5hts/default.jpg","False","False","Apni Maa ki pyaari, kaam karne mein toh hai ek dum tez par gadbadi mein hojata hai sab kuch fail, kya #ChhotiGuddan se kuch ho paayega? Janne ke liye dekhiye #GuddanTumseNaHoPaayega 21st September se Mon-Fri raat 8 PM ET | 5 PM PT baje, sirf #ZeeTVAmericas par. #GuddanKiNayiKahani#NishantSinghMalkani #KanikaMann #ShwetaMahadik","PT40S"
"dWjqHLxrBqM","Chembarathi | Premiere Episode 526 Preview - Sep 21 2020 | Before ZEE Keralam","2020-09-20T13:40:20Z","UCXOgAl4w-FQero1ERbGHpXQ","ZEE5","24","20.21.09","zee5|web series trailer|zee5 originals|latest web series 2020|zee5 original movies|hindi web series|tamil web series|bengali web series|upcoming movie trailer|ZEE Marathi|ZEE Marathi tv serial|zee telugu|zee telugu serial|zee bangla|zee bangla serial|zee kannada|zee kannada serial|zee tamil|zee tamil serial|zee tv|zee tv serial|And tv|And tv serial|before tv|spoilers|tv show spoilers|tv serial updates","320965","3652","93","162","https://i.ytimg.com/vi/dWjqHLxrBqM/default.jpg","False","False","Watch tomorrow’s Premiere Episodes of ZEE Keralam serials today. Get the best of ZEE5 Originals, popular Alt Balaji shows, 1000+ superhit movies, favourite Zindagi shows, popular kids entertainment, Live TV channels and more. https://www.zee5.com/myaccount/subscription?plid=0-11-1503&utm_source=yt&utm_medium=ref&utm_campaign=subscription","PT43S"
"GyujOxTNDTo","Huge MYNTRA FESTIVE Try On haul | Designer Kurtis, Tops, Jewelry | Super Style Tips","2020-09-20T14:31:17Z","UCMGd2CJgU3oNA1z0_Pb83eA","Super Style Tips","22","20.21.09","huge|myntra|try on|haul|designer|kurtis|tops|jewellery|super|style|tips|huge myntra|myntra haul|myntra try on haul|myntra designer kurti haul|designer kurti|super style tips|super style tips komal|under 500 rs|myntra festive haul|festive|festive haul","234947","17916","713","1090","https://i.ytimg.com/vi/GyujOxTNDTo/default.jpg","False","False","Hi Guys, welcome back to my channel, in today's video i have a Huge MYNTRA TRY ON HAUL for you all, so i  picked a lot of stuff from myntra when they had some sale going on.... watch this video till the end to find out what all i got :)..Lipstick i am wearing : Maybelline New York Sensational Liquid Matte Lipstick - 08 Sensationally Mehttps://amzn.to/3mA9rFP.House Of Pataudi Women off white printed A line kurta : https://www.myntra.com/kurtas/house-of-pataudi/house-of-pataudi-women-off-white-printed-a-line-kurta/9168925/buyh & M set of 3 necklaces : https://www.myntra.com/jewellery/h&m/h&m-women-gold-toned-3-pack-necklaces/10403357/buyAnanya Women Navy Blue & Rust orange Print : https://www.myntra.com/kurtas/anayna/anayna-women-navy-blue--rust-orange-printed-straight-kurta/9814907/buyAnanya Women beige & pink screen print straight : https://www.myntra.com/kurtas/anayna/anayna-women-beige--pink-screen-print-straight-kurta/11530828/buyAnouk Women Mustard Yellow Printed A line : https://www.myntra.com/kurtas/anouk/anouk-women-mustard-yellow-printed-a-line-empire-kurta/9186539/buy Globus women beige solid top : https://www.myntra.com/tops/globus/globus-women-beige-solid-top/9818879/buyClora creation women off white self design straight palazzos : https://www.myntra.com/palazzos/clora-creation/clora-creation-women-off-white-self-design-straight-palazzos/9856545/buyH&M women black solid cropped jersey : https://www.myntra.com/tops/hm/hm-women-black-solid-cropped-jersey-strappy-top/12125380/buyH&M women grey soid short jersey top : https://www.myntra.com/tops/hm/hm-women-grey-solid-short-jersey-top/11469020/buyVishudh women lime green printed A line kurta : https://www.myntra.com/kurtas/vishudh/vishudh-women-lime-green-printed-a-line-kurta/2094577/buyGlobal desi women printed A line top : https://www.myntra.com/tops/global-desi/global-desi-women-red-printed-a-line-top/7770616/buyAnayna Women Green & white floral printed : https://www.myntra.com/kurtas/anayna/anayna-women-green--white-floral-printed-straight-kurta/9252955/buyMelange by lifestyle women coral floral print kurti : https://www.myntra.com/kurtis/melange-by-lifestyle/melange-by-lifestyle-women-coral-floral-print-kurti/10937682/buyGlobal desi women navy blue printed crop top : https://www.myntra.com/tops/global-desi/global-desi-women-navy-blue-printed-crop-top/10366289/buyMelange by lifestyle women olive green printed A line kurti : https://www.myntra.com/kurtis/melange-by-lifestyle/melange-by-lifestyle-women-olive-green-printed-a-line-kurti/11148332/buyAurelia Women green & mustard Yellow printed top : https://www.myntra.com/tops/aurelia/aurelia-women-green--mustard-yellow-printed-crop-top/6976241/buyVeni vidi vici women white solid fitted crop top : https://www.myntra.com/tops/veni-vidi-vici/veni-vidi-vici-women-white-solid-fitted-crop-top/10054551/buyH&M women black solid waist belt : https://www.myntra.com/belts/hm/hm-women-black-solid-waist-belt/10462310/buyH&M women pink solid jersey tshirt :H&M women gold toned 3 pack necklaces :ToniQ gold toned layered necklace :H&M pack of 2 brazilian briefs :Golden girl black solid non wired lightly padded bra :...Hope you liked this video ,If you do  please hit like and subscribe to my channel for more good videos and stay connected with me on super style tips.Don’t forget to share this video with your friends and family. SUBSCRIBE HERE :https://www.youtube.com/channel/UCMGd2CJgU3oNA1z0_Pb83eA get Connected on social Instagram : https://www.instagram.com/komalgudan/?hl=en Facebook Page : Super style tips Link : https://www.facebook.com/superstyletips/                                                                                                  Camera Used : https://amzn.to/2pOnLhjVlog Phone Camera : https://amzn.to/2uthzRE  Email me for any query :Superstyletipsforyou@gmail.com LOVE XOXO","PT16M30S"
"3N0VmjE_tX8","Kollappedum | Ribin Richard ft Nihal Sadiq | Music Video | Karikku Tuned","2020-09-18T13:30:00Z","UCXuSYBF4mcxhrgDmZOrezJg","Karikku Tuned","10","20.21.09","karikku|musicvideo|music|malayalam|karikkutuned|tuned|music247|T-Series|webseries|girls|pop|edm|trance|psychedelic","219271","26179","991","1238","https://i.ytimg.com/vi/3N0VmjE_tX8/default.jpg","False","False","#karikku #karikkutuned #musicvideo #kollapedumProduced by Ribin RichardWritten and performed by Nihal SadiqManagement - Ezone EntertainmentArtwork and Video - Buff Studio , PicstacyRibin Richard - https://www.instagram.com/ribinrichard/Nihal Sadiq - https://www.instagram.com/nihal_sadiq","PT3M"
"j0HT3jBT-3c","राधाकृष्ण | सखी का सम्मान","2020-09-19T09:30:43Z","UCCy2rLnGdwoJcSAtixNdsPQ","STAR भारत","24","20.21.09","[none]","300058","10587","279","1033","https://i.ytimg.com/vi/j0HT3jBT-3c/default.jpg","False","False","कैसे बचाएँगे कृष्ण अपनी सखी का सम्मान?देखिए #राधाकृष्ण में 1 घंटे का महा-एपिसोड, 22 सितम्बर, रात 9 बजे, सिर्फ़ STAR भारत पर।","PT1M4S"
"8461t4JsESM","Coronavirus India Update : Corona से भी बड़ा ख़तरा जो इंसान की तरफ़ बढ़ रहा है. (BBC Hindi)","2020-09-16T10:31:06Z","UCN7B-QD0Qgn2boVH5Q0pOWg","BBC News Hindi","25","20.21.09","BBC Hindi|hindi news|news in hindi|भारत|कोरोना वायरस|वैक्सीन|कोरोना वैक्सीन|कोरोना वैक्सीन ह्यूमन ट्रायल|एम्स|एम्स दवा|भारत में कोरोना|कोविड 19 अपडेट|बीबीसी हिन्दी|india|corona virus|aiims|corona in india|covid 19 update|bbc hindi|corona virus crisis|aiims delhi|face mask|old delhi|chandni chowk|फेस मास्क|सैनिटाइजर|कोरोना महामारी|Brazil|ब्राज़ील","4988166","0","0","4163","https://i.ytimg.com/vi/8461t4JsESM/default.jpg","False","True","पूरी दुनिया इस वक़्त कोरोना वायरस के ख़ौफ़ में जी रही है. 2 करोड़ 92 लाख से भी ज़्यादा लोग इस बीमारी से संक्रमित हो चुके हैं. लेकिन कोरोना से भी एक बड़ा ख़तरा है जो इंसान की तरफ़ बहुत तेज़ी से बढ़ रहा है. और अगर हमने उस तरफ़ ध्यान नहीं दिया तो ऐसी तबाही मचेगी जिसकी कल्पना भी नहीं की जा सकती. कवर स्टोरी में आज उसी ख़तरे की बात.#Pollution #Deforestation #CoronaVirus #Covid19Corona Virus से जुड़े और दिलचस्प वीडियो देखने के लिए यहां क्लिक करें : https://www.youtube.com/watch?v=npgvIvfmNkE&list=PLYxuvEJLss6ByutcqkthikPxV3ccUkwPBकोरोना वायरस से जुड़ी सारी प्रामाणिक ख़बरें पढ़ने के लिए क्लिक करें : https://www.bbc.com/hindi/international-51848794ऐसे ही और दिलचस्प वीडियो देखने के लिए चैनल सब्सक्राइब ज़रूर करें-https://www.youtube.com/channel/UCN7B-QD0Qgn2boVH5Q0pOWg?disable_polymer=trueबीबीसी हिंदी से आप इन सोशल मीडिया चैनल्स पर भी जुड़ सकते हैं-फ़ेसबुक- https://www.facebook.com/BBCnewsHindiट्विटर- https://twitter.com/BBCHindiइंस्टाग्राम- https://www.instagram.com/bbchindi/बीबीसी हिंदी का एंड्रॉयड ऐप डाउनलोड करने के लिए क्लिक करें- https://play.google.com/store/apps/details?id=uk.co.bbc.hindi","PT7M53S"
"BH1LwGcPrmY","Giant Vs Tiny Toy Challenge | Hungry Birds","2020-09-19T07:20:06Z","UCTLZ1jlmY-VogpQXng48iKQ","Hungry Birds","27","20.21.09","Giant Vs Tiny Toy Challenge|toy challenge|big toy vs small toy","2261389","77608","4985","10978","https://i.ytimg.com/vi/BH1LwGcPrmY/default.jpg","False","False","For Latest Updates of Our Life Please FollowInstagram - https://www.instagram.com/the_hungry_... Facebook = https://www.facebook.com/hungrybirds4 Cast=Sanket,Akshada,Umesh,PritiEdited By=Saurabh SawantDirected By = Umesh,Sanket,PritiBackground Music By -Epidemic Sound#HungryBirds #GiantVsSmallToy #FoodChallenge","PT14M11S"
"mfCMeawD-Mw","4 ഉള്ളി ഉണ്ടെങ്കിൽ ഇപ്പോൾ തന്നെ ഇതൊന്ന് തയ്യാറാക്കി നോക്കൂ | Onion Rings with Cheese | Onion Recipe","2020-09-19T09:45:01Z","UCOH_ioSD8yxFCfKNuiWiloQ","Shamees Kitchen","26","20.21.09","bread onion rings|onion rings|cheese onion rings|onion recipe|evening snacks|onion snacks|cheese rings|cheese with onion|bread rings|bread recipe|bread with onion|bread with cheese|mozerella recipe|easy recipe|crunchy snacks|crunchy recipes|crunchy rings|crunchy onion|onion|onion with snacks|snacks|snack recipes|tasty snacks|onion rings recipe|onion rings recipes|crispy onion|crispy bread|bread recipes|cheese recipes|onion with cheese","249376","9645","343","1138","https://i.ytimg.com/vi/mfCMeawD-Mw/default.jpg","False","False","Happy Cooking with Shamees KitchenMy Instagram: https://www.instagram.com/shamees_kitchenFacebook : https://www.facebook.com/shameeskitchennYou can mail me at : shameeskitchen@gmail.comAbout : Shamees Kitchen is a YouTube Channel, Where you will find Delicious Recipes with the ingredients which are easily available. Learn Interesting Recipes and Share your Feedback with us. If I can cook you can too :D Yours Cooking Channel :)*Disclaimer : All the content published on this channel is protected under the copyright law and should not be used/reproduced in full or part without the creator's prior Permission*","PT8M24S"
"jJgG0Itbcrw","തൃപ്പനച്ചി ഉസ്താദ് ഉറൂസ് മുബാറക്ക് 2020 | ആറാം  ദിനം |മാണിയൂർ ഉസ്താദ്","2020-09-20T19:01:14Z","UCBl4reKrfIIsRI4hjQ4Il_w","SKICR TV","24","20.21.09","[none]","15021","507","17","1","https://i.ytimg.com/vi/jJgG0Itbcrw/default.jpg","False","False","തൃപ്പനച്ചി ഉസ്താദ് ഉറൂസ് മുബാറക്ക് 2020 | ആറാം  ദിനം |മാണിയൂർ ഉസ്താദ്","PT4H56M30S"
"UqO8F-qdo_s","Join Me Live While I Premiere My New Music Video","2020-09-20T17:02:26Z","UCLOEGprmycLLbyzBj2jozLg","Dixie D'Amelio","22","20.21.09","dixie damelio|dixie d'amelio|dixie|damelio|be happy|music video|tik tok|official music video|dixie damelio be happy|dixie d'amelio be happy|be happy music video|dixie damelio music video|dixie d'amelio music video|charli damelio|charli d'amelio|tiktok|charli|d'amelio|behind the scenes|bts|exclusive|ᗷᕼᑌᗴᔕᒍYᗴᔕ|blackbear|black bear|lil mosey|remix|official remix|lil|mosey|black|bear|music|hip hip","1946457","191702","1105","4841","https://i.ytimg.com/vi/UqO8F-qdo_s/default.jpg","False","False","Thanks for joining me LIVE to premiere my newest music video! Be Happy has been such a great experience and it's all because of YOU! I hope you all like the music, thank you so much for listening, and thank you to @blackbear and @Lil Mosey for being apart of my musical journey!","PT29M31S"
"KkaIsTH4V9w","Tu Aa Jaana - Palak Muchhal ft. Mumbiker Nikhil & Shanice Shrestha | Latest Hindi Song 2020","2020-09-15T04:30:05Z","UCLsMef624nZ4ME6WoSElPTg","Voilà! Digi","10","20.21.09","tu aa jaana|mumbiker nikhil|shanice shrestha|nikhil sharma|mumbiker nikhil song|mumbiker nikhil new song|mumbiker nikhil shanice shrestha love|palak muchhal|palak muchhal songs|palak muchhal new song|palak muchhal all song|mumbiker nikhil ladakh|nikhil mumbiker|mumbiker nikhil and shanice song|latest hindi song 2020|sad romantic songs|mumbiker|tu aa jaana palak muchhal|tu aa jana|mumbiker nikhil tu aa jaana|tu aa jaana mumbiker nikhil|tu aa jaana song","5086040","381582","15464","34098","https://i.ytimg.com/vi/KkaIsTH4V9w/default.jpg","False","False","Voilà! Digi presents 'Tu Aa Jaana', sung by Palak Muchhal and starring Mumbiker Nikhil & Shanice Shrestha! #mumbikernikhil #shaniceshrestha #palakmuchhal #latesthindisong2020 #tuaajaanaStream ‘Tu Aa Jaana’ on audio platforms:Gaana: https://gaana.com/album/tu-aa-jaana Wynk: https://wynk.in/u/dMNNuT1IQJioSaavn: https://bit.ly/3iK1agt Spotify: https://spoti.fi/2FBTNc2Amazon: https://amzn.to/32vhcVCApple Music: https://apple.co/2GRzB6zResso: https://m.resso.app/ZSad538b/Hungama: https://bit.ly/3c6C3lqCredits:Singer: Palak MuchhalStarring: Nikhil Sharma & Shanice ShresthaMusic Composers: Sanjeev-AjayLyricist: Sanjeev ChaturvediMusic Producer: Ashique ElahiMixed and mastered: Chakir Hussain @ Paresh  MusicMusic managed by: Kashi KashyapAssistant mixing engineer: Saikat SarkarGuitars: Britto Khangchian DOP: Onkar ChavanEditor/Chief AD: Ayu AgnihotriEP: Elvis AnthonyAssistant Director: Nidhi KamathMakeup: Manveen RekhiDI Artist: Sunil (Colorbar)Line Production: Sidhaant Sachdev ProductionsSpecial Thanks: Karishma ChhajerDirector: Sidhaant SachdevProducers: Girish Jain, Vinit JainA Voilà! Digi Production!Follow Voilà! Digi:Instagram: https://www.instagram.com/voila_digi/...Facebook: https://www.facebook.com/voiladigi/Twitter: https://twitter.com/VoilaDigiFor enquiries: contact@voiladigi.inUpcoming projects with:Palak MuchhalGajendra VermaAnkit TiwariNikhil D'souzaSonu KakkarJonita GandhiAmit MishraTanzeel KhanKarishma Sharmaand others","PT3M8S"
"rMLtkc3rcdU","Shhhhh...|| Chill Maama || Tamada Media","2020-09-19T11:48:26Z","UCCXyJU019Qj6XIvXOF4l2QA","Chill Maama","24","20.21.09","chillmaama|chillmama|telugu software comedy|telugu office comedy|telugu office short films|chillmama dheeraj|telugu latest chillmama","25637","1372","59","161","https://i.ytimg.com/vi/rMLtkc3rcdU/default.jpg","False","False","Remember how nervous we used to be during the lockdown period? But what about those ones who are always anxious? This video is about Vinay who is clinically diagnosed with Anxiety disorder and how his roommates try to manage without letting Vinay know anything about the then-ongoing pandemic Situation.Cast : Vinay Kuriti, P.V.Sai, Vamsi Krishna LingalaVoices : Ramya Yadavalli, P.V.L.SujathaD.O.P : Anvesh PogakulaEditing : Srinivas ChegondaPublicity Designer : NageshWritten & Directed by P.V.Sai SomayajuluHey, Maama Subscribe Now and hit the bell icon to hear from us Follow Team:ChillMaama(https://www.instagram.com/chillmaama/)Vinay Kuriti(https://www.instagram.com/vinay.chillmaama/)#TamadaMedia #Wirally #ChillMaamaPowered By Tamada MediaFollow Us Facebook :  https://www.facebook.com/chillmaama Instagram: https://www.instagram.com/chillmaamaTwitter: https://www.twitter.com/chillmaamaWebsite: https://www.chillmaama.com","PT14M47S"
"YwcBK1x0mf0","Aakaasam Nee Haddhu Ra - Kaatuka Kanule Dance Cover  || Swetha Naidu Ft. Mrinali || Infinitum Media","2020-09-19T13:03:48Z","UCj0aHWKJgcQAMe5YLfZKqrQ","Dancing Divas","10","20.21.09","Aakaasam Nee Haddhu Ra|Kaatuka Kanule Dance Cover|Kaatuka Kanule|swetha naidu|infinitum|sony music india|dancing divas|dancing divas dance performance|dancing divas telugu songs|Aakaasam Nee Haddhu Ra - Kaatuka Kanule Dance Cover|mrinali kiran","86807","4555","173","371","https://i.ytimg.com/vi/YwcBK1x0mf0/default.jpg","False","False","Cast :- @Swethaa Naidu & Mrinali KiranD.O.P, Ediiting & D.I :-  Kala PavanLocation :- Chaya Chitram StudiosExecutive producer :- Sathwik G. RoyProduced by #Infinitum network solutions for #DancingDivasAakaasam Nee Haddhu Ra - Kaatuka Kanule  ( Please Find Song Credits Below )A #GVPrakash melody that will stay etched in our hearts! #KaatukaKanule from #Suriya's #Aakaasam Nee Haddhu Ra ! out now! Hit play and enjoy the mesmerizing number now! Watch the official Telugu lyric video here!Movie- Aakaasam Nee Haddhu Ra !Song – Kaatuka KanuleSinger– DheeLyrics – Bhaskarabhatla Cast:Suriya, Aparna Balamurali,  Dr.M Mohan Babu, Paresh Rawal, Urvashi, Karunas, Vivek prasanna, Krishna kumar, Kaali venkatCrew:Story & Direction - Sudha KongaraMusic - GV Prakash KumarCinematographer - Niketh BommiArt Director - JackiEditor - Sathish SuriyaScreenplay - Shalini Usha Devi & Sudha KongaraAdditional Screenplay - Aalif Surti, GaneshaaDialogue - Rakendu MouliCostume Designer - Poornima RamasamyChoreography - Shobi, Sekhar VJAction Choreography - Greg powell, VickyDolby Atoms Mix - Suren GSound Design - Sound Factor Vishnu Govind, Sree SankarSound Effects -  ArunSeenuMake up & Hair - Shyed Malik SCostumes - ArunStills - CH BaluVisual Promotions -SangathamizhanPublicity Designer - Gopi PrasannaaBTS - BalajiLyric video - Antony JeromeColorist, DI - Suresh RaviVFX Supervisor - Vishwas SavanurVFX Studios - SilverCloud Studios, Knack Studios, DNote StudioExecutive Producers - Achin Jain, PavithraChief Production Controller - B.Senthil KumarPro - Vamsi ShekarCo produced by Rajsekar Karpoorasundarapandian, Guneet Monga, Aalif SurtiProduced by SuriyaBanner- 2D Entertainment & Sikhya EntertainmentMusicians CreditsProgrammers : Ganesan Sekar, K C Balasarangan. Raj Kumar AmalBacking Vocals: K C Balasarangan,Ala B Bala.Recorded at Divinelabs chennai Mixed and Mastered by : Jehovahson AlgharMusic Label - Sony Music Entertainment India Pvt. Ltd.© 2020 Sony Music Entertainment India Pvt. Ltd.","PT4M30S"
