video_id,title,publishedAt,channelId,channelTitle,categoryId,trending_date,tags,view_count,likes,dislikes,comment_count,thumbnail_link,comments_disabled,ratings_disabled,description,duration
"3UGqUcBAoCc","Que Se Mueran De Envidia - DASH x BLACKROY x BABYFLOW x SIMON LA LETRA x ALEX GOT (VIDEO OFICIAL)","2020-09-12T21:00:10Z","UCkWNSxRTNde-8vT4dOlWU7g","Dash El Travieso","10","20.21.09","dash|blackroy|simon la letra|alex got|baby flow|envidia|reggeaton|mambo|chile|musica|forest|daddy yankee|myke towers|bayron fire|pablo chile|movinatik|Youngtheflay|Shishigang|Mambo|Mambo chileno|Carlitos Junior|El rey del mambo|Sosa mafia|Los 200|Dash el travieso|Los del rating|Farándula Records|Pablo chile","1088616","9263","2252","1229","https://i.ytimg.com/vi/3UGqUcBAoCc/default.jpg","False","False","#QueSeMueranDeEnvidia #Dash #EbiMusicQue Se Mueran De Envidia - DASH x BLACKROY x BABYFLOW x SIMON LA LETRA x ALEX GOT (VIDEO OFICIAL)Instagram:Dash https://www.instagram.com/ildash/?hl=...Blackroy https://www.instagram.com/youngteflay200/Simon la Letra https://www.instagram.com/simonlaletrashishi/Baby Flow https://www.instagram.com/_babyflow._/Ale Got https://www.instagram.com/alexgot_oficial/Sello Ebi Music https://www.instagram.com/ebimusic_/?...Productor Maython Music https://www.instagram.com/maython_mus...Beat Mata Pista https://www.instagram.com/pedroelmata...Dirigido por Movienatik https://www.instagram.com/movienatik/Letra:Na Na NaBABY FLOWEn un ritmo certero Yo quiero salir adelante con mis compañeros Yo sigo estando adelante y tu estás en cero Me quiere la gente del barrio porque soy sinceroBABY FLOW - DASHQue se mueran de envidiaYo estoy claro en todos ladoVo nunca la hay pasaoEsto es pa mi familiaPa la gente que ha estado cuanto nos ha costadoQue se mueran de envidiaYo estoy claro en todos ladoVo nunca la hay pasaoEsto es pa mi familiaPa la gente que ha estado cuanto nos ha costadoUoo Uoo SIMON LA LETRASeguimo en la luchaYo ando por la familiaDiosito me escuchaEn Poco confio, ando con lo mioLa envidia es muchaPero positivo, pa arriba en ascensoAndo atrayendo todo lo que piensoQuiero tener el bolsillo extensoY Quieren bajarme pero no PodránEn cualquier momento tomo el lanAmigos que están, otros que se vanPero de mi familia nunca fallannunca me fallannunca me fallanSimon la LetraALEX GOTYa no doy más aguante a lo traicioneroY sigo adelante, camino primeroLa lucha constante forma a un gran guerreroQue jamás abandona a su compañeroMétele sazón, batería, ReguetonEscucha el mambo en la poblaciónNos dicen que somos la sensación Estamos viviendo con la presiónPa que sienta la ráfagame habla de calle, pistola, billete, pero en realidad la tienen pagállegó el nene de oro a cambiarle el juegoy la competencia está apagáLos malditos se van pa la disco el fin de semanaY se llevan la máscaraSe llevan la máscaraBABY FLOW - DASHQue se mueran de envidiaYo estoy claro en todos ladoVo nunca la hay pasaoEsto pa mi familiaPa la gente que ha estado cuanto nos ha costadoUoo Uoo BLACKROYYoung teflayQue se muera de envidia toitosNinguno me quiere, me odian porque soy invictoMúsica pa la calle y to los convictosSábado gigante como Don FranciscoYa salió Chacal crucialAhora todos me quieren escucharUstedes me odian y sus mujeres me quieren amarAhora me hospedo en la sheraton frente al marYa no estes triste mamá, por mi familia lo voy a lograrNo van a llegar, toy claro en tos laos pensando en facturarA los jiles le pusimos los patines resbalines le vamos apagar el cineY a esos película yo estoy claro en tos laosUstedes no están en nahDASHCamino con puros frecuenteY siempre los tengo presenteYo nunca me olvido de dónde salíNi tampoco olvido a mi genteLe doy gracias a mi papáLe doy gracias a mi mamá que siempre han estado atrásDándome la oportunidadQue de envidia se mueran Mi futuro es afuera Mi madre me enseño a que nunca durmiera A que donde llegue siempre plante bandera y que camine recto que no me confundiera Con el que me de la mano La misma plata si somos hermanoEl que va rápido se muere temprano Por eso voy lento y disfruto el planoBABY FLOW - DASHEn un ritmo certero Yo quiero salir a delante con mis compañeros Yo sigo estando adelante y tu estás en cero Me quiere la gente del barrio por qué soy sincerosoy sinceroQue se mueran de envidiaYo estoy claro en todos ladoVo nunca la hay pasaoEsto pa mi familiaPa la gente que ha estado cuanto nos ha costadoQue se mueran de envidiaYo estoy claro en todos ladoVo nunca la hay pasaoEsto pa mi familiaPa la gente que ha estado cuanto nos ha costadouoo uooYeah Yeah YeahEbi MusicDash Tu travieso, tu traviesoyou dash, el traviesoBlackroy Young teflaySimon la Letra, Simon la letraBaby Flow, Alex Got yehAlex GotYeahShishigangLos 200Sosa mafia gangaShishigang Maython , pedro el matapistasLos de la MagiaEbi MusicDimelo dimelo Baby FlowBaby Flow ey ey MamiEste mambo es pa las nenas pa la calleEyyy Pa que lo bailenEl big bossCompositores:Maickol GonzalezSimón SaavedraEmerson RamirezAlexander LopezAlejandro Tognarelli©️ Ebi Music","PT5M1S"
"pIk19cQYzaQ","25 Comidas que Construyen MUSCULO (Varias te Sorprenderan!)","2020-09-16T16:32:16Z","UCuzmut0enwi-LrnyYwD0NCA","BUFF Academy","22","20.21.09","musculo|alimentos que construyen musculo|comidas que construyen musculo|aumentar masa muscular|ganar masa muscular|alimentos con proteinas|ganar musculo|alimentos baratos para aumentar masa muscular|como aumentar masa muscular|alimentos saludables|alimentos baratos con mucha proteina|hipertrofia muscular","189527","19255","102","972","https://i.ytimg.com/vi/pIk19cQYzaQ/default.jpg","False","False","Amigos, en este vídeo hablaremos sobre 25 alimentos que construyen musculo.ÚNETE, GUERRERO! Únete a los miles de personas en EL CAMINO DEL GUERRERO: https://www.buff-academy.com/shopNuestro sitio web: https://www.buff-academy.com/BUFF Academy en Instagram:https://www.instagram.com/buff.academy/","PT9M6S"
"cPYsLm645I4","¡PUSE CUCARACHAS EN SU COMIDA POR 24 HORAS! BROMA PESADA A COLORIDAS - Yolo Aventuras","2020-09-14T21:45:11Z","UCOnIJiQuk1fDSp6p1GCZy3A","YOLO AVENTURAS","24","20.21.09","yolo aventuras|yolo|yolo aventura|yoloaventuras|broma|bromas|broma pesada|pesada|24 horas|horas|coloridas|cucarachas|comida|broma cruel|broma extrema|ex|ex novia|novia|broma a mi ex|broma a mi ex novia|broma a mi novia|broma a yolo|broma a yolo aventuras|broma a coloridas|vecinas|vecinos|fede|fede vegevani|antrax|skabeche|los polinesios|polinesios|katie angel|tendencias|mexico|colombia|argentina|risas|diversion|lulu99|las mejore bromas|24 horas de bromas","1639909","150049","3707","11991","https://i.ytimg.com/vi/cPYsLm645I4/default.jpg","False","False","Registrate en Binomo y obten 1000$ en tu cuenta demo: https://bit.ly/YOLOAVENTURAS_BINOMO24 horas de bromas pesadas a mis vecinas. Yolo Aventuras le hacen bromas a Coloridas.Mira la broma que nos hicieron las Coloridas aquí: https://youtu.be/UPBQTZNPBAcSíguenos en Instagram:YOLO: https://cutt.ly/QyvFG7UNANDO: https://cutt.ly/PyvFHnxMARIANA: https://cutt.ly/TyvFJxmPANDA: https://cutt.ly/FyvFJMGSíguenos en TikTok:YOLO: https://vm.tiktok.com/x7jjrHNANDO: https://vm.tiktok.com/x7YabRMARIANA: https://vm.tiktok.com/x7McqsPANDA: https://vm.tiktok.com/x71NHUCanales de Youtube personales:YOLO 😎: https://youtu.be/GUDf3eBINFINANDO 👱‍♂: https://youtu.be/5CtVnmmncsgMARIANA 💁‍♀: https://youtu.be/FyktlV48QH4PANDA 🐼: https://youtu.be/fbiaqORa26cNuestros canales de videojuegos: CRACKS: https://youtu.be/Xn2F4C9JKnMTITANES: https://youtu.be/ee6a49eFmSYSuscríbete al canal de Coloridas: https://youtu.be/UPBQTZNPBAcSigue a las Coloridas en Instagram:Lila: https://www.instagram.com/lilacoloridasMía: https://www.instagram.com/miacoloridasPoli: https://www.instagram.com/policoloridasSoni: https://www.instagram.com/sonicoloridasSigue a las Coloridas en TikTok:Lila: https://www.tiktok.com/@lilacoloridasMía: https://www.tiktok.com/@miacoloridasPoli: https://www.tiktok.com/@policoloridasSoni: https://www.tiktok.com/@sonicoloridasEstamos en Twitch de Lunes a Viernes, síguenos:Twitch de Yolo Aventuras: http://www.twitch.tv/yoloaventurasTwitch de Titanes: https://www.twitch.tv/titanesyoutubeCONTACTO/PUBLICIDAD: yoloaventuras@yolodigital.com","PT19M9S"
"K0oSaCS0_98","ASTRO 아스트로 문빈&산하 - Bad Idea M/V","2020-09-14T09:00:06Z","UCZqY2yIsAM9wh3vvMwKd27g","ASTRO 아스트로","10","20.21.09","ASTRO|아스트로|판타지오뮤직|판타지오|fantagio|fantagioMusic|ASTROPLAY|아스트로플레이|차은우|문빈|진진|엠제이|윤산하|라키|ChaEunWoo|MoonBin|JINJIN|MJ|YoonSanHa|ROCKY|또까|DDOCA|Highlight Medley|하라메|하이라이트메들리|IN-OUT|IN|OUT|Eyez On U|Bad Idea|섬(Alone)|All I Wanna Do|Dream Catcher|문빈&산하|문빈&산하(ASTRO)|MOONBIN&SANHA(ASTRO)|TEASER|티저|뮤비티저|MV TEASER","3594287","285966","984","34504","https://i.ytimg.com/vi/K0oSaCS0_98/default.jpg","False","False","#ASTRO #문빈_산하 1st Mini Album [IN-OUT] '#Bad_Idea' M/V OPEN! 🤦  ▶ Twitter : http://twitter.com/offclASTRO▶ Facebook : http://facebook.com/offclASTRO▶ Instagram : https://www.instagram.com/officialastro▶ Weibo : http://weibo.com/officialASTRO▶ Fancafe : http://cafe.daum.net/fantagio-boys","PT3M48S"
"WKl8ineApqM","Brighton 1-3 Chelsea | Reece James & Kurt Zouma Goals Sink Brighton | Highlights","2020-09-14T23:00:09Z","UCU2PacFf99vhb3hNiYDmxww","Chelsea Football Club","17","20.21.09","Chelsea TV (TV Network)|Chelsea F.C. (Football Team)|goal|chelsea highlights|chelsea fc|chelsea|brighton v chelsea|brighton 1-3 chelsea|reece james|chelsea vs brighton|reece james goal vs brighton|reece james goal|hakim ziyech|ziyech|chelsea vs brighton live|pulisic|Premier League|werner|Kai havertz|havertz|willian|soccer|London|training|chelsea football club news|kante|lampard|hudson-odoi|abraham|timo werner|chilwell|ben chilwell|Jorginho","2839383","45570","1575","2246","https://i.ytimg.com/vi/WKl8ineApqM/default.jpg","False","False","The Blues are back for the 2020/21 season with their first Premier League match of the season. Watch the highlights from Chelsea's Premier League trip to Brighton.Download Chelsea FC's official mobile app:-App Store https://apple.co/2vvlN9t-Play Store http://bit.ly/2MfNJHX Subscribe: http://che.lc/YTsubscribeTo watch more EXCLUSIVE Chelsea content go to: http://che.lc/YTwebsiteWelcome to the official home of Chelsea Football Club on YouTube. It’s the only channel where you’ll get an authentic look at life at this great club. Every week we’ll be uploading fresh content from the training ground, our famous stadium and much, much more. Nowhere else will you get closer to world-class stars like Christian Pulisic, Kai Havertz, Hakim Ziyech, Timo Werner & N’Golo Kanté. ABOUT CHELSEA FOOTBALL CLUBFounded in 1905, Chelsea Football Club has a rich history, with its many successes including 5 Premier League titles, 8 FA Cups and 1 Champions League, secured on a memorable night in 2012. Famous former Blues include Peter Osgood, Gianfranco Zola, Dennis Wise, John Terry, Didier Drogba & Eden Hazard.","PT2M18S"
"whUs3hNAtGk","Worlds 2020 - Take Over comienza ya | Esports | League of Legends","2020-09-14T15:00:19Z","UC-I8d_BjKP6MMsYjZhAtjIA","LoL Esports Latinoamérica","20","20.21.09","Liga Latinoamérica|Liga|Latinoamérica|Liga Latam|LLA|League of Legends|LoL|Esports|eSports|E-Sports|Competición|Copa|Ismind|Rogue|Finn|LEC|Starscreen|TCL|IW|Envy|INTZ|ITZ|CBLoL|Jaeger|LJL|Caster|Bwipo|Fnatic|Nuguri|DAMWON|LCK|Smeb|KT|KT Rolster|micaO|Kiin|Afreeca Freecs|Azael|LCS","120594","5792","76","251","https://i.ytimg.com/vi/whUs3hNAtGk/default.jpg","False","False","No es solo un esport. Es el futuro del deporte. Take Over en Worlds 2020.El viaje para coronar al mejor equipo de League of Legends del planeta comienza el 25 de septiembre en Shanghái, China. Únete a nosotros y a los millones de fanáticos de LoL de todo el mundo en la misión de hacernos escuchar en Take Over de Worlds 2020.Todo eso ocurrirá en Worlds 2020. No te lo pierdas.","PT1M16S"
"TgnAn_OVQtA","아니 (Any) Any","2020-09-14T09:08:29Z","UCIMmuidNJdncfMEelOU08Fg","Stray Kids - Topic","10","20.21.09","Stray Kids|IN LIFE|아니 (Any) Any","826543","85604","189","4097","https://i.ytimg.com/vi/TgnAn_OVQtA/default.jpg","False","False","Provided to YouTube by JYP Entertainment Corporation아니 (Any) Any · Stray KidsIN LIFE℗ JYP EntertainmentReleased on: 2020-09-14Music  Publisher: JYP Publishing (KOMCA)Lyricist: 방찬 (3RACHA)Lyricist: 창빈 (3RACHA)Lyricist: 한 (3RACHA)Composer: 방찬 (3RACHA)Composer: 창빈 (3RACHA)Composer: 한 (3RACHA)Composer: MatluckComposer: TeleArranger: TeleArranger: 방찬 (3RACHA)Auto-generated by YouTube.","PT2M50S"
"7Nor9YPO9Kg","Mario Bautista - Tequila (Video Oficial)","2020-09-15T06:04:15Z","UCI8F_Ztv2ypr3ecbh9HT8qQ","Mario Bautista","24","20.21.09","mario|bautista|comedia|gil|mario bautista gil|youtuber","2187426","80240","2304","12503","https://i.ytimg.com/vi/7Nor9YPO9Kg/default.jpg","False","False","Tequila es una canción que hice junto a mi hermano Sunamy en un día de cuarentena con la esperanza de que algun día terminara y saliéramos a rumbear como sabemos.HOY celebramos a México y a todos los mexicanos que imaginamos cosas chingonas!!!Salud y buena vibra a todos!!!!! 🇲🇽🇲🇽🇲🇽🇲🇽🇲🇽QUE LA RUMBA SIIIIIGA 🔥Sígueme:https://www.instagram.com/mariobautista/https://www.facebook.com/MarioBautistaa/https://twitter.com/mariobautista_Directed by The Broducers@broducershttps://www.instagram.com/broducers/","PT2M33S"
"CnGdarAKMu8","Miley Cyrus - Midnight Sky (From The Tonight Show Starring Jimmy Fallon)","2020-09-14T20:11:14Z","UCdI8evszfZvyAl2UVCypkTA","MileyCyrusVEVO","10","20.21.09","midnight sky live|miley midnight sky live|miley midnight sky live fallon|miley cyrus midnight sky fallon|miley cyrus jimmy fallon|miley cyrus the tonight show|miley cyrus midnight sky the tonight show|miley cyrus midnight sky|miley midnight sky|miley cyrus vmas|midnight sky lyrics|miley midnight sky lyrics|miley cyrus midnight sky official|miley midnight sky video|miley cyrus midnight sky video|midnight sky official|midnight","1427018","74531","1145","4221","https://i.ytimg.com/vi/CnGdarAKMu8/default.jpg","False","False","Miley’s new single “Midnight Sky” is available now: http://mileyl.ink/midnightskyiTunes: http://mileyl.ink/midnightsky/itunesApple Music: http://mileyl.ink/midnightsky/applemusicSpotify: http://mileyl.ink/midnightsky/spotifyAmazon: http://mileyl.ink/midnightsky/azDeezer: http://mileyl.ink/midnightsky/deezer Watch the Official Music Video, Self-Directed by Miley Cyrus  http://mileyl.ink/midnightsky/youtube View merch at Miley’s official store now! https://smarturl.it/MileyStore?iQid=yt  Follow Miley on Spotify, Apple Music or Deezer to get new music as soon as it’s out: https://smarturl.it/FollowMC?iQid=yt Connect with MileyFacebook: https://mileyl.ink/facebookTwitter: https://mileyl.ink/twitterInstagram: https://mileyl.ink/instagramSnapchat: https://mileyl.ink/snapchatTiktok: https://mileyl.ink/tiktokSite: http://www.mileycyrus.com LYRICS: La la la la la Yeah it’s been a long night and the mirror’s telling me to go homeBut it’s been a long time since I felt this good on my ownA lot of years went by with my hands tied up in your ropesForever, and ever, no more The midnight sky is the road I’m takingHead high up in the cloudsOhhhh I was born to run I don’t belong to anyone, oh noI don’t need to be loved by youFire in my lungs can’t bite the devil on my tongue, oh noI don’t need to be loved by youSee my lips, on her mouth, everybody’s talking now babyOhh, you know it’s true, yeahhThat I was born to run I don’t belong to anyone, oh noI don’t need to be loved by youLoved by you…. La la la la la She got her hair pulled back cause the sweat’s dripping off of her faceSaid it ain’t so bad if I wanna make a couple mistakesYou should know right now that I never stay put in one placeForever, and ever, no more The midnight sky is the road I’m takingHead high up in the cloudsOhhhh I was born to run I don’t belong to anyone, oh noI don’t need to be loved by youFire in my lungs can’t bite the devil on my tongue, oh noI don’t need to be loved by youSee my lips, on her mouth, everybody’s talking now babyOhh, you know it’s true, yeahhhThat I was born to run I don’t belong to anyone, oh noI don’t need to be loved by youBy you…. Ohhh I don’t hide, blurry eyes like youLike you I was born to run I don’t belong to anyone, oh noI don’t need to be loved by youFire in my lungs can’t bite the devil on my tongue, you knowI don’t need to be loved by youSee his hands round my waist, thought you’d never be replaced babyOhh you know it’s true, yeah That I was born to run I don’t belong to anyone, oh noI don’t need to be loved by you Yeah…La la la la la la la #MileyCyrus #MidnightSky #TonightShow #JimmyFallon #Pop","PT3M52S"
"_IJ118cLSrs","PANDEMIA : LA VERDADERA MAGNITUD DE ESTE PROBLEMA","2020-09-15T17:15:09Z","UCrMAwrcvQ2m2ZhbaxDTcwFQ","vida segun richie","24","20.21.09","pandemia|coronavirus|covid 19|noticias de hoy|tapabocas|colombia|alvaro uribe|Bogota|noticias telemundo|telemundo|medellin|pereira|armenia|cali|barranquilla|mexico|argentina|noticias caracol|noticias en vivo|policia|noticias|noticias colombia|stand up|stand up comedy|comedy central stand up|vida segun richie|humor","126586","24435","172","1687","https://i.ytimg.com/vi/_IJ118cLSrs/default.jpg","False","False","Mucha gente está a las puertas de la quiebra debido a la situación mundial actual. Es necesario que entendamos que DEBEMOS AYUDAR. No podemos seguir haciéndonos los tontos frente a la necesidad de los demás.HAY QUE AYUDAR. HAY MUCHA GENTE AGUANTANDO HAMBRE Y LA SOLUCIÓN ESTA EN MANOS DE LOS QUE ESTÉN EN CAPACIDAD DE AYUDARMi video anterior: https://www.youtube.com/watch?v=szzCc8RrdVsMi Patreon por si me quiere dar de tragar: https://www.patreon.com/Vidasegunrichie Mi instagram: https://www.instagram.com/vidasegunrichieMi Tik Tok: https://www.tiktok.com/@vidasegunrichieMi Facebook: https://www.facebook.com/VidaSegunRichieOficial","PT5M24S"
"bZMPz5lzb2U","Daddy Yankee, Anuel AA & Kendo Kaponi - Don Don (Video Oficial)","2020-09-11T03:58:52Z","UC9TO_oo4c_LrOiKNaY6aysA","Daddy Yankee","10","20.21.09","daddy yankee en vivo|con calma|dura|shaky shaky|lo mejor de daddy yankee|daddy yankee en gira|dy adictiva|daddy yankee gasolina|daddy y yankee|desde que te vi supe que eras pa mi|don don|nueva cancion daddy yankee|anuel aa y daddy yankee|anuel aa|kendo kaponi|daddy yankee anuel aa kendo kaponi|daddy yankee|daddy yankee oficial|don don daddy yankee|raymnon ayala|don don don don don don|despacito|despacito daddy yankee|despacito joe biden|fonsi","33036990","482112","41227","40385","https://i.ytimg.com/vi/bZMPz5lzb2U/default.jpg","False","False","Daddy Yankee, Anuel AA & Kendo KaponiDon Don (Video Oficial)Suscríbete al canal: https://goo.gl/yypZyaEscucha Don Don en tu plataforma digital favorita: https://umusic.digital/dondon/Más vídeos de DY: More music videos from DY:Con Calma: https://youtu.be/DiItGE3eAyQQue Tire Pa' 'Lante: https://youtu.be/fAgvmh1jaCEFollow DY:Facebook-http://goo.gl/QYZ53a | Twitter-http://goo.gl/AzaR8o Instagram-http://goo.gl/a6F7gz | www.daddyyankee.comLetra/Lyrics:KENDOBurberry, Fendi, se prende el amorRojo, sangre, el aventadorA gorilla glue huele el interiorY la medusa se enculebra en la 22ANUELRichard Miller, en mi mano de cazadorLa pinta completa de Christian DiorEsta noche no quiero un errorHacemos una porno y yo voy a ser el directorKENDOContigo no me pongo necioBaby ese toto lo aprecioPorque tú tienes valorPero muchas solo tienen precioANUELSe te humedeció…cuando te toque babyDon don don don donContigo puedo ser fielTú estas en otro nivelBaby don don don don donDADDY YANKEETe llevo conmigo a viajar en el jetMi aerolínea tú la tienes de UBEREso está temblando cómo San Andrés WO!Ojitos verdes como moña de VancouverDale ma oh!Sigo pasando por el GOBatman en el MurciélagoTengo las pacas TOA ALTAEllos las tienen TOA BAJADate un shot de tequila te está invitando el PatrónSi quieres jugar con Jordan ven y caileTe voy a dar el último baileHay fuego en el 23Las botellas toa’ llegan via expressY síguelo no le bajamosA este nivel donde estamosSi mueves el bote ma’ te lo anclamosNadie nos quita el sueño por eso roncamosANUELSe te humedeció…cuando te toque babyDon don don don donContigo puedo ser fielTú estas en otro nivel,Baby don don don don donKENDOEl amor no se nos caeCómo la tarjeta que no da decline20,000 en la Montclair y pedales Off-WhiteLos Benjamin soy el Dios del rapEl odin, yo no uso Louis Vuitton si no es con la SupremeANUELSe te mojaron los labiosLos de la boca y los de abajoMami te quiero ver estoy en Ibiza bebeYo te viajoKENDOSolo disfruta de la vistaQue voy a llevarte pa broncearte las playas nudistasPa' que nos tiren fotos imprevistasY nos vamos viral en portadas de revistasDADDY YANKEESe te humedeció…cuando te toque babyDon don don don donContigo puedo ser fielTú estas en otro nivel,Baby don don don don donANUELEl Lambo rojo como hell boyAmarillo bumble bee el Rolls RoyceLos AKA y R en mi convoyY la baby es rubia Marylin MonroeBaby yo te rompo la tangaReal Hasta La muerte Mi gangaDe Kylie Jenner el maquillajeY la crema Versace pa' los masajeChampaña y sexo, yeMarijuanaEl momento es perfectoPara perdernos y matar las ganasChampaña y sexo, yeMarijuanaEl momento es perfectoPara perdernos y matar las ganasKENDOSe te humedeció…cuando te toque babyDon don don don donContigo puedo ser fielTú estas en otro nivel,Baby don don don don don#DaddyYankee #AnuelAA #KendoKaponi","PT4M39S"
"WWSUlgXbeC0","Tengo Novio / Último Capítulo","2020-09-13T15:29:00Z","UCgWTcPsEX0VczNmuHs5eo_Q","La Bala","22","20.21.09","bala|la bala|hey bala|capitulo 2|somos novios|novios","1147431","75605","2034","6076","https://i.ytimg.com/vi/WWSUlgXbeC0/default.jpg","False","False","Antes de empezar no se les olvide suscribirse en @Hey Bala! ahora siiiiBalovers! Feliz Domingo!!! Espero les haya gustado este video que se llama Tengo Novio / última parte!!! y la verdad es que como ustedes son mi familia , pues les tengo que contar todo lo que pasa en mi vida ya que ustedes son mi vida entera!! LOS AMO CON TODO MI SER!!!!!Por cierto ya se suscribieron a mi canal @Hey Bala! LOS AMO!!!!!","PT9M18S"
"B_-qdL8K-ZY","24 horas siendo novios ahre","2020-09-14T22:30:00Z","UCz-slMIhrM5gMQeq5Ggm01Q","MOMO","24","20.21.09","Momo|MomoOk|Que|hay|en|mi|iPhone|celular|phone|Como|poner|miniaturas|editar|hacer|para|youtube|facil|rapido|sencillo|tag|del|novio|broma|bromas|amigo|mama|papa|sale|mal|termina|no|lo|esperaba|24|horas|siendo|que|me|gusta|estoy|enamorada|de|el|yo|soy|momo|bañera|reaccionando|meme|memes|momos|videos|antiguos|novios|pareja|esposados|challenge|beso","458540","37474","2221","0","https://i.ytimg.com/vi/B_-qdL8K-ZY/default.jpg","True","False","tenemos luna en capri, todo eso nos da cringeMIS REDES SOCIALESINSTAGRAM: https://www.instagram.com/momook/TIKTOK: https://www.tiktok.com/@okmomoCONTACTO: info@momo-ok.com#1SemanaMomo","PT10M29S"
"IC0GedE7KO0","PARIS SAINT-GERMAIN - OLYMPIQUE DE MARSEILLE(0 - 1 ) - Highlights - (PARIS SG - OM) / 2020/2021","2020-09-14T00:02:12Z","UC58LMAlfwtGRNR6Xpd4DlSA","Ligue 1 Uber Eats Official","17","20.21.09","PARIS SG OM|Paris Marseille|highlights PARIS SAINT-GERMAIN OLYMPIQUE DE MARSEILLE|highlights PARIS SG OM|highlights Paris Marseille|PARIS SAINT-GERMAIN|Paris|highlights|Goals|Goal|ligue 1|Ligue 1 Uber Eats|league 1|L1|football|foot|soccer|french league|french|France|day|match day|sp:ty=high|sp:dt=2020-09-13T21:00:00Z|sp:vl=en-GB|sp:st=soccer|sp:li=france|sp:ti:home=PARIS SG|sp:ti:away=OM","1307769","13118","757","1339","https://i.ytimg.com/vi/IC0GedE7KO0/default.jpg","False","False","PARIS SAINT-GERMAIN vs OLYMPIQUE DE MARSEILLEHighlights(0 - 1) in video. Ligue 1 Uber Eats - Season 2020/2021 - Week 3 PARC DES PRINCES - Sunday 13 September 2020Goals : Florian THAUVIN (31' - OLYMPIQUE DE MARSEILLE) Red cards : Layvin KURZAWA (90' +7) /Leandro Daniel PAREDES (90' +7) /Neymar DA SILVA SANTOS JUNIOR (90' +9) /Dario Ismaël BENEDETTO (90' +7) /Jordan AMAVI (90' +7) PARIS SAINT-GERMAIN Team line-up : 27 - Idrissa GUEYE /3 - Presnel KIMPEMBE (c) /6 - Marco VERRATTI /11 - Angel DI MARIA /10 -  NEYMAR JR /4 - Thilo KEHRER /14 - Juan BERNAT /19 - Pablo SARABIA /21 - Ander HERRERA /16 - Sergio RICO /24 - Alessandro FLORENZI OLYMPIQUE DE MARSEILLE Team line-up : 30 - Steve MANDANDA (c) /10 - Dimitri PAYET /26 - Florian THAUVIN /18 - Jordan AMAVI /21 - Valentin RONGIER /22 - Pape Alassane GUEYE /27 - Maxime LOPEZ /4 - Boubacar KAMARA /2 - Hiroki SAKAI /15 - Duje CALETA-CAR /3 - Alvaro GONZALEZ Subscribe to the channel YoutubeSubscribe : https://www.youtube.com/subscription_center?add_user=ligue1officialFollow us on Instagram : https://instagram.com/ligue1ubereats/ Follow us on Twitter : https://twitter.com/Ligue1UberEatsFollow us on Facebook : https://fb.com/Ligue1UberEatsFollow us on Ligue1.fr : https://www.ligue1.fr","PT3M33S"
