video_id,title,publishedAt,channelId,channelTitle,categoryId,trending_date,tags,view_count,likes,dislikes,comment_count,thumbnail_link,comments_disabled,ratings_disabled,description,duration
"x8SURbZSmj4","Bayern dominates Schalke with 8 goals! | FC Bayern - Schalke | 8-0 | Matchday 1 – Bundesliga 20/21","2020-09-20T22:00:06Z","UC6UL29enLNe4mqwTfAyeNuw","Bundesliga","17","20.23.09","Bundesliga|Bundesliga 2020/21|Bundesliga Highlights|Football Highlights|season 20120/21|Highlights|FC Bayern München|Bayern|Bayern Munich|FC Schalke 04|Schalke|Schalke 04|Bayern Schalke|Bayern Schalke highlights|Bundesliga Matchday 1|BLMD1|NTBM|Gnabry|Lewandowski|Sane|Musiala|Thomas Müller|8-0|bayern schalk 8-0|sep20|kw3920","306990","7918","119","495","https://i.ytimg.com/vi/x8SURbZSmj4/default.jpg","False","False","#FCBS04 | Highlights from Matchday 1!► Sub now: https://redirect.bundesliga.com/_bwCS Watch all goals of FC Bayern München vs. FC Schalke 04 from Matchday 1 of 2020/21 season!Goals: 1-0 Gnabry (4’), 2-0 Goretzka (19’), 3-0 Lewandowski (31’ Penalty), 4-0 Gnabry (47’), 5-0 Gnabry (59’), 6-0 Müller (69’), 7-0 Sané (71’), 8-0 Musiala (81’)► Watch Bundesliga in your country: https://redirect.bundesliga.com/_bwCT► Join the conversation in the Bundesliga Community Tab:https://www.youtube.com/bundesliga/communityWe’ve seen another Matchday full of unmissable Bundesliga drama. Don’t miss any highlights from Germany’s football league! The Official Bundesliga YouTube channel gives you access to videos about the greatest goals, best moments and anything else you should know about. Make sure to subscribe now and visit us at https://bndsl.ga/comYT to find out more about the fixtures, analysis and news about your favourite team!","PT3M3S"
"QEoN6kcrCBo","ASTROCAFFE' STAGIONE 7 - TEASER","2020-09-21T05:00:03Z","UCHRTziAevLPgAE9Y5VhSs5g","link4universe","27","20.23.09","link4universe|adrian fartade|trailer|astrocaffè|telefunken|potevamo stupirvi","18377","3505","28","341","https://i.ytimg.com/vi/QEoN6kcrCBo/default.jpg","False","False","La settima stagione degli Astrocaffè inizierà Lunedi 28 Settembre alle ore 7:00 . Vi aspetto quindi tutti i giorni da Lunedi a Venerdi per parlare di nuove scoperte e missioni nel modo dell'astronomia (e morte e distruzione). Vi aspetto.PS: avete colto la citazione del teaser?PPS: Se voleste subito la risposta, eccola qui https://youtu.be/tFXd1LS5_A0 _______________________________________________________SUPPORTA IL CANALEhttps://www.patreon.com/link4universeLE MAGLIETTE CHE INDOSSO LE TROVI SU PAMPLINGUsa il codice ADRIANL4U su qualsiasi tuo acquisto e otterrai il 20% di sconto https://bit.ly/2pldLjiI MIEI LIBRIA piedi nudi su Marte | https://amzn.to/2FLKa57Su Nettuno piovono diamanti | https://amzn.to/2EWKC1JCome acchiappare un'asteroide | https://amzn.to/3gZYVFcVIDEO EDITATO CONMSI Trident X : https://it.msi.com/Desktop/Trident-X-9thMonitor : Optix MPG27C- https://it.msi.com/Monitor/Optix-MPG27CSedia: MAG CH110 - https://it.msi.com/Gaming-gear/MAG-CH110  _______________________________________________________DOVE TROVARMIPATREON:https://www.patreon.com/link4universeINSTAGRAM profilo personale: https://www.instagram.com/adrianfartadeprofilo canale: https://www.instagram.com/link4universeFACEBOOKpagina: https://www.facebook.com/link2universeprofilo personale: https://www.facebook.com/adrian.linku...PROSSIME LIVEhttps://adrianfartade.itMAILinfo.link4universe@gmail.com_______________________________________________________#link4universe #astrocaffè #scienza","PT31S"
"Z2Y1pHUfamM","Niko Pandetta - A UN PASSO DALLA LUNA & DANZA (REMIX) .","2020-09-15T12:08:43Z","UCDuX5tSzDq5MocnAJWQMXtA","Niko Pandetta","10","20.23.09","#nikopandetta #danza #Catania","529155","15354","739","1180","https://i.ytimg.com/vi/Z2Y1pHUfamM/default.jpg","False","False","NIKO PANDETTA - AD UN PASSO DALLA LUNA & DANZA (REMIX) .Autori: Vincenzo Pandetta - Giuseppe Giocondo- C. BagliMix e Master: G.SantonocitoIeri sera sono tornato nella mia city, sentendo un po’ i miei amici di vita sono stato invitato in studio, lo studio dove tutto iniziò.Abbiamo acceso il microfono e tra una risata e l’altra ci siamo accorti che Ad un passo dalla luna di Rocco è molto simile a Danza 😂,e vabbè, da qui é nata l'idea.È sempre bello tornare a casa,le energie positive della mia cara Catania mi avvolgono come un caloroso abbraccio dato da una madre!Ci vediamo l’1 ottobre.REVENGE 🍀👑Segui Niko Pandetta:Su Instagram: https://bit.ly/31I2YQNSu Spotify: https://spoti.fi/32Fcrb2Su Facebook: https://bit.ly/3hMC4wT","PT2M52S"
"x1aXvxVT21o","The Jackal - L’ultimo giorno PRIMA dell’ESAME (feat. Emma Marrone)","2020-09-16T11:00:10Z","UCpB9uxBH-Hjoj_Jd9cnRC_w","The Jackal","23","20.23.09","video divertenti|parodie divertenti|corti divertenti|web series ita|parodia|the jackal|emma marrone|x factor|sky|mika|maracas|gruppo studio|studiare|mario|real brown","625687","42494","577","720","https://i.ytimg.com/vi/x1aXvxVT21o/default.jpg","False","False","Lo sapevi? Studi scientifici dimostrerebbero che la musica aiuta a concentrarsi, e che se continuerai a dare zero esami all'anno non ti laureerai mai.➜ ISCRIVITI AL CANALE: https://bit.ly/2WjyIdd➜ INSTAGRAM: https://www.instagram.com/_the_jackal/➜ FACEBOOK: https://www.facebook.com/thejackalweb/➜ TWITCH https://www.twitch.tv/thejackal_official➜ TWITTER: https://twitter.com/_the_jackalIn collaborazione con Sky ItaliaX Factor 2020 dal 17 Settembre tutti i Giovedì alle 21:15 su Sky Italia e in streaming su NOWTV---- Cast & Troupe ----Ciro PrielloGianluca FruAurora LeoneClaudia Napolitanocon la partecipazione di: Emma Marronee con:Renato De SimoneGiuseppe AquilaPietro ValenteMichele Angelo GrimaldiRegia: Valerio VestosoDirettore della fotografia: Roberto OstuniDirettore della fotografia unità Roma: Giuseppe de MuroProduttore esecutivo: Simone RussoOrganizzatore generale: Maria Chiara De GregorioCoordinatrice di Produzione: Annachiara de FilippisAssistente di produzione: Giuseppe AquilaAssistente di produzione: Pietro ValenteMontaggio: Nicola VerreColor Correction: Alfredo FelcoMusiche e Mix Audio: Liz MartinAiuto Regia: Ylenia AzzurrettiSegretaria di Edizione: Laura CampanileCostumista: Teresa PapaTrucco: Antonietta BorrelliParrucco: Antonello AstaritaAttrezzista: Miriana PalombaAiuto Attrezzista: Daniele RussoFonico: Giorgio DurantinoOperatore: Giuseppe De MuroVideoassist: Deborah VenezianoCapo Elettricista: Francesco SaccoMacchinista: Vitalii MaliuskyiElettricista Roma: Nicola De BlasioAmministrazione: Arianna Avolio, Antonella Tommasini, Rosita Venuti, Raffaele SodanoSottotitoli: Marica EspositoSoggetto e Produzione The JackalHead of Branded Content: Vincenzo PiscopoAccount Manager: Anna ManzoDirezione artistica: Alessandro GrespanScritto da: Alessandro Grespan, Ciro Priello, Gianluca Fru, Fabio Balsamo, Aurora Leone e Claudia Napolitano","PT5M41S"
"4hzld_tFedg","Tour de France 2020 - Stage 20 Highlights | Cycling | Eurosport","2020-09-19T19:29:38Z","UClhp9g6TPiqCTOlcw0ROfNg","Eurosport","17","20.23.09","Tadej Pogacar|Pogacar|Primoz Roglic|Tour de France|Tour de France 2020|Stage 20|Stage 20 Tour de France|Stage 20 Highights|Tour de France Highlights|bike racing|cycle racing|cycling feed|eurosport|gcn racing|live pro cycling|sports|alejandro valverde|alejandro valverde bike|chris froome|tour de france|elia viviani|peter sagan|tour de france 2020|tour de france highlights|tdf highlights|tour de france stage 20 2020|tdf stage 20","291765","2707","48","391","https://i.ytimg.com/vi/4hzld_tFedg/default.jpg","False","False","Watch the highlights of Stage 20 of Tour de France 2020.News from the #1 sports destination and #HomeofTennis in Europe. Watch LIVE anytime, anywhere via eurosport.com: https://goo.gl/BVye9MFollow us on Instagram: http://bit.ly/2TOtykZEurosport Player iOS: https://goo.gl/PcohtLEurosport Player Android: https://goo.gl/WkrQo6Subscribe For More: https://goo.gl/o9rbKgVisit our Website: https://goo.gl/BVye9MFacebook: https://goo.gl/jMfLNRTwitter: https://goo.gl/jxT1fYwww.eurosport.comwww.eurosportplayer.com","PT5M54S"
"uhH9UvjwkK8","Harry Potter Hogwarts Legacy (PS5) | Trailer Italiano","2020-09-17T11:49:23Z","UCpguAA4VKBftSU7kcgQl5Iw","Multiplayer.it","20","20.23.09","multiplayer.it|multiplayerit|videogiochi|videogames|games|giochi|recensioni|gameplay|gaming|anteprime|playstation 4|ps4|xbox|harry potter|howgarts legacy|hogwarts legacy trailer|harry potter game|harry potter trailer|harry potter ps5|ps5|playstation 5|playstation|harry potter ita|hogwarts legacy ita|hogwarts legacy ps5|hogwarts","83494","3773","27","404","https://i.ytimg.com/vi/uhH9UvjwkK8/default.jpg","False","False","Warner Bros. Games annuncia Hogwarts Legacy, un gioco di ruolo (GdR) d'azione single-player ambientato nel Mondo Magico del 1800. I giocatori vivranno come mai prima d'ora un'inedita avventura nei panni degli studenti della Scuola di Magia e Stregoneria di Hogwarts e potranno intraprendere un viaggio pericoloso alla scoperta di una verità nascosta del Mondo Magico. Sviluppato da Avalanche e pubblicato da Warner Bros. Games per l'etichetta Portkey Games, Hogwarts Legacy sarà pubblicato nel 2021 per PlayStation®5, PlayStation®4, PlayStation®4 Pro, console Xbox Series X, Xbox Series S, Xbox One e PC.----👍 Se vi piacciono i video che realizziamo, iscrivetevi al canale YouTube e attivate le notifiche (cliccando sulla campanella) per restare aggiornati in tempo reale su tutti i nostri contenuti legati al gaming. ► ISCRIVITI AL CANALE YOUTUBE: http://bit.ly/2EojR7wPer tutti gli aggiornamenti e le novità sui vostri videogiochi preferiti seguite il sito di Multiplayer.it► Multiplayer.it: http://www.multiplayer.it► Facebook: https://www.facebook.com/multiplayer.it► Twitter: https://twitter.com/Multiplayerit► Instagram: https://www.instagram.com/multiplayer.it► Twitch: https://www.twitch.tv/multiplayerit","PT2M31S"
"o9izfo38faE","REAZIONE ai 10 VETERANI più FORTI del 2020 !!!","2020-09-21T12:45:08Z","UCnkwSxZiYBPy1aVjQfEWhRQ","ExSet ™","24","20.23.09","migliori veterani|migliori vecchi|migliori veterani nel calcio|old players|giocatori vecchi|skill|goal|top 10 migliori veterani|top 10 migliori vecchi|cristiano ronaldo|ibrahimovic|top veterani|top vecchi calcio|exset reazione|exset|calcio|ita|ribery|migliori vecchi 2020|oldest player 2020|10 VETERANI più FORTI del 2020|calciatori vecchi|over 35","29811","3215","31","197","https://i.ytimg.com/vi/o9izfo38faE/default.jpg","False","False","👉► Maglie Calcio 2020/21 a Poco Prezzo!https://www.stutecalcio.com/-15% di sconto: exset  (oltre €79, spedizione gratuita )🏆► CREDITI DI FIFA A BASSO COSTO! CON IL CODICE  exset8  8% DI SCONTO!https://www.igvault.it/Crediti-FIFA-20#at_aid=exset&at_bid=d3d3d784⭐► EMAIL COMMERCIALE: exsetcom@gmail.com🤩► SEGUIMI SU: 📷 INSTAGRAM : @exset7🎮 TWITCH : https://www.twitch.tv/theexset🔵 FACEBOOK : https://www.facebook.com/ExSet7/🥰► SOSTIENI IL CANALE:https://www.igvault.it/c2c-index/xproject/ExSetTM❤️► ISCRIVITI AL CANALE: http://goo.gl/F71RIr👉► COMPRA GIOCHI A BASSO COSTO!https://key.igvault.com/it?at_aid=Exsetcdkey&at_bid=b5daef12⚒► TUTORIAL CREDITI:  https://www.youtube.com/watch?v=UUzlychLJQQ► Creatore Video: https://www.youtube.com/watch?v=RvpzgAIwjMg&t=50s","PT12M16S"
"9Pp3-bJL5ys","Doctor Strange 2: Marvel vuole Tom Cruise come IRON MAN e le versioni alternative degli Avengers","2020-09-22T16:23:03Z","UCaEEdZvbEl-X9lIiiLhOd5Q","NerdMovieProducti0ns","24","20.23.09","NerdMovieProducti0ns|Nerdmovieproductions|andrea|bellusci|nerd|movie|productions","16431","1854","11","92","https://i.ytimg.com/vi/9Pp3-bJL5ys/default.jpg","False","False","- Seguimi su Instagram: http://instagram.com/andreabellusci- Unisciti al canale Telegram delle Offerte: https://t.me/nerdmovieprod- Vai su Pampling cliccando qui: https://goo.gl/KUwSBi ...e durante l'acquisto ottieni uno sconto del 20% inserendo il codice: NERDMOVISCRIVITI a NerdMovieProductions: http://goo.gl/9d9sRF Pagina Facebook : http://goo.gl/bQwXZ3Profilo Facebook : http://goo.gl/VcgHi1Instagram: http://instagram.com/andreabellusciTwitter: https://twitter.com/Andrea_Bellusci","PT3M28S"
"8RvAKRoIDqU","Sam Smith - Diamonds","2020-09-17T23:00:09Z","UC3Pa0DVzVkqEN_CwsNMapqg","SamSmithVEVO","10","20.23.09","Sam|Smith|Diamonds|Capitol|Pop|Oasis|(Lyric|Video)|i'm ready|sam smith|too good at goodbyes|how do you sleep|stay with me|i'm not the only one|fire on fire|i feel love|dancing with a stranger|to die for|I’m ready lyrics|Sam Smith love song|heartbreak songs|Sam Smith music|Sam Smith|sam smith lyrics|slow music|샘 스미스|サムスミス|サムスミス 2020|샘 스미스 2020|2020 music|pop music 2020","6722115","459511","4209","16174","https://i.ytimg.com/vi/8RvAKRoIDqU/default.jpg","False","False","Diamonds out now: http://samsmith.world/DiamondsIDPre-order 'Love Goes' out 30th October: http://samsmith.world/LoveGoesPreOrderIDDirected by: Luke MonaghanLyricsHave it allRip our memories off the wallAll the special things I boughtThey mean nothing to me any moreBut to youThey were everything we wereThey meant more than every wordNow I know just what you love me forTake all the money you want from meHope you become what you want to beShow me how little you care, how little you care, how little you careYou dream of glitter and goldMy heart’s already been soldShow you how little I care, how little I care, how little I care My diamonds leave with youYou’re never gonna hear my heart breakNever gonna move in dark waysBaby you’re so cruelMy diamonds leave with youMaterial love won’t fool meWhen you’re not here I can breatheThink I always knewMy diamonds leave with youShake it offShake the fear of feeling lostAlways me that pays the costI should never trust so easilyYou lied to meLied to meThen left with my heart round your chestTake all the money you want from meHope you become what you want to beShow me how little you care, how little you care, how little you care You dream of glitter and goldMy heart’s already been soldShow you how little I care, how little I care, how little I care My diamonds leave with youYou’re never gonna hear my heart breakNever gonna move in dark waysBaby you’re so cruelMy diamonds leave with youMaterial love won’t fool meWhen you’re not here I can breatheThink I always knewMy diamonds leave with youOh ohAlways knewMy diamonds leave with youOh ohAlways knewYou’re never gonna hear my heart breakNever gonna move in dark waysBaby you’re so cruelMy diamonds leave with youMaterial love won’t fool meWhen you’re not here I can breatheThink I always knewMy diamonds leave with youYou’re never gonna hear my heart breakNever gonna move in dark waysBaby you’re so cruelMy diamonds leave with youMaterial love won’t fool meWhen you’re not here I can breatheThink I always knewMy diamonds leave with youOh ohAlways knewMy diamonds leave with youOh ohAlways knewMy diamonds leave with youListen to Sam Smith’s Complete Collection here: http://samsmith.world/CatalogueIDFollow Sam Smith:http://samsmithworld.comhttp://facebook.com/samsmithworldhttp://instagram.com/samsmithhttp://twitter.com/samsmithPRODUCTION COMPANY BLACK DOG FILMS DIRECTOR LUKE MONAGHANPRODUCER ALEX JEFFERSONEXECUTIVE PRODUCER MARTIN ROKER CHOREOGRAPHER HOLLY BLAKEYPRODUCTION MANAGER SAVVAS STAVROUPRODUCTION ASSISTANT HARRY MORGANLOCATION MANAGER PAUL DAVIES1ST ASSISTANT DIRECTOR DANIEL SMITH2nd ASSISTANT DIRECTOR  JACQUELINE MOORERUNNER CHEYENNE WATERS RUNNER BRIAN GITHIOMIDIRECTOR OF PHOTOGRAPHY RINA YANGFOCUS PULLER KATE MOLINSCLAPPER LOADER JONNY LEWISCAMERA TRAINEE MAGGIE STANSZEKDOP INTERN  LOUISE TSEDOP INTERN  REBEKAH KNOXDIT JESSE LLANDESTEADICAM JOSH BROOKSGRIP  NEIL BLAKESLEYCAMERA DRIVER JOSH (DIMITRI TOPALOV)GAFFER GENKI MCCLURESPARK ALEX BROWNSPARK GREG WHITBROOKSPARK MEL HAYWARDSPARK  SETH CROSBY SPARK / GENIE OP AARON SZOGIDESK OP NOAH FURRERRIGGER  STEVE DALYVIDEO PLAYBACK  MICKEY RICHARDS VIDEO PLAYBACK TRAINEE  MAX POWER RICHARDSAUDIO PLAYBACK  COLLIN PATTERSONPRODUCTION DESIGNER ARTHUR DE BORMANPROP STYLIST  SCARLETT CLIFFORDART DEPT ASSISTANT BEN HUGHESART DEPT ASSISTANT LAURIE WALTERSART DEPT ASSISTANT MATT FRASERART DEPT TRAINEE BERHAN MADHAENSTYLIST  BEN REARDONSTYLIST ASSISTANT  NICCOLO TORELLIMAKE-UP & HAIR  ANNE SOPHIE COSTAMAKE-UP & HAIR ASSISTANT  LYDIA WARD-SMITHCOVID SUPERVISOR  MAVREEN BROWNMEDIC  SEB CRONINSFX SUPERVISOR  SEAN HARLAND SFX ASSISTANT  ADAM HARTLEYSFX WORK EXPERIENCE  JOSEPH TORGBORBTS MADISON PHIPPSEDITOR  LIZZY GRAHAM @ WHITEHOUSE POST NEW YORKASSISTANT EDITOR   TARA O’SULLIVANEDIT PRODUCER  RYAN SMITH @ WHITEHOUSE POST NEW YORKWHITEHOUSE POST EP   CAITLIN GRADYCOLOURIST  RICKY GAUSISCOLOUR PRODUCER  DIANE VALERA & SASHA PACE @ MPC LAPOST PRODUCER  GRACE THORPE @ MPC LONDONSOUND DESIGN FRED PEARSONTHANKS TOO BEN TOTTY @ BOX MANAGEMENT, GEORGE RUMSEY & MICK WALSH @ PANAVISION, KELLY AMUNDSEN @ PANALUX#SamSmith #DiamondsMusic video by Sam Smith performing Diamonds. A Capitol Records UK Recording; © 2020 Universal Music Operations Limitedhttp://vevo.ly/Ozj2DN","PT3M47S"
"s8RrIGsJyZI","Culita Sterp ☀️ Iancu Sterp 🔥 Costi - Sarutarile Tale (Official Video)","2020-09-21T07:30:35Z","UCCTR5nIFvWBW9MeGEGPNG4g","Cat Music","10","20.23.09","culita sterp iancu sterp costi sarutarile tale|sarutarile tale culita sterp iancu sterp costi|sarutarile tale|culita sterp|iancu sterp|costi|costi ionita|costi fortza|#followthecat|muzica|muzica 2020|music 2020|muzica noua 2020|muzica romaneasca 2020|muzica romaneasca|muzica noua|muzica dance|muzica pop|pop music|top dance music|new music|hituri 2020|hit 2020|cat music|catmusic|top melodii 2020|top dance 2020|best dance music 2020|muzic 2020","595912","27094","1423","857","https://i.ytimg.com/vi/s8RrIGsJyZI/default.jpg","False","False","Watch the official music video for Sărutările Tale performed by Culita Sterp ☀️ Iancu Sterp 🔥 Costi Stay updated on all the new trendy music with our playlist !Spotify link ➜ https://open.spotify.com/user/mn7gz1uaatup10lk0klchs9n7/playlist/0g5twCr1C6oituq3La2Div?si=-SPaFMqUTW-fhQWZ6x4IsAFollow #CulitaSterpFacebook: https://www.facebook.com/culita.sterpInstagram: https://www.instagram.com/culita.sterp/Youtube: https://www.youtube.com/user/culitza1990/Follow #IancuSterpFacebook: https://www.facebook.com/Sterp-Iancu-498640960544462/Instagram: https://www.instagram.com/sterp_iancu_98/Follow #CostiFacebook: https://www.facebook.com/DrCosti.TheProducerInstagram: https://www.instagram.com/costiofficial/Website: http://www.costi.roProduced by Costi;Music: Costi;Lyrics: Alina Manolache;Directed by Alex Ceausu; Looking for a new jam ? Follow the 🐈 !  FollowTheCathttp://catmusic.meSee what we are all about  👀 !Instagram ➜ https://www.instagram.com/catmusicromania/Share your favorite video with your friends 🙌 ! Facebook ➜ http://fb.com/CatMusicRomaniaSubscribe for more good music: https://goo.gl/Hx4S8E(P)&(C) Cat Music❌ Please, do not use this song without permission of Cat Music","PT2M29S"
"5xej_yee34I","BENDATO PER 24 ORE: LA SFIDA|| Truccarsi e fare Shopping da Bendati! Su 123 GO! CHALLENGE","2020-09-21T03:00:00Z","UCclUn3n5pqkuAItrojWkPVA","123 GO! CHALLENGE Italian","24","20.23.09","123 go challenge|123go challenge|challenge|challenges|123 go|123go|123go challenge italiano|123 go challenge italian","140048","2356","185","45","https://i.ytimg.com/vi/5xej_yee34I/default.jpg","False","False","Quando perdi uno dei tuoi sensi, i quattro rimanenti si intensificano.E oggi metteremo alla prova questa teoria con una sfida al buio!Oseresti fare acquisti da bendato? Oppure cucineresti?Se hai voglia di divertirti con i tuoi amici, allora togliti uno dei sensi e guarda che cosa succede!Le cose si faranno interessanti!Condivi questo video con i tuoi amici e fatevi una bella risata!E non dimenticare di iscriverti al canale YouTube 123 GO! CHALLENGE per altri video come questo!#123go #commedia #bendatoQuesto video è realizzato a scopo di intrattenimento; Non ne garantiamo la completezza e l'affidabilità. Qualsiasi azione venga intrapresa è a proprio rischio e pericolo e non saremo responsabili per danni o perdite. É responsabilità dello spettatore usare giudizio, cura e precauzioni se intende replicare.Il seguente video mostra l'attività di attori professionisti in un ambiente controllato- usate precauzioni e giudizio se intendete replicare.Iscriviti a 123 GO! CHALLENGE Italian: http://bit.ly/2McYw4TMusica di Epidemic Sound https://www.epidemicsound.com/ Materiali usato (foto, filmati e altro):    https://www.depositphotos.com    https://www.shutterstock.com    https://elements.envato.com","PT10M32S"
"UHEKzaBpbRI","IRIS","2020-09-17T22:40:16Z","UCf40E1HUuZ7f2thPRGpq5Vw","Speranza - Topic","10","20.23.09","Speranza|IRIS","43767","2512","28","213","https://i.ytimg.com/vi/UHEKzaBpbRI/default.jpg","False","False","Provided to YouTube by Universal Music GroupIRIS · SperanzaIRIS℗ 2020 Sugar SrlReleased on: 2020-09-17Associated  Performer, Vocals: SperanzaProducer: simooAuthor: Ugo ScicoloneComposer: Simone CappuccioAuto-generated by YouTube.","PT2M49S"
"x2NV6hOjPnM","La VERA potenza di Tesla Model Y SUL BANCO PROVA!","2020-09-22T10:00:14Z","UCCLzGL_S1mktlzZruZQgwEQ","MatteoValenza","2","20.23.09","tesla model y|tesla|model y|banco prova|carburatori bergamo|tesla model y italia|tesla model y italiano|nuova tesla model y|tesla model y ita|tesla model y recensione|test drive|tesla y|prova su strada tesla model y|tesla model y anteprima|tesla model y test drive|matteo valenza|nano tesla|prova sui rulli|rulli|tesla model y dyno test|dyno test|dyno|tesla dyno|tesla model y 2020|tesla model y review 2020|gigaberlin","20827","1276","13","138","https://i.ytimg.com/vi/x2NV6hOjPnM/default.jpg","False","False","Abbiamo provato a lanciare alla massima potenza Tesla Model Y sul banco prova e il risultato è stato strabiliante. Abbiamo misurato 478cv e 979nm di coppia , la misurazione è stata effettuata con l'80% di batteria ... #TeslaModelY #Test #480cvLa recensione di Tesla Model Y : https://youtu.be/CYubwtNtT4ELe differenze di Tesla Model Y con Tesla Model 3 : https://youtu.be/F5fwRZtRkwECarburatori Bergamo : http://www.carburatoribergamo.it/Risultati Banco Prova : https://drive.google.com/file/d/10DMqOl1r_nS0IqDyVW5oRm7lGdfsXY0D/view?usp=sharingIscriviti al canale: http://bit.ly/model3italiae se sei tipo da Telegram : https://t.me/matteovalenza_ytPer usufruire di uno sconto su un acquisto di una Tesla utilizza il codice sconto qui: https://ts.la/matteo27396 segui queste istruzioni è facilissimo : https://youtu.be/5Xm3l5yOilA?t=217Merchandising : https://shop.matteovalenza.comMi trovi anche sui social :Facebook : https://www.facebook.com/matteo.valenza.ytTelegram : https://t.me/matteovalenza_ytInstagram : https://www.instagram.com/matteovalenza_Twitter : https://www.twitter.com/matteovalenza_TikTok : matteovalenza_Qui ci sono tutti gli accessori che ho recensito su amazon , tutta la mia attrezzatura e tanto altro ! dai una occhiata !https://www.amazon.it/shop/matteovalenzaGrazie mille per aver guardato il mio video!Matteo Valenza","PT11M16S"
