video_id,title,publishedAt,channelId,channelTitle,categoryId,trending_date,tags,view_count,likes,dislikes,comment_count,thumbnail_link,comments_disabled,ratings_disabled,description,duration
"xAvPkZ99Jfo","Ultimo - 22 Settembre","2020-09-22T12:00:00Z","UCpprts-5FuflykTdxedP1oQ","Ultimo Channel","10","20.23.09","ultimo|22 settembre|ultimo peter pan|pianeti|peter pan|colpa delle favole","848972","72746","889","3297","https://i.ytimg.com/vi/xAvPkZ99Jfo/default.jpg","False","False","ascolta-scarica il brano : https://ffm.to/22settembreCon Marco Giallini e Ludovica MartinoUna produzione Maestro ProductionRegia: Younuts! (Antonio Usbergo & Niccolò Celaia)Produttore Esecutivo: Antonio GiampaoloOrganizzatore Generale: Tatiana ColonnaAiuto Regia: Rocco GialliniMontaggio: Francesco GalliColor: Alessandro RocchiDirettore di Produzione: Livia GabriottiAssistente Operatore: Filippo SalvestriAiuto Operatore / Video Assist: Simone MastronardiCapo Elettricista: Alessandro D’EmiliaElettricista: Marco RivoltaMacchinista: Federico Coppo MammolottiMacchinista: Alfio TartabiniOperatore Jimmy: Giovanni Maria MoratelliScenografia: Alessandro IacopelliAssistente Scenografo: Alessandra VoglinoAssistente Scenografo: Emanuela SantiniCostumista: Noemi IntinoTruccatrice: Claudia De SimoneAssistente di Produzione: Aldo SurricchioAssistente di Produzione: Flaminia GentiliAssistente di Produzione: Emanuele PelilliAssistente Montaggio: Laura LeitermannFoto Backstage: Lorenzo Gargiulo, Renato De BlasioAmministrazione: Giammario D’EramoAutista: Roberto ZelocchiAutisti NCC: Maurizio Barbetti, Antonio OrfeoCAST: Tiziano PerroneGiuseppina BoscoClaudio Dell’AnnaAshley Perez VasquezDaniel PanisMaxime Filippo PizzutiMarisandra BassanelliMarika MaviglioDiego ChimeraMassimiliano MorelliAlberto CaniniFerdinando Di VirgilioFabrizio CerquaUmberto TantatiClaudio DavidRingraziamenti: Mind JewelsPietro Giusti “Bar Giusti” LabicoMake Green CateringPizzeria dal 136Carlo Avella x F.ll Cartocci Srl Red Fashion Talent AgencyMichela TerzaghiFrancesco MattognoMichela BaldiMirko ScaramellaGiorgia SantiniDesiree ChiaradonnaPinoIl video è stato realizzato rispettando tutte le misure di sicurezza a tutela del contenimento del virus COVID-19.","PT4M42S"
"pn-oidRYnLE","Juventus 3-0 Sampdoria | Tris alla Samp con Kulusevski, Bonucci e CR7 | Serie A TIM","2020-09-20T23:45:01Z","UCBJeMCIeLQos7wacox4hmLQ","Serie A","17","20.23.09","kulusevski juventus|kulusevski|Serie A|juve sampdoria|Sampdoria|juventus sampdoria 3 0|juventus sampdoria|Cristiano Ronaldo|Ronaldo|Higuain|Dybala|highlights|Juventus|AC Milan|Inter Milan|Napoli|Roma|CR7|goals|full highlights|watch|stream|partita|migliori gol|migliori in campo|migliori al mondo|gol del mese|federcalcio|calcio|Italia|lukaku|de ligt|Lazio|juventus samdoria highlights|juventus highlights|bonucci|weston mckennie","1556359","41099","1436","1656","https://i.ytimg.com/vi/pn-oidRYnLE/default.jpg","False","False","Lo svedese a segno dopo 12’. Una traversa per Cristiano Ronaldo nel primo tempo. Pirlo stupisce schierando dal 1’ il giovane Frabotta a sinistra | Serie A TIMThis is the official channel for the Serie A, providing all the latest highlights, interviews, news and features to keep you up to date with all things Italian football.Subscribe to the channel here! https://bit.ly/2OM2Eax Find out more about the Serie A at: http://www.legaseriea.it/en/ Questo è il canale ufficiale della Serie A, dove potrai avere accesso ai momenti salienti, alle interviste, alle notizie e alle funzionalità del momento per rimanere aggiornato sulle ultime novità del campionato.Iscriviti qui al canale! https://bit.ly/2OM2EaxPer maggiori informazioni sulla Serie A: http://www.legaseriea.it/it","PT4M13S"
"uBUbDu2z290","Milan 2-0 Bologna | Una doppietta dell’eterno Ibrahimovic lancia il Diavolo | Serie A TIM","2020-09-21T23:45:01Z","UCBJeMCIeLQos7wacox4hmLQ","Serie A","17","20.23.09","Ronaldo|Serie A|Higuain|Dybala|highlights|Juventus|AC Milan|Inter Milan|Napoli|Roma|CR7|Cristiano Ronaldo|goals|full highlights|watch|stream|partita|migliori gol|migliori in campo|migliori al mondo|gol del mese|federcalcio|calcio|Italia|lukaku|de ligt|Lazio|zlatan ibrahimovic|zlatan ibrahimovic best goals|zlatan ibrahimovic ac milan|zlatan ibrahimovic highlights|zlatan ibrahimovic reaction|ac milan|ac milan vs bologna|ac milan highlights","953411","28314","476","885","https://i.ytimg.com/vi/uBUbDu2z290/default.jpg","False","False","I rossoneri centrano la prima vittoria stagionale: decisiva una doppietta dello svedese | Serie A TIMThis is the official channel for the Serie A, providing all the latest highlights, interviews, news and features to keep you up to date with all things Italian football.Subscribe to the channel here! https://bit.ly/2OM2Eax Find out more about the Serie A at: http://www.legaseriea.it/en/ Questo è il canale ufficiale della Serie A, dove potrai avere accesso ai momenti salienti, alle interviste, alle notizie e alle funzionalità del momento per rimanere aggiornato sulle ultime novità del campionato.Iscriviti qui al canale! https://bit.ly/2OM2EaxPer maggiori informazioni sulla Serie A: http://www.legaseriea.it/it","PT4M13S"
"q95KgcmNdvU","Ep.29 Feticismi discografici con Mara Maionchi e Rosa Chemical - Muschio Selvaggio Podcast","2020-09-21T13:00:25Z","UCg7mcZKjupbLdsuiMBVTuDw","muschio selvaggio","22","20.23.09","muschio selvaggio|fedez|luis|fedez podcast|luis podcast|luis sal e fedez|muschio selvaggio podcast|muschio selvaggio mara maionchi|mara maionchi intervista|mara maionchi|rosa chemical|rosa chemical intervista|rosa chemical muschio selvaggio|rosa chemical fedez|mara maionchi fedez","728092","50810","441","2153","https://i.ytimg.com/vi/q95KgcmNdvU/default.jpg","False","False","Instagram: https://www.instagram.com/muschioselvaggio/?hl=itSpotify: https://open.spotify.com/show/6jBWY6Mup7iEFSYvMiVw7b?si=y2UYfu2uQYKUyrp-sMjBrAApple Podcast: https://podcasts.apple.com/it/podcast/muschio-selvaggio/id1495854773","PT1H17S"
"GViKhJogxaE","CARNIVORI 🍔 VS VEGANI 🥑 - BATTAGLIA EPICA - iPantellas","2020-09-19T11:29:57Z","UCD-aXv7CMezGSTfxmKAD6Ag","iPantellas","24","20.23.09","ipantellas|parodia|video divertenti|carnivori|vs|vegani|ricette|cibo|food|carne|pesce|sushi|cucina|mangiare","1569575","137479","3028","7241","https://i.ytimg.com/vi/GViKhJogxaE/default.jpg","False","False","★25O.OOO LIKE PER UN NUOVO VIDEO★Vegano o carnivoro non importa...Il cibo è buono in tutte le sue forme! TIK TOK - https://www.tiktok.com/@ipantellas➜ ISCRIVITI AL NOSTRO CANALE http://www.youtube.com/subscription_center?add_user=iPantellasINSTAGRAM https://www.instagram.com/ipantellas/iPantellas tornano con un nuovo video a tema food! Tutti in tavola a mangiare con le ricette fai da te! CARNIVORI VS VEGANI - chi vincerà? Preferisci un bella fiorentina o un delizioso piatto di cucina vegana? Pesce, sushi, Ribeye, controfiletto, tagliata di fassona, tartare & salumi vs Verdure fresche,piatti a base, vegetale, tofu, seitan, pomodori, peperoncini e chi più ne ha più ne metta!","PT10M35S"
"i-Fbqpc8rSI","[SBROCCO da RICOVERO] SONO FUORI DI TESTA!!! VERONA-ROMA 3-0 a TAVOLINO!!! DIAWARA FUORI LISTA!!!","2020-09-22T15:46:39Z","UCnl9WCtAhvhY6zqtDIFzyfg","Gabboman","17","20.23.09","verona roma 3 0|verona|roma|diawara|verona roma 3 0 a tavolino|gabboman|sfogo|gabboman sfogo|gabboman verona roma 3 0 a tavolino|youtuber|fonseca","176893","19343","261","1725","https://i.ytimg.com/vi/i-Fbqpc8rSI/default.jpg","False","False","Abbiamo perso 3-0 a TAVOLINO!!! La dirigenza si è dimenticata di mettere Diawara in lista, ha giocato e non avrebbe potuto... STASERA ME RICOVERANO!!! Verona-RomaISCRIVITI su entrambi i nostri canali 👉🏻@Gabboman calcio XTRA 👉🏻 @Gabboman   Per abbonarti clicca qui: https://www.youtube.com/channel/UCnl9WCtAhvhY6zqtDIFzyfg/joinVi ricordo di attivare la campanella 🔔 per rimanere sempre aggiornati e ricevere le feed dei miei video! SEGUIMI SU:👉🏻 Gabboman calcio Xtra!!! https://www.youtube.com/channel/UCZowc-A6_9XZJMN6Y8KR_tQ?Youtube 🎮👉🏻 http://www.youtube.com/c/GabbomanSecondo Canale Youtube 🎮👉🏻https://www.youtube.com/channel/UCyMfaK4SmYK5TXYuZuxN3TgInstagram 📱👉🏻 https://www.instagram.com/gabboman7/Twitch 🟣🎮👉🏻 https://www.twitch.tv/gabbomanTelegram 🔵🧾👉🏻 https://telegram.me/gabboman7TIK TOK 👉🏻 https://www.tiktok.com/@gabboman7Facebook 📲👉🏻 https://www.facebook.com/GabbomanOfficial/Twitter 📈👉🏻 https://twitter.com/Gabboman7Se ti è piaciuto supportami con un mi piace, CONDIVIDI E ISCRIVITI al mio Canale! Un Saluto! ;)","PT8M5S"
"g6EizggKL2A","😈 AMONG US, il King colpisce ANCORA! da IMPOSTORE!","2020-09-21T12:01:37Z","UC1jTVZboWRPpjGKAN921M5w","CiccioGamer89","20","20.23.09","CiccioGamer89|CiccioGamer","396847","34805","695","359","https://i.ytimg.com/vi/g6EizggKL2A/default.jpg","False","False","Seguimi su Instagram: https://instagram.com/cicciogamer_89INSTANT GAMING: https://www.instant-gaming.com/igr/CiccioGamer89/Acquista su Amazon con il mio Link : https://tinyurl.com/y5q2977d Il Server Discord UFFICIALE di Cicciogamer89: https://discord.gg/bD2mQgkTelegram Ufficiale Cicciogamer89: https://t.me/CiccioGamer_89_89#amongus #cicciogamer89 #online #partitaonline","PT10M53S"
"_2NUVXizasE","Parma 0-2 Napoli | Osimhen entra e dà la scossa, in gol Mertens e Insigne | Serie A TIM","2020-09-20T15:30:03Z","UCBJeMCIeLQos7wacox4hmLQ","Serie A","17","20.23.09","Ronaldo|Serie A|Higuain|Dybala|highlights|Juventus|AC Milan|Inter Milan|Napoli|Roma|CR7|Cristiano Ronaldo|goals|full highlights|watch|stream|partita|migliori gol|migliori in campo|migliori al mondo|gol del mese|federcalcio|calcio|Italia|lukaku|de ligt|Lazio|Parma|parma napoli|napoli parma|parma napoli 0 2|parma napoli highlights|mertens|insigne|osimhen|osimhen napoli|osimhen highlights|napoli highlights","934747","22775","525","855","https://i.ytimg.com/vi/_2NUVXizasE/default.jpg","False","False","Napoli vincente all’esordio in campionato, Parma battuto per 2-0 | Serie A TIMThis is the official channel for the Serie A, providing all the latest highlights, interviews, news and features to keep you up to date with all things Italian football.Subscribe to the channel here! https://bit.ly/2OM2Eax Find out more about the Serie A at: http://www.legaseriea.it/en/ Questo è il canale ufficiale della Serie A, dove potrai avere accesso ai momenti salienti, alle interviste, alle notizie e alle funzionalità del momento per rimanere aggiornato sulle ultime novità del campionato.Iscriviti qui al canale! https://bit.ly/2OM2EaxPer maggiori informazioni sulla Serie A: http://www.legaseriea.it/it","PT4M13S"
"LuhwBXVLRGU","Emis Killa & Jake La Furia raccontano “17” ad Antonio Dikele Distefano in teatro | ESSE MAGAZINE","2020-09-21T11:59:16Z","UC0TFalPRyuOWuOgVgm0Lg9Q","ESSE MAGAZINE","10","20.23.09","esse|magazine|sto magazine|freestyle|rap|freestyle rap|rapper|hip hop|sto|interviste artisti rap|interviste rap|musica rap|rap italiano|Jake La Furia|Club Dogo|Emis killa|17|nuovo album","160613","10086","122","634","https://i.ytimg.com/vi/LuhwBXVLRGU/default.jpg","False","False","Iscriviti al canale YouTube ESSE MAGAZINE: http://bit.ly/YTessemagazineEsse Magazine presenta: Emis Killa & Jake La FuriaUna produzione Esse MagazineIscriviti alla nostra newsletter: https://www.essemagazine.it/news/questa-volta-abbiamo-pensato-a-te-che-ci-leggi-sempreProva Apple Music per 3 mesi: https://www.apple.com/it/apple-music/Ascolta le nostre playlist su Apple Music: https://music.apple.com/it/playlist/esse-music/pl.8d96acdf7c1946419d42201b0f060c30Visita il nostro sito: www.essemagazine.itUnisciti alla nostra Community su Telegram: http://bit.ly/ESSEcommunity Segui #EsseMagazine su Instagram: http://bit.ly/IGessemagazine","PT43M21S"
"z9KMXbSUw3w","Achille Lauro - Maleducata (Baby 3 Official Soundtrack) - Official Video","2020-09-22T12:00:13Z","UCBn0LqkY6sTa1iw-NQOGEbA","Achille Lauro","10","20.23.09","nyxcosmetics|ACHILLE LAURO|LAURO|me ne frego|1969|maleducata|bam bam twist|16 marzo|rolls royce|c'est la vie|baby 3|netflix|serie netflix|baby3","114857","7640","133","516","https://i.ytimg.com/vi/z9KMXbSUw3w/default.jpg","False","False","Achille Lauro - Maleducata (Baby 3 Official Soundtrack) Ascolta qui: https://achillelauro.lnk.to/Maleducata/ Una produzione Borotalco.tvRegia e montaggio: Giulio RosatiExecutive Producer: Matteo StefaniDOP: Tommaso Terigi1st AD/Producer: Matilde CompostaLocation Manager/Producer: Andrea VetrallaProducer: Tommaso SpagnoliCasting director: Monica Conte Focus Puller: Rocco Cirifino1st AC: Daniele CatenazziSteadycam: Loris GalettaCapo elettrico: Alan Zacchetti Elettricisti: Giorgio Messina, Lorenzo Massa Saluzzo, Leonardo Bosatra, Simone Giannico, Paolo RandazzoCapo Macchinista: Mohamed AlìStylist artista: Nicoló Cerioni Ass.stylist: Arianna Beachi, Michele PotenzaSarta: Sara PamioHair Stylist artista: Michele di Bisceglie per Simone Belli AgencyMake up artista: Maddalena Brando per Simone Belli AgencyAssistente trucco artista: Chiara Gattellaro per Simone Belli AgencyStylist comparse: Giorgia Andreazza Ass. stylist: Lucrezia SgualdinoMake up comparse: Alessandra VillaAss. Make Up: Francesca PapapiccoHair stylist: Camilla Batista CremaScenografia: Isotta SanctusAss. scenografi: Giacomo Broggini, Davide Orlando BenzaColor: Lorenzo AmeriAss. montaggio: Riccardo BelleiVfx: Mattia RosatiExecutive supervisor: Andrea BiscaroAss di produzione: Irene Simoncini, Maria Onano, Franscesco Castagnino, Yuri Falco, Gloria MenegattiService: VideodesignAmministrazione: Agnese Incurvati, Annamaria ModicaGrazie a: Angelo Calculli, Giuseppe Di Morabito, Danilo Paura, Reamerei, Lorenzo Seghezzi, Club Ippico la Valletta, Elena Minotti, Edy Campo, Mattia Di Lullo, Nyx Cosmetics, MK3, Elektra, Warner Music Italy#AchilleLauro #Maleducata #Baby3Product Placement: NYX COSMETICS #nyxcosmeticsIl video è stato realizzato rispettando tutte le misure di sicurezza a tutela del contenimento del virus SARS-CoV-2.Il contiene marchi e prodotti per fini commerciali.","PT3M59S"
"hdoeV5KlgBs","INTERVISTE ALCOLICHE: IL CORONAVIRUS - Giacomo Hawkman","2020-09-22T11:45:09Z","UCHOgKgVGNbftbVqu97SgWuw","Giacomo Hawkman","24","20.23.09","interviste alcoliche corona virus|corona virus|giacomo hawkman|giacomo|hawkman|scambiare i cellulari|covid|covid19|non c'è ne coviddi|coronavirus italia|coronavirus oggi|milanese imbruttito|interviste imbruttite|mascherine|mascherine chirurgiche|amuchina|discoteche|contagio|pandemia|coppie|fidanzati|scambio cellulari|tampone|tamponi|far baciare sconosciuti|parlare male|the show|interviste","42609","2526","133","164","https://i.ytimg.com/vi/hdoeV5KlgBs/default.jpg","False","False","INSTAGRAM: @GiacomoHawkman Oggi sono andato in giro a chiedere ai ragazzi e ragazze che incontravo quanto fossero informati sul CORONA VIRUSIn un momento storico così particolare come questo è giusto cercare di fare un pò di chiarezza.Attraverso il format delle interviste alcoliche ho voluto affrontare una tematica seria e attuale che riguarda tutti noi.Grazie alle persone per aver partecipato al video.MI TROVI ANCHE SUI SEGUENTI SOCIAL:Facebook: Giacomo HawkmanInstagram: @giacomohawkmanSnapchat: GiacomoHawkmanTwitter: GiacomoHawkman","PT10M3S"
"tx_I_fnfn98","Juve-Samp 3-0, Pirlo: Bene l'atteggiamento propositivo. Ho in testa squadra con centravanti","2020-09-20T22:13:01Z","UCP3HLYi2ECQhgKXMSbTO-5A","EsteNews","17","20.23.09","Pirlo|Andrea Pirlo|Juventus|Serie A|Juventus-Sampdoria|Juve-Samp|Juventus-Sampdoria 3-0|Juve-Samp 3-0|Andrea Pirlo oggi|Estenews|Estenews Pirlo|Pirlo video|Video|Pirlo Juve|Pirlo Juventus|Pirlo dopo Juve-Samp|Juventus italia|Juventus Pirlo|Andrea Pirlo intervista|Pirlo intervista|Pirlo Juventus Sampdoria","180810","4104","110","329","https://i.ytimg.com/vi/tx_I_fnfn98/default.jpg","False","False","Per non perdervi nessun contenuto seguite i nostri Account social ufficiali:Instagram: https://www.instagram.com/estenews_official/Facebook: https://www.facebook.com/Estenews/  Per ulteriori informazioni su Este News: http://estenews.it/  | Este News","PT7M30S"
"Nw3DcrwCF-Q","Come MI VEDO VS come mi VEDONO gli altri","2020-09-22T12:26:18Z","UC7taYIDsseS-WAbdCvHbrIw","Casa Surace","23","20.23.09","[none]","65548","7111","88","142","https://i.ytimg.com/vi/Nw3DcrwCF-Q/default.jpg","False","False","Sii sempre te stesso, ma piano piano! (Cit. Nonno Andrea)Escici MI PIACE su:Facebook https://www.facebook.com/casasurace/Instagram www.instagram.com/casasurace#casasurace #sevuoipuoi #adv","PT5M9S"
"Md3qYNYxdrE","INTER 7-0 PISA | OPEN ACCESS + EXTENDED HIGHLIGHTS | Fans return as Inter hit 7️⃣once again! 🙌⚫🔵","2020-09-20T06:00:02Z","UCvXzEblUa0cfny4HAJ_ZOWw","Inter","17","20.23.09","Inter|Internazionale|Inter Milan|fc inter|FC Internazionale|fc internazionale milano|inter tv|Inter Media House|inter channel|hakimi|lukaku|lautaro|alexis|eriksen|conte|pisa|moscardelli|tifosi|san siro|kolarov|inter pisa|highlights inter pisa|highlights|gagliardini","441731","12520","318","687","https://i.ytimg.com/vi/Md3qYNYxdrE/default.jpg","False","False","53 days on from the last time they took to the pitch at San Siro, Inter played their third pre-season fixture. It finished Inter 7-0 Pisa (a Lautaro hat-trick, a Christian Eriksen brace and goals from Romelu Lukaku and Roberto Gagliardini) at San Siro in front of 1,000 spectators, who returned to the stadium after spending seven months away (the last time the Nerazzurri played in front of a crowd was against Napoli in the Coppa Italia in February). Relive this special afternoon through the lens of our exclusive Open Access camera and the extended highlights of the match.Le sensazioni di un'estate lunghissima che volge al termine e di un campionato che sta per ricominciare, quelle del prato di San Siro calpestato dai tacchetti 53 giorni dopo l'ultima volta. Inter-Pisa finisce 7-0 (tripletta di Lautaro, doppietta di Christian Eriksen e gol di Romelu Lukaku e Roberto Gagliardini), a San Siro, davanti a mille spettatori che tornano ad assistere ad un match al Meazza dopo 7 mesi (l'ultima volta a febbraio, Inter-Napoli di Coppa Italia). Rivivi i migliori momenti del pomeriggio con la nostra camera esclusiva di Open Access e gli extended highlights della gara!🖋 SUBSCRIBE on YOUTUBE 📹👇🏻https://www.youtube.com/subscription_center?add_user=interFollow us 📱 💻 👇🏻FACEBOOK: http://facebook.com/interINSTAGRAM: https://instagram.com/interTWITTER: http://twitter.com/inter_enSNAPCHAT: http://snapchat.com/add/interofficialINTER OFFICIAL APP: http://www.inter.it/en/inter-official-app","PT10M14S"
"uq0A0LBS5w8","STUDENTI RICCHI VS STUDENTI NORMALI || Rientro A Scuola Ricchi vs Poveri by 123 GO! SCHOOL","2020-09-17T07:00:07Z","UCKtMLmINLbhzSB3HJI8M_jg","123 GO! SCHOOL Italian","24","20.23.09","go|123go|123go! scuola|123goschool|scuola|fai da te|scherzo|trucchi|trucchetti|ambiguo|imbarazzante|trucchi utili|scherzi|divertente|tiktok|tik tok|sketch","1326180","15582","3888","1118","https://i.ytimg.com/vi/uq0A0LBS5w8/default.jpg","False","False","Lo voglio e l’avrò! L’eterna lotta fra i ragazzi ricchi e quelli poveri. Oggi vi mostreremo altre differenze tra i ragazzi ricchi e quelli poveri! Vi siete trovati in una situazione di ricchi contro poveri come questa? Fatecelo sapere nei commenti!Non dimenticate di condividere questo video con i vostri amici e iscrivetevi alla pagina YouTube di 123 GO! SCHOOL, per altri fantastici video come questo!#123GO #divertente #scuola #ricco #povero #studentiIscriviti: https://bit.ly/33IG4rOMusica daEpidemic Sound: https://www.epidemicsound.com/Materiali usato:https://www.depositphotos.comhttps://www.shutterstock.comhttps://elements.envato.comQuesto video è realizzato a scopo di intrattenimento; Non ne garantiamo la completezza e l'affidabilità. Qualsiasi azione venga intrapresa è a proprio rischio e pericolo e non saremo responsabili per danni o perdite. É responsabilità dello spettatore usare giudizio, cura e precauzioni se intende replicare.Il seguente video mostra l'attività di attori professionisti in un ambiente controllato- usate precauzioni e giudizio se intendete replicare.","PT10M3S"
"pSXA4IERWyk","Tormentoni Estivi 2020 [PARODIA] - PanPers","2020-09-21T12:00:13Z","UCgNMoAbuVFn22XABkqrIVmA","PanPersTube ©","23","20.23.09","colorado|panpers|pampers|andrea|pisani|luca|peracino|panperstube|parodie|parodia|estate|estate 2020|tormentoni estivi|tormentoni|canzoni estive|Elodie|rocco Hunt|ana mena|ciclone|ad un passo dalla luna|irama|mediterranea|non mi basta più|baby k|chiara ferragni|karaoke|caraoke|Guantanamera|alessandra amoroso|amoroso|boomdabash","191915","19466","158","188","https://i.ytimg.com/vi/pSXA4IERWyk/default.jpg","False","False","Quest'anno non avendo avuto tempo di farle singolarmente (tolto Shade del nostro cuore che ne merita una personale) abbiamo deciso di fare un Medley.Mix Audio: SdrushiRiprese: FaveToFrameAudio: Roberto Zordan (non pagato)Scenografie: Luca Bartolino (anche amante in armadio)Attrice: Elena Giberti (che ve lo dico a fare ha Instagram)Twitch: https://www.twitch.tv/sfiatatoioSpotify: https://spoti.fi/34utayfTik Tok: https://vm.tiktok.com/n7gEsy/Instagram: @ipanpersTwitter: @panpersofficial","PT3M50S"
"unZpEayPXio","Dixie D'Amelio - Be Happy (ft. blackbear & Lil Mosey) [Remix] Official Music Video","2020-09-20T17:00:10Z","UCLOEGprmycLLbyzBj2jozLg","Dixie D'Amelio","22","20.23.09","dixie damelio|dixie d'amelio|dixie|damelio|be happy|music video|tik tok|official music video|dixie damelio be happy|dixie d'amelio be happy|be happy music video|dixie damelio music video|dixie d'amelio music video|charli damelio|charli d'amelio|tiktok|charli|d'amelio|remix|black bear|lil mosey|be happy remix","10688835","1037025","22951","70887","https://i.ytimg.com/vi/unZpEayPXio/default.jpg","False","False","Be Happy Remix Featuring  @blackbear  and  @Lil Mosey  Stream/Buy The New Remix Below:https://hitco.lnk.to/BeHappyRemixCreditsDirector | John TashiroExecutive Producer | Lucas Prevost & Harrison CorwinVideo Commissioner | Dominic WestProduction Company | SHOTCLOCK Subscribe for more official content from Dixie: https://www.youtube.com/dixiedamelio?...Connect with DixieTikTok: https://www.tiktok.com/@dixiedamelioInstagram: https://www.instagram.com/dixiedamelioTwitter: https://twitter.com/dixiedamelioWebsite: https://www.dixiedamelio.comLyricsSometimes I don’t wanna be happyDon’t hold it against meIf I’m down just leave me there, let me be sadblackbearI don't wanna get up outta bed this season All bad days, walk away... leave me bleedinIt's fuck you and youFuck today, fuck this pain I been feelinI've got the devil on my shoulder, heart is getting colder But, I keep to myself Anxiety been creepin', staring at the ceilingBut, I don't need your help 'cause Sometimes I don’t wanna be happyDon’t hold it against meIf I’m down just leave me there, let me be sadSometimes I just wanna be lonelyDon’t need you to hold meIf I’m low you don’t need to care, let me be sadWhat’s the matter with that?Oh, oh, ohWhat’s the matter with that?Oh, oh, ohWhat’s the matter with… Lil MoseySometimes I be by myself Cause it feel better Sometimes my heart feel like snowLike it’s cold weather I know everyone fake I just roll wit it So you can’t come with meIf you can’t roll wit usAll of you making me madI had to spazz out I know it made me feel better So I had to cash out This fame not what it seemsIt brings bad bad energy ButSometimes I don’t wanna be happyDon’t hold it against meIf I’m down just leave me there, let me be sadSometimes I just wanna be lonelyDon’t need you to hold meIf I’m low you don’t need to care, let me be sadWhat’s the matter with that?Oh, oh, ohWhat’s the matter with that?Oh, oh, ohBad days, it’s okayLet me feel it (uh-huh, uh-huh)In some ways, you’ve gotta break your heart to heal it (heal it)I’ve got chips on my shoulder, only gettin’ olderSo, I keep to myselfAin’t tryna complain just don’t wanna explain it (explain it)ButSometimes I don’t wanna be happyDon’t hold it against meIf I’m down just leave me there, let me be sadSometimes I just wanna be lonelyDon’t need you to hold meIf I’m low you don’t need to care, let me be sadWhat’s the matter with that?Oh, oh, ohWhat’s the matter with that?Oh, oh, oh What’s the matter with that?Oh, oh, ohWhat’s the matter with that?Oh, oh, oh  #dixiedamelio #behappy #remix #blackbear #lilmosey","PT3M15S"
"FJt4pHxZo0s","Marvel Studios’ WandaVision | Trailer Ufficiale | Disney+","2020-09-21T01:05:54Z","UClssoj08grgttJtZhsbuGRw","Marvel Italy","1","20.23.09","marvel|marvel italia|marvel it|marvel ita|ironman|iron man|avengers|tony stark|hulk|captain america|Marvel|MCU|Wanda Vision|Marvel Trailer|Disney plus|Disneyplus|New trailer|Wanda|Vision|Wanda Maximoff|Elizabeth Olsen|Paul Bettany|Kat Dennings|Darcy Lewis|Kathryn Hahn|Jimmy Woo|Randall Park","146534","7374","105","390","https://i.ytimg.com/vi/FJt4pHxZo0s/default.jpg","False","False","Benvenuti a #WandaVision. Prossimamente su #DisneyPlus.Disney + Pixar + Marvel + Star Wars + National Geographic = #DisneyPlus. Un Nuovo Mondo Ti Aspetta. Iscriviti su https://www.disneyplus.com.Seguici anche su:Facebook: https://www.facebook.com/DisneyPlusIT/ Instagram: https://www.instagram.com/disneyplusit/Twitter: https://twitter.com/DisneyPlusIT","PT1M21S"
