video_id,title,publishedAt,channelId,channelTitle,categoryId,trending_date,tags,view_count,likes,dislikes,comment_count,thumbnail_link,comments_disabled,ratings_disabled,description,duration
"urUUYhCCZ_c","CHALLENGE ASMR : SE TI ADDORMENTI PERDI! Livello INFATTIBILE (sub eng)","2020-09-21T17:37:36Z","UCo6VVJ2-Tr9xq8luJR5NiVA","Chiara ASMR","24","20.23.09","asmr|asmr ita|chiara asmr challenge|asmr challenge se ti addormenti perdi|for who doesn't fell asmr|video rilassante|asmr lid sounds|asmr coperchio|asmr per dormire","152014","19370","206","1002","https://i.ytimg.com/vi/urUUYhCCZ_c/default.jpg","False","False","Dai che ce la facciamo ad arrivare a 60.000 LIKE!Lo sai che ho scritto un libro sull'ASMR? Lo trovi in libreria o su Amazon: https://amzn.to/2ZLqdXGTimestamps: 00:00 - 00:54 intro1:03 spiegazione challenge3:55 rimozione e scioglimento pensieri negativi (zac, tongue clicking, tico)8:50 primo trigger, il metro13:59 secondo trigger, lid sound22:22 tisana della buonanotte24:53 conto alla rovescia con inaudible e brushing camera27:03 buonanotteTriggers you will find: whispering, mouth sounds, tico, zac, hand movements, personal attention, tongue clicking, meter, lid sounds, brushing camera, inaudible whisperingLa wishlist Amazon per il canale: https://www.amazon.it/hz/wishlist/ls/1JRZ330SGDFJB?ref_=wl_share🌈👉🏻INSTAGRAM: https://www.instagram.com/chiara.asmr/🌈👉🏻SPOTIFY, iTunes, Amazon Music, Youtube Music : chiara asmr🌈👉🏻TINGLES: Chiara ASMR🍪NUOVO VIDEO OGNI LUNEDI' E VENERDI' ALLE 19:30🍪      fogliaVuoi sostenere il canale?Questo è mio link di affiliazione Amazon : https://amzn.to/37vacIVAttraverso un qualsiasi acquisto con questo link, riceverò una piccola commissione, senza che per voi ci sia alcun cambiamento. E' semplicemente un modo per sostenere il canale a costo zero :)Oppure puoi sostenermi su Tingles, dove potrai avere accesso a una chat e a video esclusivi :)📷 Cosa uso per registrare video? Canon 6D Mark II : https://amzn.to/2XRV580Obiettivo: Canon EF 16-35 https://amzn.to/34jXFGeNuova videocamera: https://amzn.to/2WNZiuI🎙️Che microfoni uso?Zoom h1: https://amzn.to/2KT9qeVZoom h5: https://amzn.to/2rmSVB6Tascam dr 05: https://amzn.to/35yYN9eTascam dr 40: https://amzn.to/2QOnienBlue Yeti: https://amzn.to/2qzCWQcRode NT5: https://amzn.to/33iWAgD🎤 Altri microfoni che consiglio :Zoom h4n: https://amzn.to/37B05SYZoom h6: https://amzn.to/37AdBWF💡 Altra attrezzatura: Green screen e fondale : https://amzn.to/2qzvYe1Cavalletto: https://amzn.to/2KRInR4Luci led: https://goo.gl/ypE6HQHai una domanda? Probabilmente ho risposto qui: https://www.youtube.com/watch?v=LzdiLB24IgYFor business enquiries : braidsbypre@gmail.comLa stupenda intro è stata fatta da Gloria, vi lascio il suo Instagram qui : @glodoodlesThank you for joining me :)Grazie di avermi tenuto compagnia :)Se sei arrivato/a fin qui commenta con la parola nascosta nella descrizione :)","PT29M15S"
"Sj-aL0ajmDI","Denver Nuggets vs. Los Angeles Lakers [GAME 1 HIGHLIGHTS] | 2020 NBA Playoffs","2020-09-19T04:11:15Z","UCiWLfSweyRNmLpgEHekhoAg","ESPN","17","20.23.09","lakers|lakers vs nuggets|lebron james|lebron|anthony davis|los angeles lakers|denver nuggets|los angeles lakers vs denver nuggets|nuggets vs lakers|lakers vs nuggets highlights|western conference finals|anthony davis highlights|lebron james highlights|lakers highlights|jamal murray|nikola jokic|nba playoffs|2020 nba playoffs|lebron highlights|ad lebron|nba highlights|nba bubble|2020 western conference finals|lakers news|espn|nba|nba on espn","1287873","12439","617","1452","https://i.ytimg.com/vi/Sj-aL0ajmDI/default.jpg","False","False","Check out the highlights of Game 1 between the Denver Nuggets and the Los Angeles Lakers in the Western Conference finals of the 2020 NBA Playoffs, featuring a 37-point performance from Anthony Davis and a double-double by LeBron James. #NBA #ESPN #Lakers #Nuggets #NBAPlayoffs #Sports✔️Subscribe to ESPN+ https://plus.espn.com/✔️ Get the ESPN App: http://www.espn.com/espn/apps/espn✔️Subscribe to ESPN on YouTube: http://es.pn/SUBSCRIBEtoYOUTUBE✔️ Subscribe to NBA on ESPN on YouTube: http://bit.ly/SUBSCRIBEtoNBAonESPN✔️ Watch ESPN on YouTube TV: http://es.pn/YouTubeTVESPN on Social Media:► Follow on Twitter: http://www.twitter.com/espn► Like on Facebook: http://www.facebook.com/espn► Follow on Instagram: http://www.instagram.com/espnVisit ESPN on YouTube to get up-to-the-minute sports news coverage, scores, highlights and commentary for NFL, NHL, MLB, NBA, College Football, NCAA Basketball, soccer and more. More on ESPN.com: https://www.espn.com","PT10M12S"
"cnUK28Azdb8","Dangerous Idiots Fastest Skill Extreme Truck Fails Driving, Heavy Equipment Machines Fails Working","2020-09-20T17:29:20Z","UCmim404OBCRDi8SOe3mh-ow","MachineryTV","28","20.23.09","Dangerous|Idiots|Fastest Skill|Extreme|Truck|Fails|Driving|Heavy Equipment|Machines|Fails Working|Extreme Truck|Truck Fails Driving|Truck Fails Working|Idiots Truck|Idiots Heavy Equipment|Idiots Fastest Skill Truck Fails Driving|Idiots Fastest Skill Truck Fails Working|Heavy Equipment Machines Fails Working","581056","2423","395","28","https://i.ytimg.com/vi/cnUK28Azdb8/default.jpg","False","False","Dangerous Idiots Fastest Skill Extreme Truck Fails Driving, Heavy Equipment Machines Fails Working","PT26M14S"
"LQWFODJE23I","FUNNY SCHOOL LIFE! 9 DIY School Hacks || Tips and Tricks & Funny Situations By Crafty Panda","2020-09-21T11:00:05Z","UC03RvJoIhm_fMwlUpm9ZvFw","Crafty Panda","26","20.23.09","School Hacks|School Crafts|School DIY|Back to School|School Ideas|School Life|Useful Things|Tutorial|Guide|Step By Step|How To|Simple|Easy|Life Hacks|Hacks|Tips|Tricks|DIY Activities|DIY Ideas|Do It Yourself|DIY|Crafty Panda","2492097","23037","3428","767","https://i.ytimg.com/vi/LQWFODJE23I/default.jpg","False","False","Hey there, school Pandas! Take a look at these awesome school hacks & school crafts! Try making your own awesome eyeshadow box or blackboard phone case using school supplies! Don’t forget to stay tuned for more fun school DIY ideas by Crafty Panda!If you enjoyed this video, you might also like “9 SNEAKY SCHOOL HACKS || Back to School Supplies & DIY School Hacks by Crafty Panda”: https://youtu.be/phiPJB1Wj0YLove the music used in this video? You can find our music on EpidemicSound: https://bit.ly/2JcUlBaBlackboard Phone CaseWatercolor BoxShooter GunHot TowelUnicorn NotebookTattooHoodie BagDuct Tape CutterHack For ChalkSubscribe to Crafty Panda:Bubbly: https://www.youtube.com/CraftyPandaBubbly?sub_confirmation=1Español: https://www.youtube.com/TrucosPanda?sub_confirmation=1Deutsch: https://www.youtube.com/HacksVonPanda?sub_confirmation=1Français: https://www.youtube.com/AstucesDuPanda?sub_confirmation=1Português: https://www.youtube.com/TruquesDoPanda?sub_confirmation=1Pусский: https://www.youtube.com/channel/UCsiXd1g_bLJG09kfHCfrBaQ?sub_confirmation=1Arabic: https://www.youtube.com/channel/UCX8c8zd6_SY5aapRMkp030w?sub_confirmation=1Hindi: https://www.youtube.com/channel/UCKfkSZCohr9tDAKNN4atyGQ?sub_confirmation=1Little: https://www.youtube.com/channel/UCmh3maJSWbnwYvdtoUCOmcg?sub_confirmation=1Top Crafty Panda Playlists:School Hacks:https://www.youtube.com/watch?v=i_sggC94R1E&list=PL_hNADyE5fYDQgsxox4wZLft0F-zaAXLpMakeup & Beauty Hacks:https://www.youtube.com/watch?v=qEFAnhj4_n8&list=PL_hNADyE5fYBjEiDkjcMuUS2KRtPkYChYPranks & Fun Ideas:https://www.youtube.com/watch?v=fcEi1ttwl6E&list=PL_hNADyE5fYDZbdD7P8I-iHTTBZwHZSjcLike us on Facebook:  https://facebook.com/craftypandaVisit Bored Panda website: https://www.boredpanda.comGet Animated Stickers by Crafty Panda: http://bit.ly/BPandaStickersFor sponsored content, contact us at crafty@boredpanda.com#SchoolHacks #SchoolCrafts #CraftyPanda","PT10M47S"
"dbrDlUnUZsw","Highlights: Chelsea 0-2 Liverpool | Mane's double wins it at Stamford Bridge","2020-09-20T21:00:12Z","UC9LQwHZoucFT94I2h6JOcjw","Liverpool FC","17","20.23.09","Liverpool FC|LFC|Liverpool|Anfield|Melwood|Liverpool Football Club|premier league","1155208","23820","490","1492","https://i.ytimg.com/vi/dbrDlUnUZsw/default.jpg","False","False","Sadio Mane struck twice for Liverpool, to ensure the Reds walked away from Chelsea with all three points, whilst an Alisson Becker penalty save secured a clean sheet in the first away game of LFC's Premier League season.Enjoy more content and get exclusive perks in our Liverpool FC Members Area, click here to find out more: https://www.youtube.com/LiverpoolFC/joinSubscribe now to Liverpool FC on YouTube now and get notified when new videos land: https://www.youtube.com/subscription_center?add_user=LiverpoolFC","PT1M30S"
"xlGCDKEgqok","PARODIA FALÒ SOFIA E AMEDEO!","2020-09-17T12:48:36Z","UC8yqtQKi-7uM5bGjJqqvkuw","Vincenzo Tedesco","24","20.23.09","[none]","340876","29862","282","1286","https://i.ytimg.com/vi/xlGCDKEgqok/default.jpg","False","False","Seguitemi su Instagram = @vincenzotedesco97 che disagio ogni giorno nelle storie 😂 Iscrivetevi al canale 🤪🌈💘🦄","PT10M14S"
"s0GHHvRCSow","Exclusif : Mariage de Soumboulou avec Abdoulaye Diop Khass qui lui offre 6millions","2020-09-21T11:13:59Z","UCtLWSPWa5bUMPO0wF9qcXhA","Feeling Dakar TV","22","20.23.09","#mariage Soumboulou BATHILLY#|#abdoulaye Diop khass#|#mariage#|#FeelingDakar#|#sénégal#","409368","3356","264","273","https://i.ytimg.com/vi/s0GHHvRCSow/default.jpg","False","False","Mariage de Soumboulou Bathilly et Serigne Abdoulaye Diop Khasse","PT4M16S"
"w7A9BW0z5rE","ENEMIGOS OCULTOS REMIX - OZUNA X T.Y.S X ROCHY X WILMER ROBERTS X SHELOW SHAQ X MUSICOLOGO X OMEGA","2020-09-22T00:28:07Z","UCwDi_r3CCE2WjmiY3MWSF-w","Unsolomovimientomusic","10","20.23.09","Ozuna|Enemigos Ocultos|ENOC|Omega El Fuerte|Rochy RD|El Alfa El Jefe|Dembow|T.Y.S|Wilmer Roberts|Shelow Shaq|Musicologo|Arcangel|Anuel AA|Bad Bunny Live|Cosculluela|Wisin|J Balvin|Bulin 47|Maluma|Daddy Yankee|Zion y Lennox|Lunay|Rauw Alejandro|Bryant Myers","1001349","74454","1838","7305","https://i.ytimg.com/vi/w7A9BW0z5rE/default.jpg","False","False","Remix oficial de Enemigos Ocultos Ozuna ft T.Y.S, Rochy RD, Wilmer Roberts, Shelow Shaq, Musicologo & Omega El FuerteMix by Light GMDale a me gusta & compartir!!!","PT6M12S"
"wZlvTHFuyl8","Ensi - SPECIALIST (prod. Gemitaiz) Official Video","2020-09-18T12:44:12Z","UCeE4SQ6TUTZdxux8ag_TLqQ","ENSI OFFICIAL","10","20.23.09","Ensi|Ensi specialist|specialist|Gemitaiz|ensi official|ensi numero uno|ensi abracadabra|ensi freestyle|ensi stratocaster|rap italia|musica rap|ensi oro e argento","91841","9052","37","481","https://i.ytimg.com/vi/wZlvTHFuyl8/default.jpg","False","False","ENSI - SPECIALIST (prod. GEMITAIZ) Official VideoAscolta Specialist nei digital store: https://backl.ink/142762182 CREDITS: Video: Nacho Tranquilo & Mario Zanetta Grooming: Davide Nucara Clothing: Sin Control Vintage℗ JUICY MUSIC © NUMERO UNO Instagram: https://www.instagram.com/therealensi/Facebook: https://www.facebook.com/ensiofficialTwitter: https://twitter.com/THEREALENSI#Ensi #Specialist #prodGemitaiz","PT2M26S"
"cmwe-Xx13-E","TRUCCHI FIGHI PER I VESTITI || Idee per Trasformare i Vestiti Femminili da 123 GO!","2020-09-21T08:30:01Z","UCnCOF59sixEUF5Jtp13_hMA","123 GO! Italian","24","20.23.09","fai da te|idee creative|idea creativa|scherzo|scherzi|sfida|sfide|divertimento|divertente|123GO!|123 go|123go|amici|amichevole|tutorial|vestiti|abbigliamento|trucchi abbigliamento|top|T- shirt|maglietta|pantaloni|pigiama|jeans|trucchi jeans|fai-da-te|semplificarsi la vita|trucchetti semplici|scialle","259422","6186","339","200","https://i.ytimg.com/vi/cmwe-Xx13-E/default.jpg","False","False","ISCRIVITI: http://bit.ly/2McT9TpTi sono piaciute le nostre idee? Condividi questo video con le tue amiche per loro conoscere i nostri segreti di tendenza! E non dimenticare di iscriverti al canale YouTube 123 GO! Italian per altri video!#123GO #femminile #trucchiMusica di Epidemic Sound: https://www.epidemicsound.com/Materiale di scorta: https://www.depositphotos.com https://www.shutterstock.comQuesto video è realizzato a scopo di intrattenimento; Non ne garantiamo la completezza e l'affidabilità. Qualsiasi azione venga intrapresa è a proprio rischio e pericolo e non saremo responsabili per danni o perdite. É responsabilità dello spettatore usare giudizio, cura e precauzioni se intende replicare.Il seguente video mostra l'attività di attori professionisti in un ambiente controllato- usate precauzioni e giudizio se intendete replicare.","PT10M2S"
"_51XVYJrA9Y","Sefirin Kızı 20. Bölüm","2020-09-21T21:18:39Z","UCYKPH4JKMEdCWLaEZdj42Cg","Sefirin Kızı","1","20.23.09","Sefirin Kızı|sefirin kızı fragman|sefirin kızı 1. bölüm|sefirin kızı yeni dizi|sefirin kızı konusu|engin akyürek sefirin kızı|sefirin kızı ilk bölüm|neslihan atagül sefirin kızı|sefirin kızı tanıtım|sefirin kızı startv|Neslihan Atagül|Engin Akyürek|Sancar Nare|Sancar Efeoğlu|Nare|Gediz|Uraz Kaygılaroğlu|Sancar ve Nare|vajza e ambasadorit|The Ambassador's Daughter|سانجار و ناري|مسلسل ابنة السفير الحلقة|Дочь посла|مسلسل","1559659","19762","2085","3206","https://i.ytimg.com/vi/_51XVYJrA9Y/default.jpg","False","False","Sefirin Kızı bütün bölümleri startv.com.tr'de → https://www.startv.com.tr/dizi/sefirin-kizi/bolumler/20-bolumSefirin Kızı'na Abone Olmak İçin → http://bit.ly/sfrn-kizi-dd-subSefirin kızı 20. Bölüm ÖzetGediz’in Nare’yi konaktan alıp götürdüğünü öğrenen Sancar deliye döner. O ikisini her yerde arar amabulamaz. Nare ve Gediz nereye gitmişlerdir?  Hem busorunun cevabı, hem de Nare’nin Gediz’in aşk itirafına verdiği cevap, hiç kimsenin beklemediği bir şeydir.Menekşe-Akın ittifakı zalim bir planla başlar. Alacakuş yavrusunun ardından uçup gitsin diye Melek’i kullanmaya karar verirler.Bir çocuğun mutluluğu üzerine yapılan bu plan başarılımı olacak, yoksa ayaklarına mı dolaşacak? Menekşe kazanacak mı, yoksa büyük bir kayıpla karşı karşıya mı kalacak?Sancar ve Yahya ise Kahraman’ın oynadığı oyunu ortaya çıkarmak için planlarına devam ederler. Ama Kahraman’ın konakta olan biten her şeyden haberi olmaktadır. Kahraman’ın konaktaki kulağı kim?Yapım: O3 Medya ve NGMYönetmen: Emre Kabakuşak Senaryo: Ayşe Ferda Eryılmaz - Sedef Nehir ErdemOyuncu Kadrosu:Sancar Efeoğlu: Engin AkyürekNare: Neslihan Atagül DoğuluGediz: Uraz KaygılaroğluYahya: Doğukan PolatElvan: Hivda Zizan AlpRefika: Özlem Çakar YalçınkayaAkın: Erhan AlpayGüven: Erdal KüçükkömürcüHalise: Gonca CilasunMenekşe: Tülin YazkanMüge: Esra KızıldoğanZehra: Cemre ÖktemKavruk Ömer: Edip TepeliMelek: Beren Gençalp#SefirinKızı #SefirinKızıS2 #SevdaAteşi","PT2H16M27S"
"-DrOiIrSdSg","Hercai 40. Bölüm 2. Fragmanı","2020-09-22T19:05:18Z","UC2l92bN_FWHjZZPdOYnZveg","Hercai","24","20.23.09","Akın Akınözü|Ebru Şahin|Gülçin Santıroğlu|Serhat Tutumluer|Ayda Aksel|Macit Sonkan|Serdar Özer|Oya Unustası|Tansu Taşanlar|İlay Erkök|eda başlamışlı|hercai dizisi|yeni dizi hercai|hercai yeni bölüm|hercai son bölüm|hercai tek parça|hercai fragman|hercai atv|hercai izle|hercai|atv dizisi|yeni dizi atv|atv|dizi izle|dizi|Hercai 40. Bölüm 2. Fragmanı","1015170","26575","563","3010","https://i.ytimg.com/vi/-DrOiIrSdSg/default.jpg","False","False","Ayrıcalıklardan yararlanmak için bu kanala katılın:https://www.youtube.com/channel/UC2l92bN_FWHjZZPdOYnZveg/join“İntikamdan doğan imkansız bir aşkın hikayesi”Yapımcılığını, Mia Yapım Banu Akdeniz üstlendiği, İntikamdan doğan imkansız bir aşkın hikayesi mottosuyla yola çıkan Hercai'nin başrollerini Akın Akınözü, Ebru Şahin, Gülçin Santıroğlu, Serhat Tutumluer, Ayda Aksel, Macit Sonkan, Serdar Özer, Oya Unustası, Tansu Taşanlar ve  İlay Erkök paylaşıyor.Hercai YouTube Kanalına Abone Olmak İçin; https://bit.ly/2vwmORDatv Resmi YouTube Kanalına Abone Olmak İçin; https://goo.gl/dmrDLNHercai Web Sayfası; https://goo.gl/ziLDeQ","PT56S"
"Glu52GyaC1Y","اصالة المالح ـ طول ما احنا سوا (فيديو كليب) | (Official Music Video)","2020-09-21T16:15:40Z","UCqJNTGwKmgMCwfYDbnz514Q","anasala family I أنس و أصالة","24","20.23.09","اصالة|اصاله|انس مروة|اول مرة|بيبي|تسبح|اصالة و انس|انس و اصالة|سيارة|انس واصالة|اصالة مالح|انس|انس مروة و اصالة|اصالة و انس مروة|anasmarwah|anas marwah|ميلا مروة|anasala|عائلة انس و اصالة|anasala family|أنس مروة|اصالة وانس مروة|انس و اصاله|مع اصالة و انس مروة|عائلة انصالة|حامل|اصالة حامل|الجنين|برج|خليفة|اكير|حفلة معرفة|جنس جنين|في|العالم|official music video|official|asala maleh|burj|biggest|gender|reveal|khalifa|dubai","11076428","1395967","19099","183454","https://i.ytimg.com/vi/Glu52GyaC1Y/default.jpg","False","False","على انغامي والمنصات الاخرى https://asala.lnk.to/sawaاصالة انس مروة و اصالة | انس و اصاله |اصالة المالح ـ طول ما احنا سوا | (Official Music Video) )  ----- سناب اصالة: https://www.snapchat.com/add/asalasaltyسناب انس: https://www.snapchat.com/add/anasmarwahحسابنا في تيك توك: https://vm.tiktok.com/QJ1Xvo/حساب اصالة عالانستجرام: https://www.instagram.com/asalamaleh/حساب انس عالانستجرام: https://www.instagram.com/anasmarwah/ حساب ميلا عالانستجرام: https://www.instagram.com/milamarwah/ ---- Thank you Ahmed AlNasheet for your concept & Love on this project!! Thank you Anasala family for being apart of our journey! WE LOVE YOU! Thank you Alfan Group for taking this journey home led by the awesome @MoktarLarbi !! Thank you Aida, Nouf, Muntasir, and everyone who worked on this project!! Filming/editing: Thank you Hani Fayed for being patient with us!! @HaniFayed Thank you GAD Production for Music, song, and production! @DBGAD Full Credit @ end of Song :) LOVE!!—- Contact info: info@anasalafamily.com","PT3M4S"
"adJdH0khLHs","Tiromancino - Finché Ti Va","2020-09-18T18:30:00Z","UCvdIK6-0kRFCBc80jPpuMnw","TiroMancinoVEVO","10","20.23.09","Tiromancino|Finchè|Universal|Music|Italia|srL.|Pop","85578","2619","32","132","https://i.ytimg.com/vi/adJdH0khLHs/default.jpg","False","False","Prodotto da Antonio Giampaolo per Maestro ProductionCon la partecipazione di:Giacomo Ferrara e Band Tiromancino (Antonio Marcucci, Marco Pisanelli, Francesco Stoia)Regia: Younuts! (Antonio Usbergo & Niccolò Celaia)Montaggio: Gianluca ConcaColorist: Rosario BalestrieriUn grazie Speciale a: Zegna per Styling Federico ZampaglioneOrganizzatore Generale: Livia GabriottiDirettore di produzione: Giammario D’EramoFocus Puller: Gianluca BattelliAiuto Operatore: Simone MastronardiCapo Macchinista: Claudio RomaniCapo Elettricista: Alessandro D’EmiliaAss. Elettricista: Marco RivoltaCostumista: Noemi IntinoStylist: Matteo CassanelliMake up: Claudia De SimoneScenografo: Raffaele LucciAss. scenografo: Giorgio RodinòTeam Maestro: Riccardo FedericoFoto Backstage: Jessica GaudiosoAutista Service: Giuseppe PezzaCoreografa: Alessia GattaBallerina: Vanessa GuidolinCast: Adrana Panpana, Stefania Santippo, Vittorio Aisa, Alessandro De Micheli, Gigi ElifaniThanks to:F.lli Cartocci, Gambero Rosso, La SquisiteriaIl video è stato realizzato rispettando tutte le misure di sicurezza a tutela del contenimento del virus COVID-19.Music video by Tiromancino performing Finchè Ti Va. A Virgin Records release; © 2020 Universal Music Italia Srlhttp://vevo.ly/qexgys","PT3M59S"
"N7uR0xrRaNI","NEW MUSIC! Pa' Ti - Lonely with Maluma - COMING THURSDAY","2020-09-21T14:18:00Z","UCr8RjWUQ_9KYcIPmWiqBroQ","Jennifer Lopez","10","20.23.09","Jennifer Lopez|JLo|Hispanic Heritage Month|hispanic heritage month 2020|hispanic culture|latin music 2020|jlo new music|jennifer lopez new music|jlo and maluma|jennifer lopez and maluma song|jlo maluma lonely|maluma|playlist 2020|pop playlist|playlist video|billboard|billboard 2020|billboard breakdown|tiktok live|tiktok mashup september 2020|jlo tiktok|maluma tiktok|new music 2020|tiktok influencer marketing|september 2020|pa'ti lonely","124872","7550","155","526","https://i.ytimg.com/vi/N7uR0xrRaNI/default.jpg","False","False","NEW MUSIC ANNOUNCEMENT! My two song collaboration Pa’ Ti - Lonely with Maluma is almost here! ✨ Don’t miss the TikTok Live: Behind the Video and two-part premiere event this Thursday at 6pm EST / 3pm PST. It all starts on TikTok.Pre-save the songs now: smarturl.it/PaTiLonelyPSFollow JLo:- Facebook: https://www.facebook.com/jenniferlopez/- Instagram: https://www.instagram.com/jlo/- Soundcloud: https://soundcloud.com/jenniferlopez- Spotify: https://lnk.to/JLOSpotify- TikTok: https://www.tiktok.com/@jlo - Twitter: https://twitter.com/jlo- Text Me: +1 (305) 690-0379#PaTiLonely #JenniferLopez #Maluma","PT16S"
"o9owSt9SHak","Tommaso Paradiso - Ricordami","2020-09-16T12:00:11Z","UCe4o1J6j0gV-zkYIORfhTqw","TommasoParadisoVEVO","10","20.23.09","Tommaso|Paradiso|Ricordami|Universal|Music|Italia|srL.|Pop|non avere paura|sulle nuvole tour|tommy paradiso|thegiornalisti|non avere paura testo|baby netflix|colonna sonora baby|netflix|i nostri anni|ma lo vuoi capire|oh ma lo vuoi capire|sotto il sole di riccione|sulle nuvole|ricordami|abbracciami|baciamoci|estate|andrea delogu|cocktail|anni 80|francesco montanari","474628","9439","541","737","https://i.ytimg.com/vi/o9owSt9SHak/default.jpg","False","False","Ascolta “Ricordami” http://island.lnk.to/ricordami ► Segui Tommaso Paradiso:Facebook: https://www.facebook.com/tommasoparadiso83/Instagram: http://www.instagram.com/tommasoparadisoSpotify: https://spoti.fi/2lnraWo ► Credits Con Francesco Montanari e Andrea Delogu  Una produzione Maestro Production  Regia : Younuts! (Antonio Usbergo & Niccoló Celaia) Produttore Esecutivo : Antonio GiampaoloD.O.P : Davide Manca Montaggio: Francesco GalliColorist : Alessandro RocchiMotion Graphic : Valerio MasottiOrganizzatore Generale : Michela TerzaghiAiuto Regia : Simone MastronardiDirettore di produzione : Livia GabriottiIspettore di Produzione : Giammario D’Eramo Costumi : Marta FantozziFocus Puller : Lorenzo De MarcoAiuto Operatore : Matteo AloisiVideo Assist : Giuseppe GentiliCapo Elettricista : Daniele ZonettiElettricista : Massimo MontinaroCapo Macchinista : Massimo DiamantiMacchinista : Giovanni Peyrone Stagisti Fotografia : Giulio Paolo Davoli, Ignazio Caccamo, Andrea Lo Vetro, Alessandro SaulliFonico : Andrea GuzzoScenografia : Massimo SergianniAss. Scenografia : Anna Di Franco, Giorgio Rodinò, Angeliki SyrmaAss. Costumi : Luigi D’EliaMake up : Adriana ApruzzoAss. Make up : Giulia Neri  Hair Style Tommaso : Francesco DominiciHair Cast : Italo De AngelisAss. Hair Cast : Simone AlimontiAssistente di produzione : Camilla Zanini Autisti : Petrucci Gabriele, Massucci Dino, Spitoni Stefano Un ringraziamento particolare per i costumi a: WoodenD’Inzillo, La Bottega di Alice, AnnamodeMadmoiselle Vintage Giorgia Bianchini Thanks to:Carlo CartocciMake Green / CateringGuido PlanetaSound System Gel Allestimenti per lo spettacoloBakeka Casting e Gianluca Mitrione F.ll Cartocci Srl Il video è stato realizzato rispettando tutte le misure di sicurezza a tutela del contenimento del virus COVID-19.  ► Ricordami (Testo)Noi che crediamo solo ai sogni e bastaNoi che fumiamo mentre va la pastaNoi che sbagliamo a mandare i messaggiNessuno che capisce i nostri sbagli A noi che non ci piace fare fintaA noi che a volte non abbiamo grintaAmore, Sally, toccami la manoScopiamo pure su questo divano E se finisse pure il mondo adessoLa nostra vita resterà lo stesso Abbracciami, baciamoci, ricordamiTanto comunque andrà sarà un successoAbbracciami, baciamoci, ricordamiTanto comunque andrà sarà un successo Tu che mi dici asciugati i capelliTu che ti svegli sempre dopo di meIo che non so neanche che giorno èMa son contento ce ne andremo in vacanza E se finisse pure il mondo adessoLa nostra vita resterà lo stesso Abbracciami, baciamoci, ricordamiTanto comunque andrà sarà un successoAbbracciami, baciamoci, ricordamiTanto comunque andrà sarà un successo Abbracciami, baciamoci, ricordamiTanto comunque andrà sarà un successoSarà un successoSarà un successoMusic video by Tommaso Paradiso performing Ricordami. An Island Records release; © 2020 The Sold Out Music Srl, under exclusive licence to Universal Music Italia srlhttp://vevo.ly/MNx7Ua","PT4M36S"
"CXosIjlic7c","COFFIN DANCE MEME BUT IT'S ON PLAYSTATION 1","2020-09-18T11:45:00Z","UC_kp5BOiILYQZsrH1nS3aBw","ARATA","23","20.23.09","markthehammer|arata|coffin dance|coffin dance meme|playstation|playstation 5|retro gaming|psx|playstation 1|Dancing Pallbearers|Dancing Coffin|Coffin Dancers|coffin dance compilation|ghana|gameplay|ableton|logic pro x|playstation review|playstation 2020|playstation 2021|coffin dance 2|coffin dance minecraft|parody|best meme compilation 2020|coffin dance 1 hour|coffin dance remix|coffin dance metal|coffin dance piano|coffin dance cover|guitar|meme 2020","118289","8485","120","315","https://i.ytimg.com/vi/CXosIjlic7c/default.jpg","False","False","♫ SUBSCRIBE! ♫Have you ever wonder how THE COFFIN DANCE MEME (Dancing Pallbearers) would sound on PlayStation 1? Here it is.#Playstation#coffindance-------MY OTHER CHANNEL-------www.youtube.com/user/markthehammer-------SOCIAL LINKS-------FACEBOOK: www.facebook.com/markthehammer861' CHANNEL: www.youtube.com/markthehammerINSTAGRAM: markthehammer86TWITTER: markthehammer86-------MP3s-------MP3 ITUNES: https://goo.gl/FdTJehMP3 GOOGLE PLAY: https://goo.gl/qmLCJyMP3 SPOTIFY: https://goo.gl/NznvSi---------------------(C) 2020, Mark The Hammer.","PT1M23S"
