video_id,title,publishedAt,channelId,channelTitle,categoryId,trending_date,tags,view_count,likes,dislikes,comment_count,thumbnail_link,comments_disabled,ratings_disabled,description,duration
"6MNpUzc3c4c","SI È SPOSATO! - Cane Secco","2020-09-20T09:00:03Z","UCK3SAdbpJHiVTGo2Ug_i4SA","Cane Secco","22","20.23.09","si è sposato|marco cioni matrimonio|cane secco matrimonio|slim dogs matrimonio|cane secco si sposa|uno di noi si sposa|cane secco vlog|slim dogs vlog|cane secco casa|cane secco|slim dogs|slim dogs live|marco cioni|2020 anno peggiore","128668","12732","92","531","https://i.ytimg.com/vi/6MNpUzc3c4c/default.jpg","False","False","Marco Cioni si è sposato, ma non è il solo che ricorderà il 2020 come un grande anno.Non ci credete? Guardate il video e vi ricrederete :DLe magliette STO IN FISSA: http://bit.ly/MaglietteStoInFissaGrazie a tutti quelli che mi hanno mandato i video, eravate un sacco e non ho potuto usarli tutti.Ci vediamo settimana prossima, con un nuovo vlog e un Marco Cioni sempre sposato.Tutti i vlog settimanali: http://bit.ly/VlogCaneSeccoPlaylist#CaneSecco #Vlog #MatrimonioCOSA USO PER GIRARE I VIDEOSONY A6600: https://amzn.to/365KecWOBIETTIVO SONY SEL1018: https://amzn.to/2R5gPeSOBIETTIVO SONY SEL1655: https://amzn.to/2NDOutYCAVALLETTO: https://amzn.to/2DRruU3MICROFONO: https://amzn.to/2P62iuVGO PRO: https://amzn.to/2KIkvOxISCRIVITI AL CANALE: http://www.youtube.com/user/canesecco?sub_confirmation=1SEGUIMI ANCHE QUI:- Facebook: https://www.facebook.com/MatteoBrunoP...- Instagram: http://instagram.com/cane_secco- Twitter: https://twitter.com/cane_seccoSito SLIM DOGS: http://www.slimdogsproduction.com/","PT11M3S"
"Dfc22M7GNDg","FIFA 21 | New Celebrations Trailer","2020-09-22T15:00:08Z","UCoyaxd5LQSuP4ChkxK0pnZQ","EA SPORTS FIFA","20","20.23.09","Fifa|fifa celebrations|fifa new celebrations|fifa 21 new celebrations|fifa 21 celebrations|fifa 21 celebrations tutorial|fifa 21|fifa21|fifa 21 trailer|fifa 21 news|fifa 21 ps4|fifa 21 ps4 gameplay|fifa 21 xbox one|fifa 21 gameplay|fifa 21 pre-order|win as one|fifa 21 reveal trailer|fifa 21 release date|fifa 21 cover|fifa 21 gameplay trailer","210558","18239","1294","1311","https://i.ytimg.com/vi/Dfc22M7GNDg/default.jpg","False","False","See the new celebrations in FIFA 21 and how to pull them off in-game. Win as One in FIFA 21: http://x.ea.com/64932FIFA 21 releases October 9, 2020. Pre-order the Ultimate Edition or Champions Edition now and get three days early access! http://x.ea.com/64933Entitle for FIFA 21 on either PlayStation 4 or Xbox One before the release of FIFA 22 and upgrade your game for the equivalent next generation console (Xbox Series X or PlayStation 5) at no additional cost: http://x.ea.com/64934Subscribe to see more FIFA 21 videos: http://bit.ly/pzw4VD.#FIFA21","PT1M18S"
"l6T9xIeZTds","2020 Annual Shareholder Meeting and Battery Day","2020-09-22T23:50:10Z","UC5WjFrtBdufl6CZojX3D8dQ","Tesla","2","20.23.09","tesla|model s|model x|model 3|powerwall|electric car|elon musk|ludicrous|battery|Cypertruck|Pick-up|Truck|cybrtrk","1711256","0","0","1061","https://i.ytimg.com/vi/l6T9xIeZTds/default.jpg","False","True","Battery Day Q&A: please submit your questions here:https://app.saytechnologies.com/tesla-battery-day","PT3H18M9S"
"gXZYu16kFas","MANGIO IN UN ICE HOTEL A -10 GRADI *Esperienza ESTREMA*","2020-09-22T11:30:02Z","UC8iDKxXT8Ep1owsiYSucgWA","Giovanni Fois","24","20.23.09","mangio in un ice hotel a -10 gradi|esperienza estrema|esperienza|estrema|giovanni fois|fois|fois tesla|viaggio|food|tesla|tesla model s|europa tour|mangio in un ristorante a meno 10 gradi|mangio a meno 10 gradi|mangio in un ice hotel|hotel di ghiaccio|ice hotel|milano capo nord|milano capo nord in tesla|capo nord|tour|food tour","300289","33028","267","513","https://i.ytimg.com/vi/gXZYu16kFas/default.jpg","False","False","SCONTI bulk powders  :  http://tidd.ly/68a25c0dProdotti preferiti:  NUOVI gusti BARRETTE PROTEICHE  : https://tidd.ly/32Qccdfburro di pistacchi : https://tidd.ly/32MirQKbiscotto proteico :  http://tidd.ly/8de99a63brownie proteico: https://tidd.ly/2ZNjK03Instagram : https://www.instagram.com/giovanni_fois/?hl=itTIKTOK : http://vm.tiktok.com/auvMr4/Sony Alpha 7 iii : https://amzn.to/2PfdiIBObiettivi che uso :Sony 20mm f1.8 : https://amzn.to/34nmDHAtamron 28.75 f2.8 : https://amzn.to/33LUiXqTamron 17-28 f2.8 : https://amzn.to/2rft7ahSony Rx100 M5 : https://amzn.to/2SIjpGvMicrofono rode : https://amzn.to/2Zstbywmicrofono sony gun shot:  https://amzn.to/34UlXXI√vOggi nel tour da Milano a Capo nord in Tesla model s abbiamo fatto tappa in un ice hotel in Svezia, dove la temperatura all'interno è di -10 gradi e abbiamo creato anche un ristorante nel quale mangiare all'interno! Continua l'Europa tour","PT25M15S"
"J2AclQ0iil4","Chi ha vinto il Referendum 2020? Chi ha vinto le Regionali?","2020-09-22T18:59:29Z","UC4V3oCikXeSqYQr0hBMARwg","Breaking Italy","25","20.23.09","breakingitaly|news|notizie|informazione|intrattenimento|infotainment|mondo|referendum|regionali|amministrative|voto|italia|politica|elezioni|governatori|regioni|alessandro masala","57383","6665","71","572","https://i.ytimg.com/vi/J2AclQ0iil4/default.jpg","False","False","Grazie a UberEats per lo sponsor! --- CLICCA QUI https://ubr.to/2ROSyJle usa il codice BREAKING15 sul tuo primo ordine di minimo 20€ per avere 15€ di sconto!SUPPORTA LO SHOW! - http://www.breakingitaly.clubH E Y A - http://heyastore.com----LINK DI OGGI:Come è andata,alle regionali - https://bit.ly/2RQZx4Ialle amministrative - https://bit.ly/2ROecgVal referendum - https://bit.ly/32Ss545Chiara Appendino condannata - https://bit.ly/3hUr7Z6Fincen files -https://bit.ly/3iOUgq2https://bit.ly/3kFuTYhhttps://www.bbc.com/news/uk-54225577----CONTATTI:Twitch (Live ogni venerdì alle 19) - https://bit.ly/2V63vbvFacebook (Personale): http://on.fb.me/wq5fLbTwitter: http://bit.ly/zQtyfpInstagram: http://bit.ly/shystagramPER CONTATTARMI VIA MAIL:Per business, attività, promozioni, ads, cose così: business@breakingitaly.it (non la leggo io, ma un mio collaboratore)Per tutto il resto: breakingitaly@gmail.comQuesta la leggo io. Cerco di leggere tutto ma vi prego di andare subito al punto (no mail misteriose tipo hey posso dirti una cosa, non risponderò mai). La corrispondenza non è il mio forte ma ci provo ugualmente, quindi non offendetevi se non rispondo, ricevo un sacco di roba ed è molto difficile. Non sei tu, sono io.----ALTRO:Facebook BreakingItaly (Solo link ai video): http://on.fb.me/wmJcfv Gruppo su Facebook (gestito dalla Gentaglia) http://on.fb.me/YeGkUY#Referendum #Regionali #Elezioni","PT19M26S"
"mcx-WwalYXk","TRUCCHI DIVERTENTI PER RENDERE TUTTO PIÙ FACILE! || Consigli Utili e Idee fai-da-te da 123 GO! GOLD","2020-09-21T10:04:13Z","UCfrMhXIqeeQCaPYrE5geQgw","123 GO! GOLD Italian","24","20.23.09","123|123 go|123go|123 go gold|123gogold|123go!|123 go!|123 go! oro|123go! oro|challenge|scherzo|trucco utile|fai-da-te|creazione|progetto fai-da-te|gioco di ruolo|commedia|sketch|umorismo|risata|sketch comico|trucco|fai da te|divertente|buffo|video divertente|sketch divertente|come fare|come|tutorial|fatto a mano|fatto in casa","189169","3434","270","77","https://i.ytimg.com/vi/mcx-WwalYXk/default.jpg","False","False","Sappiamo quanto è importante il tuo cellulare, quindi abbiamo preparato alcuni utili trucchi per i veri amanti dell’Apple!Imparerai a risolvere qualsiasi problema col cellulare, come creare un dispositivo per il pacchetto delle patatine e come sopravvivere alle difficoltà con i gadget da cucina!Iscriviti a 123 GO! GOLD👑 Italian e fai clic sul campanello 🔔 per non perdere i nostri video.A presto!#123GO #GOLD #divertente #trucchettiSegnalibri:00:00 Trucchi per l’iPhone01:14 Trucchi utili con il cibo 03:10 Trucchi per il ritorno a scuola per studenti intelligenti06:37 Trucchi incredibili in cucina per principianti e professionisti10:23 Papere divertentiISCRIVITI: https://is.gd/H5xAzm----------------------------------------------------Musica di Epidemic Sound: https://www.epidemicsound.com/Materiale usato: https://www.depositphotos.com https://www.shutterstock.comQuesto video è realizzato a scopo di intrattenimento; Non ne garantiamo la completezza e l'affidabilità. Qualsiasi azione venga intrapresa è a proprio rischio e pericolo e non saremo responsabili per danni o perdite. É responsabilità dello spettatore usare giudizio, cura e precauzioni se intende replicare.Il seguente video mostra l'attività di attori professionisti in un ambiente controllato- usate precauzioni e giudizio se intendete replicare.","PT11M1S"
"pvPsJFRGleA","Justin Bieber - Holy ft. Chance The Rapper","2020-09-18T04:00:10Z","UCHkj014U2CQ2Nv0UZeYpE_A","JustinBieberVEVO","10","20.23.09","justin bieber|bieber|justin|hailey|biebs|bieber fever|holy|chance|chance the rapper|toronto|yummy|changes|purpose|holey|holyy|jbiebs|pop|music|r&B|rapper|trending|viral|ryan destiny|Wilmer Valderrama","29674225","2118992","49692","164528","https://i.ytimg.com/vi/pvPsJFRGleA/default.jpg","False","False","Holy out now: https://JustinBieber.lnk.to/HolyThe new era has begun for Justin Bieber with his first single HOLY featuring Chance the Rapper. So much more to come. Follow Justin:http://facebook.com/justinbieberhttp://twitter.com/justinbieberhttp://instagram.com/justinbieber Follow Chance:https://www.instagram.com/chancethera...https://twitter.com/chancetherapper https://www.facebook.com/chancetherap... Sign up for Justin’s newsletter: http://justinbiebermusic.comDirector - Colin TilleyProducers - Scooter Braun, Allison Kaye, Jamee Ranta, Whitney Jackson Management - SB ProjectsCinematographer - Elias TalbotProduction Designer - Brandon MendezColorist - Bryan SmallerEditor - Vinnie Hobbs  Starring: Ryan Destiny, Wilmer Valderrama #Holy #JustinBieber #ChanceTheRapper","PT5M29S"
"3mnSDifDSxQ","The Largest Star in the Universe – Size Comparison","2020-09-22T15:17:30Z","UCsXVk37bltHxD1rDPwtNM8Q","Kurzgesagt – In a Nutshell","27","20.23.09","Star|sun|largest star|space|universe|kurzgesagt app|wait but why|universe in a nutshell|earth|Jupiter|brown dwarfs|gas giant|main sequence stars|hydrogen|helium|solar system|Sirius|Beta Centauri|galaxy|R136a1|red giants|Gacrux|Pistol Star|Rho Cassiopeiae|Hypergiants|Red Hypergiants|Yellow Hypergiants|Stephenson 2-18|Saturn|bernard's star","1880390","197267","1226","14039","https://i.ytimg.com/vi/3mnSDifDSxQ/default.jpg","False","False","We created our first app ‘Universe in a Nutshell’, together with Tim Urban of Wait but Why!Appstore: http://kgs.link/universe-app-iosGoogle Playstore: http://kgs.link/universe-app-androidSources & further reading: https://sites.google.com/view/sourceslargeststarWait But Why: https://waitbutwhy.com/Video on Red Dwarfs: https://www.youtube.com/watch?v=LS-VPyLaJFM&vl=ptWhat is the largest star in the Universe? And why is it that large? And what ARE stars anyway?OUR CHANNELS▀▀▀▀▀▀▀▀▀▀▀▀▀▀▀▀▀▀▀▀▀▀▀▀▀▀German Channel: https://kgs.link/youtubeDESpanish Channel: https://kgs.link/youtubeESHOW CAN YOU SUPPORT US?▀▀▀▀▀▀▀▀▀▀▀▀▀▀▀▀▀▀▀▀▀▀▀▀▀▀This is how we make our living and it would be a pleasure if you support us!Get Merch designed with ❤ from https://kgs.link/shop  Join the Patreon Bird Army 🐧 https://kgs.link/patreon  DISCUSSIONS & SOCIAL MEDIA▀▀▀▀▀▀▀▀▀▀▀▀▀▀▀▀▀▀▀▀▀▀▀▀▀▀Reddit:            https://kgs.link/redditInstagram:     https://kgs.link/instagramTwitter:           https://kgs.link/twitterFacebook:      https://kgs.link/facebookDiscord:          https://kgs.link/discordNewsletter:    https://kgs.link/newsletterOUR VOICE▀▀▀▀▀▀▀▀▀▀▀▀▀▀▀▀▀▀▀▀▀▀▀▀▀▀The Kurzgesagt voice is from Steve Taylor:  https://kgs.link/youtube-voiceOUR MUSIC ♬♪▀▀▀▀▀▀▀▀▀▀▀▀▀▀▀▀▀▀▀▀▀▀▀▀▀▀700+ minutes of Kurzgesagt Soundtracks by Epic Mountain:Spotify:            https://kgs.link/music-spotifySoundcloud:   https://kgs.link/music-soundcloudBandcamp:     https://kgs.link/music-bandcampYoutube:          https://kgs.link/music-youtubeFacebook:       https://kgs.link/music-facebookThe Soundtrack of this video:Soundcloud:   https://bit.ly/2RutyqUBandcamp:     https://bit.ly/35HmkIa 🐦🐧🐤 PATREON BIRD ARMY 🐤🐧🐦▀▀▀▀▀▀▀▀▀▀▀▀▀▀▀▀▀▀▀▀▀▀▀▀▀▀Many Thanks to our wonderful Patreons from http://kgs.link/patreon who support us every month and made this video possible:Keanu Vestil, Xavier, Antonio Tavano, Scott James, Camfifty5, Michael, Paul Barth, Christian Puelacher, Katie Barton, Cole Bowden, Andreas Rautner, Sovos, Alejandro Uresti, couchy, Bill Hochberg, John Specht, Lander Verhack, Vlad Mustiață, Oliver Kurtz, Mischa Blazer, Josh Yelavich, Islam Mohamed, Robrecht Cannoodt, Kirsty, Greenleaves, Jayson Lamanca, Nithin Thaha, Tristan Jackson, Even_skjeih, Mo Alawami, Jonas Brandão, Lily McAdams, Alejandro Rodriguez, Isaac Overmyer, Cooper Norton, Biblion, Stephen Zappia, Bodo Nuber, Samhain, Kyle Goff, jota jodra, Marc Bornträger, Filip Leszczyński, Влад Кальченко, NexusValhalla, Aleksandar Zivancevic, Silas Zander, Tijn Flinterman, Shrutika Umralkar, Or Bairey-Sehayek, Terri-Ann dela Cruz, Choltikan Phothong, Collin Carey, Champ, Marcela Oliveira, rbtpzk, Jamie Grall, LAI Oscar, Ralf P., Kuba, Ryan Giles, JoghurtWiesel, Timster Ruu, John Highet, Walmyr Carvalho, Perry Williams, Aldo Vicente, Peter Paj, Vanny Khon, Olga, Theeraphong Gasparini, destroymyarrogance, Martin Pietrowski, Josip Haramija, Champ, Carlos, Davi & Nicholas","PT11M59S"
"Rp2l_M9Nl1E","DADI VEGETALI FATTI IN CASA | Ricetta facilissima | Cucina Botanica","2020-09-21T12:00:08Z","UC0Ng90XAT8I9PAq_tQIiMPQ","Cucina Botanica","24","20.23.09","cucina botanica|cucina vegana|ricette vegane|ricette vegetariane|dadi vegetali|dadi vegetali fatti in casa|dado fatto in casa|dado vegetale fatto in casa|dadi fatti in casa|dado ricetta|dadi ricetta|dado ricetta facile|dado fatto in casa ricetta|meal prep dado|meal prep verdure|meal prep settimanale|dado vegetale ricetta|dado vegetale|dadi|dado come farlo|dado come prepararlo|dado come è fatto|dado come si fa|dado cucina botanica|dado vegano","44599","7435","13","242","https://i.ytimg.com/vi/Rp2l_M9Nl1E/default.jpg","False","False","Si sa, i dadi possono tornare estremamente utili in cucina, ma spesso lasciano ai nostri piatti quel sapore, appunto, di dado. Nel video di oggi prepariamo i dadi vegetali fatti in casa, con una ricetta semplice e veloce: il tempo richiesto è di appena 30 minuti (più il tempo di congelamento) e sono fatti soltanto con verdure fresche, sale e olio extravergine. In questo caso il sapore sarà molto più genuino e gli ingredienti saranno solo ed esclusivamente prodotti naturali, senza addensanti o conservanti di alcun tipo. La praticità, però, sarà la stessa: con questa ricetta otterremo circa 40 dadi da conservare nel nostro freezer, pronti per essere estratti e aggiunti in pentola per ogni evenienza. I MIEI CONTATTI» Instagram: https://www.instagram.com/cucinabotanica/» Facebook: https://www.facebook.com/cucinabotanica» LinkedIn: https://www.linkedin.com/in/carlottaperego/» E-mail: cucinabotanica@artisti.show-reel.it» Indirizzo:Cucina BotanicaShow ReelVia Stresa, 620125 MilanoCUCINA BOTANICA» Il blog: https://www.cucinabotanica.com» Le ricette di Cucina Botanica: https://www.cucinabotanica.com/ricette» Entra nella community + PDF gratuito: http://bit.ly/2Ry8u4WSTRUMENTI - CUCINA» Frullatore / Mixer: https://amzn.to/2JHMn6C» Altro mixer che adoro: https://amzn.to/2BxIg8c» Impastatrice:https://amzn.to/2UQq5lX» Coltelli Zwilling: https://amzn.to/2UQpctD» Essiccatore: https://amzn.to/2TM32ZDLink in affiliazione: se acquistate questi oggetti, Amazon mi ringrazia per la vendita regalandomi una piccola percentuale. STRUMENTI - VIDEOMAKING» Macchina fotografica Canon EOS 80d: https://amzn.to/2GjaFDB» Obiettivo Canon 50mm: https://amzn.to/2DoqEMI» Obiettivo Grandangolare 10-18mm: https://amzn.to/2Mz0exJ» Macchina fotografica Sony a6000: https://amzn.to/2WVDsTz» Il mio microfono: https://amzn.to/2GjbZX5» Il mio NUOVO microfono: https://amzn.to/31AEc1E + registratore: https://amzn.to/2PfNXjB» Treppiede: https://amzn.to/2GjasAj» Joby gorillapod: https://amzn.to/2JRNl0u» Softbox: https://amzn.to/2oQnr5wLink in affiliazione: se acquistate questi oggetti, Amazon mi ringrazia per la vendita regalandomi una piccola percentuale. ALTRI VIDEO» Mangiare con 1€ http://bit.ly/35Ztgy5» 3 dolci senza zucchero http://bit.ly/2Njxk7f» 3 burger vegani http://bit.ly/2KN7uGu» Come accettare il proprio corpo http://bit.ly/2KN7uGu» Cena con ospiti vegani: menu da preparare in anticipo http://bit.ly/2LjXoMO» 5 frullati deliziosi, facili e veloci http://bit.ly/2Ymza8g» Minimalismo: come essere felici con poco http://bit.ly/2GVVr81» 5 idee per colazioni sane e semplici http://bit.ly/2Ul6Dhc» 3 cookies vegani sani, buoni e facili http://bit.ly/2TgFG1Y» Meal prep autunnale http://bit.ly/2JcLToz» Home tour http://bit.ly/2qDT02N» Cereali integrali http://bit.ly/2JhQcyJMUSICAwww.epidemicsound.comhttp://bit.ly/2BEoDvthttp://bit.ly/2o9GtTQ","PT3M26S"
"c79eVJFMYBg","I 10 Alimenti Da Evitare a Tutti i Costi Se Desideri Un Fegato Sano","2020-09-21T09:07:17Z","UC3IA7IqiL5Z4dnsLjOVoMbA","Uno Stile Di Vita Sano","26","20.23.09","Fegato e Sana Alimentazione|Dieta per il fegato|fegato alimenti da evitare|I cibi da evitare per il fegato ingrossato|corpo|Uno Stile Di Vita Sano","47494","779","36","73","https://i.ytimg.com/vi/c79eVJFMYBg/default.jpg","False","False","Nel video di oggi parleremo di cibi che distruggono il tuo fegato. Sono inclusi alcol, uvetta, cibi in scatola, carne rossa e altro ancora.Lo sapevi che i decessi per malattie epatiche in Italia hanno raggiunto 8.787 cioè l'1,63% dei decessi totali? Il tasso di mortalità ponderato per età è 6,07 per 100.000 abitanti, l'Italia è al 158 ° posto nel mondo.Il tuo fegato è uno degli organi che lavorano di più del corpo.È un filtro dell'aria, un disintossicante chimico e un serbatoio di gas per l'energia. Funziona 24 ore su 24 per assicurarti che il tuo corpo riceva i nutrienti di cui ha bisogno, proteggendoti dalle tossine che assumi durante il giorno.Altri video consigliati per te:GUARDA 🎥: Bevine Un Bicchiere Al Giorno Per 1 Settimana Per Avere La Pancia Piattahttps://www.youtube.com/watch?v=k0LXk2xDHqoGUARDA 🎥: Ecco Che Succede Se Bruci Una Foglia Di Alloro In Casa (e altri 7 usi)https://www.youtube.com/watch?v=XyIn7YxUDV4GUARDA 🎥: Questa Bevanda Segreta Ti Farà Peso Velocemente - Non è Una Dieta Rigidahttps://www.youtube.com/watch?v=hS8MkCm6J0Y#fegatoalimentidaevitareSOMMARIO:1. Zucchero             00:01:17Mangiare dolci, bibite zuccherate, caramelle e altri tipi di dolci fatti con zuccheri raffinati sono tutti fattori di rischio perché innescano malattie del fegato come la fibrosi.2. Sale                  00:01:32Troppa assunzione di sale aumenta la pressione sanguigna e il rischio di malattia del fegato grasso. È importante leggere le etichette sui prodotti che mangi per controllare la quantità di sodio aggiunto...........................................................................................Dichiarazione di non responsabilità:I materiali e le informazioni contenute nel canale Uno Stile Di Vita Sano sono forniti solo a scopo generale ed educativo e non costituiscono alcuna consulenza legale, medica o di altro tipo su qualsiasi argomento. Queste affermazioni non sono state valutate dalla FDA e non sono intese per diagnosticare, trattare o curare alcuna malattia. Cerca sempre il consiglio del tuo medico o di un altro operatore sanitario qualificato prima di iniziare qualsiasi nuova dieta o trattamento e rivolgi loro qualsiasi domanda tu possa avere riguardo una condizione medica. Se hai o sospetti di avere un problema medico, contatta immediatamente il tuo medico.","PT5M32S"
"oU6M1BLnJWM","Mamma Africana VS Mamma Napoletana","2020-09-20T11:00:25Z","UChjC39JlMc4dkti2AIosWfA","Tay Vines","24","20.23.09","Tay Vines|comedy|entertainment|niggaz be like","144046","16631","172","467","https://i.ytimg.com/vi/oU6M1BLnJWM/default.jpg","False","False","Follow me on Instagram: https://www.instagram.com/tayviines/Subscribe to my channel!!!","PT1M59S"
"4Nx9MYaRhSI","A cena da Gaggan Anand, ristorante due stelle Michelin a Bangkok - Ep. 26","2020-09-20T09:00:00Z","UCuApobilcYeWdlbhdp746RA","Cosa mangiamo oggi?","22","20.23.09","cosa mangiamo oggi|giano e franci|ristorante stellato|ristoranti stellati|ristorante stellato thailandia|cena ristorante stellato|stelle michelin|due stelle michelin|2 stelle michelin|3 stelle michelin|guida michelin|50 best restaurants|50 best restaurants asia|tailandia|tailandia turismo|viaggio in thailandia|bangkok|gaggan anand|gaggan bangkok|cibo tipico bangkok|gaggan|cosa si mangia in thailandia|cosa si mangia a bangkok|travel blog","139122","8008","75","454","https://i.ytimg.com/vi/4Nx9MYaRhSI/default.jpg","False","False","23.08.2019Ecco finalmente il video dell'esperienza più divertente e pazza che abbiamo mai fatto in un ristorante stellato.Nell'estate del 2019 abbiamo avuto la fortuna di riuscire a prenotare un tavolo in quello che è stato definito dalla classifica 50 best restaurants il migliore ristorante di Asia del 2018, insignito di due stelle Michelin, guidato dal vulcanico chef indiano Gaggan Anand: in questo video vi mostriamo l'incredibile e surreale cena che ci è stata servita.Seguiteci su:- Twitch: https://www.twitch.tv/cosamangiamooggi- Instagram: https://www.instagram.com/cosamangiamooggi- Facebook: https://www.facebook.com/GianoeFranci/Se volete supportare il canale potete effettuare una donazione qui: https://streamlabs.com/cosamangiamooggi/tip#cosamangiamooggi #ristorantestellato #foodblogger---------------------------------------------------------------Per contatti: gianoefranci@gmail.com--------------------------------------------------------------- La nostra attrezzatura: - Panasonic Lumix G DC-GH5L: https://amzn.to/2EqyPt4- Panasonic Lumix LX15: https://amzn.to/2M3VkKE- GoPro Hero 8 Black: https://amzn.to/2QfKcKi- Microfono Rode Video micro: https://amzn.to/2WYFIcF- Treppiede JOBY Kit GorillaPod 3K: https://amzn.to/2xFLzf9- Powerbank EasyAcc 20000mAh: https://amzn.to/2HKQnRR- Hard Disk esterno da viaggio Transcend 1TB: https://amzn.to/2WY7mq0- Drone Dji Mavic Mini Combo: https://amzn.to/2U2v18y","PT19M30S"
"h-1B_wf_xyw","30 ANNI SU UN'ISOLA DESERTA - Il guardiano di Budelli🌴","2020-09-21T12:00:14Z","UCCDtBHQGboy9eTvNd_KqfTA","Progetto Happiness","19","20.23.09","mauro morandi sardinia|mauro morandi arte|mauro morandi budelli|la maddalena italy|la maddalena sardinia italy|isola di budelli mauro morandi|isola di budelli custode|il guardiano di budelli|la spiaggia rosa sardegna|vivere su unisola deserta|eremita|eremita di budelli|sardegna|cosa portare su unisola deserta|vivere da solo su un isola|isola rosa in sardegna|intervista a mauro budelli|mauro morandi guardiano|il guardiano dellisola di budelli","68764","7832","38","454","https://i.ytimg.com/vi/h-1B_wf_xyw/default.jpg","False","False","Cosa ti porteresti su un'isola deserta?Di solito questa domanda è un gioco tra amici, ma per Mauro Morandi era una domanda mooolto seria. 30 anni fa ha deciso di lasciare la sua famiglia e tutto il mondo che ormai non lo rendeva più felice per vivere sull'isola deserta di Budelli. Un paradiso terrestre, famosa tanti anni fa per la sua sabbia rosa che ormai non c'è più a causa dei migliaia di turisti che l'hanno rubata. La sua missione è sempre stata quella di proteggere l'isola dall'uomo, ma ora è proprio l'uomo che vuole cacciare lui, l'unico guardiano dell'isola. Per il primo episodio dello Speciale Italia, sono andato a incontrarlo nel suo mondo per scoprire cos'è la felicità su un'isola deserta.Questa è l'incredibile storia di Mauro Morandi!🎞Editing: https://www.instagram.com/_sterno/🔥💪Se ti piace il progetto SOSTIENI IL MIO LAVORO su💪🔥🌟 PATREON - https://www.patreon.com/ProgettoHappiness 🌟🙏 DONAZIONI - https://www.paypal.me/progettohappiness 🙏👇 👇 Segui il progetto anche su 👇 👇 📸 INSTAGRAM - http://bit.ly/Instagram_PH 📸👀 TWITCH - https://bit.ly/3fbnWeI 👀👨🏽‍🎓  LINKEDIN - http://bit.ly/Linkedin_PH👩🏽‍🎓👍  FACEBOOK - http://bit.ly/Facebook_PH 👍👨‍👦‍👦 FACEBOOK GROUP - http://bit.ly/FacebookGroup_PH 👨‍👧‍👧💻  WEBSITE - http://bit.ly/ProgettoHappinessSite 💻 💌  NEWSLETTER - http://bit.ly/NewsLetterPH 💌🎧  SPOTIFY - https://spoti.fi/2BNbUK8 🎧🎥 TUTTA LA MIA ATTREZZATURA - https://amzn.to/2MO17BD 🎒🎵 LE MUSICHE DEI MIEI VIDEO - https://bit.ly/2Ysf8dY 🎵 🌎 COME CREO LE MIE GRAFICHE - https://bit.ly/2ATB49y⏱TIMESTAMPS⏱0:00 Intro1:03 La spiaggia3:00 L'incontro con Mauro3:26 Come sei arrivato sull'isola?5:10 Idee contrastanti7:00 Hai dovuto abbandonare la tua famiglia7:28 La casa di Mauro9:15 Ti senti fortunato?10:18 Le 10 domande15:58 Hai mai avuto un pensiero estremo?17:10 Il concetto di solitudine17:48 Ringraziamenti","PT18M13S"
